link,title,abstract,tag,author
https://pubmed.ncbi.nlm.nih.gov/26356209/,Developing Orthopaedic Trauma Capacity in Uganda: Considerations From the Uganda Sustainable Trauma Orthopaedic Program,"Uganda, like many low-income countries, has a tremendous volume of orthopaedic trauma injuries. The Uganda Sustainable Trauma Orthopaedic Program (USTOP) is a partnership between the University of British Columbia and Makerere University that was initiated in 2007 to reduce the consequences of neglected orthopaedic trauma in Uganda. USTOP works with local collaborators to build orthopaedic trauma capacity through clinical training, skills workshops, system support, technology development, and research. USTOP has maintained a multidisciplinary approach to training, involving colleagues in anaesthesia, nursing, rehabilitation, and sterile reprocessing. Since the program's inception, the number of trained orthopaedic surgeons practicing in Uganda has more than doubled. Many of these newly trained surgeons provide clinical care in the previously underserved regional hospitals. The program has also worked with collaborators to develop several technologies aimed at reducing the cost of providing orthopaedic care without compromising quality. As orthopaedic trauma capacity in Uganda advances, USTOP strives to continually evolve and provide relevant support to colleagues in Uganda.",,Nathan N OʼHara;Peter J OʼBrien;Piotr A Blachut
https://pubmed.ncbi.nlm.nih.gov/12838052/,Orthopaedic research and education foundation and industry,"Members of orthopaedic industry commit a significant amount of funds each year to support research and education programs that are directly related to their product(s). In addition, industry supports organizations such as the Orthopaedic Research and Education Foundation. The relationship between the Orthopaedic Research and Education Foundation and industry began in the early 1980s. The support to the Orthopaedic Research and Education Foundation from industry primarily has come in the form of unrestricted grants. These grants best can be looked at as an investment rather than a contribution. This form of giving, once called corporate philanthropy is more accurately referred to as strategic philanthropy. Members of industry make these investments to enhance their reputations, build brand awareness, market their products and services, improve employee morale, increase customer loyalty, and establish strategic alliances. The specialty of orthopaedics is among the leaders in medicine in the amount of funding raised within the specialty for research and education programs. This is because of the amount of support from members of industry and the surgeons. During the past 15 years, 40% of the annual support to the Orthopaedic Research and Education Foundation has come from industry and the balance has come from surgeons and members of lay public. Future industry support of the Orthopaedic Research and Education Foundation and other organizations within the specialty of orthopaedics will be dependent on the continued demonstration of tangible returns in areas described.",,Gene R Wurth;Judy H Sherr;Thomas M Coffman
https://pubmed.ncbi.nlm.nih.gov/3885609/,"[The significance of the scientist Prof. Bernhard Heine (1800-1846) for his age, especially for German and French orthopedics]","The professor of Orthopaedics in Würzburg, Bernhard Heine (1800-1846) nephew and successor of Johann Georg Heine (1770-1838) at the Karolinen Institute in Würzburg, is not only of significance for the history of the university in Würzburg and for the development of his subject in the German-speaking area, as has mostly been represented up until now, but he should also be seen as one of the forerunners of international cooperation in the early 19th century! From his contacts to the Académie des sciences in Paris and his two Monthyon prizes, his influence on the technology of orthopaedics, the clinic and bone physiology should be indicated by means of his osteotome.",,S Seffert
https://pubmed.ncbi.nlm.nih.gov/30413920/,The extent of pediatric orthopaedic research in low- and middle-income countries and the impact of academic collaboration on research quality: a scoping review,Introduction: This review aims to (1) assess the breadth of pediatric orthopaedic research in low- and middle-income countries (LMICs) and (2) determine the impact of academic collaboration (an LMIC and a non-LMIC investigator) in published LMIC research.,Academic collaboration; Global surgery; Low- and middle-income countries; Orthopaedics; Pediatrics; Scoping review.,John M Ibrahim;Max Liu;Hao-Hua Wu;Kushal R Patel;Amber M Caldwell;Ralph Richard Coughlin;Saam Morshed;David W Shearer
https://pubmed.ncbi.nlm.nih.gov/26049297/,Simulation in Pediatric Orthopaedic Surgery,"Surgical simulation has become an increasingly important means of improving skills acquisition, optimizing clinical outcomes, and promoting patient safety. While there have been great strides in other industries and other fields of medicine, simulation training is in its relative infancy within pediatric orthopaedics. Nonetheless, simulation has the potential to be an important component of Quality-Safety-Value Initiative of the Pediatric Orthopaedic Society of North America (POSNA). The purpose of this article will be to review some definitions and concepts related to simulation, to discuss how simulation is beneficial both for trainee education as well as value-based health care, and to provide an update on current initiatives within pediatric orthopaedic surgery.",,Donald S Bae
https://pubmed.ncbi.nlm.nih.gov/8048253/,[Prosthetics-orthotics and related surgery],"Only in German speaking countries, prosthetics/orthotics are still considered as being a part of orthopaedic surgery (and not of physical and rehabilitation medicine). Thus, patient management is an overall task for the orthopaedic surgeon from diagnostics to surgical and conservative treatment up to rehabilitation programs. This special issue is dedicated to prosthetics, orthotics and related surgery as a part of orthopaedics. It is one of the results of a '93 campaign in order to promote this specialty.",,R Baumgartner
https://pubmed.ncbi.nlm.nih.gov/26049310/,Value of Pediatric Orthopaedic Surgery,"Value has become the buzzword of contemporaneous health care reform. Value is defined as outcomes relative to costs. Orthopaedic surgery has come under increasing scrutiny due to high procedural costs. However, orthopaedic surgery may actually be a great value given the benefits of treatment. The American Academy of Orthopaedic Surgeons (AAOS) Value Project team was tasked to develop a model for assessing the benefits of orthopaedic surgery including indirect costs related to productivity and health-related quality of life. This model was applied to 5 orthopaedic conditions demonstrating robust societal and economic value. In all cost-effectiveness models, younger patients demonstrated greater cost-effectiveness given increased lifespan and productivity. This has tremendous implications within the field of pediatric orthopedic surgery. Pediatric orthopaedics may be the best value in medicine!",,Mininder S Kocher
https://pubmed.ncbi.nlm.nih.gov/28952378/,A review of translational medicine. The future paradigm: how can we connect the orthopedic dots better?,"Introduction: Patients with complex medical and surgical problems often travel great distances to prestigious university medical centers in search of solutions and in some cases for nothing more than a diagnosis of their condition. Translational medicine (TM) is an emerging method and process of facilitating medical advances efficiently from the scientist to the clinician. Most established clinicians and those in training know very little about this new discipline. The purpose of this article is to illustrate TM in varied scientific, medical and surgical fields.",3D simulation; Translational medicine; osteonecrosis; translational orthopedics; tumor localization.,Mohamed Mediouni;Daniel R Schlatterer;Henning Madry;Magali Cucchiarini;Balwant Rai
https://pubmed.ncbi.nlm.nih.gov/26047000/,Co-Management Arrangements in Orthopedic Surgery,"A co-management arrangement (CMA) is a contractual relationship between physicians and a hospital that results in a shared-responsibility management structure for a specific service line. In orthopedic surgery, CMAs are becoming increasingly popular as stakeholders in the health care market seek increased value (ie, higher-quality care at lower costs). A CMA can significantly improve the efficiency and the outcomes of a musculoskeletal service line if it adheres to the basic principles of a focus on the patient, evidence-based decision-making, physician leadership, appropriate physician compensation, transparency, reasonable and modifiable goals, and accountability. While the specifics of each CMA will vary, all CMAs have common operational elements that include the arrangement's legal structure, legal compliance, leadership and reporting structure, facilities management, personnel management, clinical data management, financial data management, and quality and effectiveness reporting.",,Brandon D Bushnell
https://pubmed.ncbi.nlm.nih.gov/16885475/,The case for patient-centered care in orthopaedics,"Now is a critical time to develop a patient-centered care model in the field of orthopaedic surgery. Patient-centered care is defined by the American Academy of Orthopaedic Surgeons as the provision of safe, effective, and timely musculoskeletal care achieved through cooperation between the orthopaedic surgeon; an informed, respected patient (and family); and a coordinated health care team. Patient-centered care, a paradigm shift from disease-centered care, is being championed by government agencies, patient advocacy groups, and insurance companies. Orthopaedic organizations must develop a comprehensive education program to provide surgeons the tools they need to navigate this paradigm shift.",,Frances A Farley;Stuart L Weinstein
https://pubmed.ncbi.nlm.nih.gov/30419592/,Fifth World Veterinary Orthopaedic Congress: An Outstanding Success,,,Kenneth A Johnson
https://pubmed.ncbi.nlm.nih.gov/14498761/,Biotherapeutics in orthopaedic medicine: accelerating the healing process?,"Musculoskeletal injuries have a significant human and financial impact on society. In particular, fractures that lead to delayed union or even nonunion represent a serious clinical challenge for which few treatment options are available. The multiple surgical procedures often needed are associated with patient morbidity and reduced quality of life. Biotechnological advances have made possible a host of potential treatments for enhancing and accelerating the repair of bone. By stimulating the body's own healing mechanisms, clinical outcomes may be improved while also containing procedural costs. Biotherapeutics may take the form of proteins, genes or cells that can be used to treat the injury. Protein biotherapeutics have received the greatest attention. Using recombinant DNA techniques, growth factors that play important roles in bone development and repair are being produced. By delivering exogenous growth factors to the site of injury in an appropriate manner, bone formation can be stimulated. Although individual proteins have been the primary focus of investigation, combinations of biomolecules can have additive, and perhaps synergistic, effects. Alternatively, genes coding for osteotropic growth factors can be delivered to the site of injury. Expression of the gene effectively results in localised delivery of the growth factor. Delivery of cells having osteogenic potential can also result in bone formation. Furthermore, it may be possible to obtain additional benefits by combining biotherapeutic approaches, such as by introducing cells genetically modified to overexpress therapeutic proteins of interest. Although biotherapeutics have great potential for stimulating bone repair, only a limited number of treatments have been approved by governmental regulatory agencies for clinical use. Bone morphogenetic activity was initially described in 1965, but not until 2001 and 2002 did two protein biotherapeutics, utilising bone morphogenetic proteins 2 and 7, receive approval for commercial distribution. Gene- and cell-based therapies are in a comparatively early stage of development.",,David Puleo
https://pubmed.ncbi.nlm.nih.gov/30097726/,Excellence in orthopaedic surgery: an overview of Nobel Prize nominees 1901-1960 with focus on Friedrich Pauwels and Gerhard Küntscher,"Purpose: This paper provides for the first time an overview of orthopaedic surgeons nominated for the Nobel Prize in physiology or medicine during the first six decades of the twentieth century. The study is part of the project ""Enacting Excellency: Nobel Prize nominations for surgeons 1901-1960"".",Adolf Lorenz; Excellence in orthopaedic surgery; Friedrich Pauwels; Gerhard Küntscher; Nobel Prize in physiology or medicine; Themistocles Gluck.,Nils Hansson
https://pubmed.ncbi.nlm.nih.gov/28375896/,American Orthopaedic Surgeons in World War I,"On April 6, 1917, the United States declared war on Germany and entered what was then called the Great War. Among the first officers sent to Europe were 21 orthopaedic surgeons in the so-called First Goldthwait Unit. Prior to the war, orthopaedics had been a nonoperative ""strap-and-buckle"" specialty that dealt primarily with infections, congenital abnormalities, and posttraumatic deformity. The Great War changed all of that forever, creating a new surgical specialty with emphasis on acute treatment, prevention of deformity, restoration of function, and rehabilitation.",,David P Green;Jesse C DeLee
https://pubmed.ncbi.nlm.nih.gov/29286953/,Co-management Strategies for Hospitals and Orthopedic and Neurosurgery Practices,"Co-management arrangements can be a very effective means of aligning physicians and their hospitals to gain care delivery efficiencies, control costs, and reduce variation in practices. In an era of value-based care delivery all aspects must be examined and the appropriate incentives put in place to reduce waste and optimize asset and resource utilization. This article will review legal considerations, define basic co-management structure and goals, and suggest examples of metrics used to achieve success.",,Scott G Tromanhauser
https://pubmed.ncbi.nlm.nih.gov/23924745/,"ICD 10: ""what orthopedic surgeons should know, how it will affect them and the cost of implementation?""","Orthopedic surgeons will be required to use ICD-10-CM codes for reimbursement and to substantiate the medical necessity for their services beginning October 1, 2014. Implementation of ICD10 will require significant changes in the clinical and administrative processes of orthopedic offices and hospital practices. As in other countries, implementation added costs and resulted in disruptions in physician practices with concomitant decreases in productivity and practice revenue. Through education and planning, orthopedic surgeons can mitigate the anticipated changes and reduce the potential impact these changes will have on their practices. Changes anticipated in the diagnostic part of the ICD10 coding system are reviewed with examples pertinent to orthopedic surgeons. Many will need to improve the accuracy and specificity of their documentation by using anatomically precise nomenclature and obtaining a more detailed history and physical examination. This will require eliciting external causes of patients' problems, the precise activity of causation, and the place of occurrence.",,M Bradford Henley
https://pubmed.ncbi.nlm.nih.gov/26762839/,Microsurgical Simulation Exercise for Surgical Training,Objective: Initial training for orthopedic surgical residents (postgraduate years 1-5) in microsurgery using the turkey wing model and evaluation of their proficiency.,Medical Knowledge; Patient Care; laboratory model; microsurgery; neurovasculature skills; training.,Lauren Beth Grossman;David E Komatsu;Marie A Badalamente;Andrew M Braunstein;Lawrence C Hurst
https://pubmed.ncbi.nlm.nih.gov/25743029/,Historical descriptions of physicians' personal pathologies,There were many instances in the history of medicine when doctors reported on their suffering from diseases or injuries and how they were managed. Orthopaedic surgery saw many examples of such self-reports. Do surgeons describe their own pathologies in the same way they do those of their patients? Also what did such self reports change in the orthopaedic practice of their times and thereafter? The aim of this paper is to review some historical self-reports in which eminent general and orthopaedic surgeons reported their own orthopaedic ailments. Many such reports broke prevalent myths and made significant changes in the orthopaedic thought and methodology.,,Mohamed Abdelghany
https://pubmed.ncbi.nlm.nih.gov/29138917/,"Level of evidence and authorship trends of clinical studies in knee surgery, sports traumatology, arthroscopy, 1995-2015","Purpose: There is increasing emphasis on publication quality and internationalization of author groups in orthopaedic literature. The purpose of this review was to evaluate the type of studies and the level of evidence (LOE) published in knee surgery, sports traumatology, arthroscopy (KSSTA) from 1995 to 2015. The secondary aim was to analyze trends in authorship characteristics in KSSTA.",,Ryan P Judy;Jason J Shin;Christopher McCrum;Olufemi R Ayeni;Kristian Samuelsson;Volker Musahl
https://pubmed.ncbi.nlm.nih.gov/16523118/,Quality of reporting of orthopaedic diagnostic accuracy studies is suboptimal,"Complete and accurate reporting of diagnostic research are essential to assess the validity of its results. To improve the quality of reporting of diagnostic accuracy studies, the Standards for Reporting of Diagnostic Accuracy (STARD) steering committee has developed a checklist of 25 items. We asked whether the quality of reporting of diagnostic accuracy studies published in three major orthopaedic journals (Clinical Orthopaedics and Related Research, Journal of Bone and Joint Surgery British Volume, and Journal of Bone and Joint Surgery American Volume) would be similar across levels of study, journals, and years of publication, and would be similar to other subspecialty journals. We identified 37 articles from 2002-2004 diagnostic accuracy studies and applied the STARD checklist and scoring system. The scores ranged from 6.6 to 21.4 with a mean of 15 +/- 3.3. Only 38% of the articles (14 of 37) reported more than 2/3 of the items, and the majority failed to report nine specific items. The mean STARD scores were similar between the studies with different levels of evidence, across the three journals, and across the three years of publication. They were similar to scores for other subspecialty journals. The current standards of reporting of diagnostic accuracy studies in orthopaedic journals are suboptimal.",,Krishna R Boddu Siva Rama;Sharmila Poovali;Sunil Apsingi
https://pubmed.ncbi.nlm.nih.gov/26333742/,"Sufficient Competence to Enter the Unsupervised Practice of Orthopaedics: What Is It, When Does It Occur, and Do We Know It When We See It? AOA Critical Issues","The goal of residency programs is to provide an educational venue with graduated responsibility and increasing levels of independence as preparation for entering the unsupervised practice of medicine. Surgical programs are required to both cultivate and convey skills pursuant to three fundamental domains: a sufficient fund of knowledge, technical competence in surgical procedures, and a degree of professionalism to enable ethical independent practice. Never before has the expectation that residency programs provide graduated responsibility in preparation for entering the unsupervised practice of medicine been so clearly articulated as it has by Nasca in the recent Accreditation Council for Graduate Medical Education (ACGME) work-hour guideline revisions. The Royal College of Physicians and Surgeons has provided similar guidance in Canada. Yet, as we progress further into the second decade of work-hour restrictions, it is unclear that we have adequately defined or can recognize the critical end points essential to trainee competency. What is clear is that we must achieve these end points in a manner different from that prior to the introduction of work-hour restrictions. We present the current state of thinking from North America and contrast this with the evolving medical educational process in the United Kingdom.",,Vincent D Pellegrini Jr;Peter C Ferguson;Richard Cruess;Sylvia Cruess;Timothy W R Briggs
https://pubmed.ncbi.nlm.nih.gov/25086132/,Ethical standards for orthopaedic surgeons,This paper offers a summary of the ethical guide for the European orthopaedic community; the full report will be published in the EFORT Journal.,,M Benson;N Boehler;M Szendroi;L Zagra;J Puget
https://pubmed.ncbi.nlm.nih.gov/27737294/,Impact of a Musculoskeletal Clerkship on Orthopedic Surgery Applicant Diversity,"Orthopedic surgery lacks racial and sexual diversity, which we hypothesized stems from absence of exposure to orthopedics during medical school. We conducted a study to determine whether diversity of matched orthopedic surgery residency applicants increased after introduction of a required third-year rotation. We compared 2 groups: precurriculum and postcurriculum. The postcurriculum group was exposed to a required 1-month musculoskeletal rotation during the third year of medical school. Comparisons were made of percentage of total students exposed to orthopedics, percentage who applied to and matched to orthopedic surgery, and proportion of women and underrepresented minorities. A prospective survey was used to determine when students chose orthopedics and what influenced their decisions. The required rotation increased the percentage of third-year students rotating on orthopedics (25%) with no change in application rate (6%). It also led to an 81% relative increase in the proportion of female applicants and a 101% relative increase in underrepresented minority applicants. According to survey data, 79% of students chose orthopedics during their third year, and 88% thought they were influenced by their rotation. A required third-year rotation exposes more medical students to orthopedics and increases the diversity of matching students.",,Daniel A London;Ryan P Calfee;Martin I Boyer
https://pubmed.ncbi.nlm.nih.gov/27448611/,Orthopedic Oncology Caseload Among Orthopedic Surgery Residents,"Despite educational focus regarding orthopedic oncology during residency, assessment of resident orthopedic oncology caseload has not been performed. The purpose of this study was to evaluate orthopedic oncology caseload trends and variation among residents. The Accreditation Council for Graduate Medical Education case log reports for orthopedic surgery residents were reviewed for graduating years 2007 to 2013. Trends in orthopedic oncology cases and variation in the median number of cases performed by residents in the 90th, 50th, and 10th percentiles of caseload were evaluated. The proportion of orthopedic oncology caseload among all cases performed by residents increased significantly (P = 0.005) from 2007 to 2013. Likewise, the mean number of adult (P = 0.002), pediatric (P = 0.003), and total orthopedic oncology cases increased significantly (P = 0.002). On average, residents in the 90th, 50th, and 10th percentiles performed 83, 28, and 3 cases, respectively. The current study demonstrates a significant increase in adult, pediatric, and total orthopedic oncology caseload. There is also evidence of substantial caseload variation among residents. Caseload variation may influence the education and technical proficiency of orthopedic residents.",Caseload; Education; Oncology; Orthopedic; Resident.,Richard M Hinds;Timothy B Rapp;John T Capo
https://pubmed.ncbi.nlm.nih.gov/19340519/,Modernising the higher surgical training in trauma and orthopaedic surgery in Ireland: taking the middle path approach,"Traditionally, the UK and Ireland have followed the same postgraduate surgical training of orthopaedic surgeons. Modernising medical careers (MMC) and European Working Time Directive (EWTD) have radically changed the way surgical training is delivered in the UK. In Ireland, however, the traditional structure of surgical training system continues with an emphasis to modernise the training with more objective assessment tools. The aim of this review is to highlight the current differences in the higher surgical training in Orthopaedics in the UK and Ireland.",,M K Sayana;M Ashraf;J O'Byrne
https://pubmed.ncbi.nlm.nih.gov/30419593/,"Rudolf ""Tass"" Dueland (1933-2018)",,,Kenneth A Johnson
https://pubmed.ncbi.nlm.nih.gov/33156213/,Online Information and Mentorship: Perspectives From Orthopaedic Surgery Residency Applicants,Introduction: Applying to orthopaedic surgery residency is competitive. Online information and mentorship are important tools applicants use to learn about programs and navigate the process. We aimed to identify which resources applicants use and their perspectives on those resources.,,Taylor M Yong;Daniel C Austin;Ilda B Molloy;Michael T Torchia;Marcus P Coe
