link,title,abstract,tag,author
https://pubmed.ncbi.nlm.nih.gov/1876458/,The history of the calcaneal fracture,"The treatment of intra-articular calcaneal fractures has been a source of controversy in the past century. Major shifts in emphasis among four broad categories of therapy--no reduction, closed reduction, open reduction, and primary arthrodesis have occurred. The historical foundations of each of these treatments are traced to the present and related to modern approaches. The evolution of classification systems and developments in understanding the pathomechanisms of these fractures are also reviewed. According to several authors, modern treatment is making increasing use of open reduction after appropriate analysis and classification by computed tomography.",,L A Crosby;P Kamins
https://pubmed.ncbi.nlm.nih.gov/25756911/,Interobserver Variability in the Measurement of Lower Leg Compartment Pressures,Objectives: To determine whether interobserver technical variations and errors in the measurement of compartment pressures may affect measurement accuracy.,,Thomas M Large;Julie Agel;Daniel J Holtzman;Stephen K Benirschke;James C Krieg
https://pubmed.ncbi.nlm.nih.gov/30358690/,Orthopaedic Care for Children: Who Provides It? How Has It Changed Over the Past Decade? Analysis of the Database of the American Board of Orthopaedic Surgery,"Background: The field of orthopaedic surgery has subspecialized over the past decade with an increasing number of graduates of orthopaedic residency programs entering fellowship training. The number of graduates from pediatric orthopaedic fellowships has also increased over the past decade. We hypothesize as the number of pediatric orthopaedic fellowship graduates has increased, the proportion of orthopaedic cases completed by pediatric surgeons in comparison with adult surgeons has also increased. We have used the database of the American Board of Orthopaedic Surgery (ABOS) to analyze the trends in who is providing the orthopaedic care for children.",,Pooya Hosseinzadeh;Mitchel R Obey;Ena Nielsen;Lindsay Andras;Gary M Kiebzak;Megan Mignemi;Jeffrey R Sawyer;Stephen Albanese;John M Flynn
https://pubmed.ncbi.nlm.nih.gov/30020134/,The General Orthopaedist: Going the Way of the Dinosaur or the Next Subspecialty?: AOA Critical Issues,"Orthopaedic specialization has increased substantially over the past several decades, partly due to the desire of residents to improve their clinical expertise and to increase the likelihood that they will obtain a position with better compensation and a more balanced lifestyle. The American Academy of Orthopaedic Surgeons (AAOS) census data support this trend, demonstrating a substantial rise in the percentage of practicing orthopaedic surgeons who identify themselves as specialists rather than as general orthopaedic surgeons. There is a perception that a more narrowed scope of practice may prevent the current orthopaedic workforce from being able to adequately care for populations in rural areas of the United States. Additional consideration should be given to clearly defining the necessary knowledge and skills of a general orthopaedist in the twenty-first century, to understanding their role in musculoskeletal care, and to reevaluating residency educational experiences relative to their ability to prepare graduates to practice general orthopaedics independently.",,Mary K Mulcahey;Keith Kenter;Kevin P Black
https://pubmed.ncbi.nlm.nih.gov/25229679/,Medical liability and orthopaedic trauma: history and current state of affairs,"Orthopaedic trauma has been associated with the history of medical liability all the way back to the dark ages and the bubonic plague. Caps on noneconomic damages and other reforms have been challenged in many states, and an innovative approach to medical liability reform must be developed within the medical profession and the various legislatures. Orthopaedic trauma surgeons have a unique perspective in that they perform a critical service to the community, however they are often deprived of the benefit of preoperative risk reduction best practices because of the critical needs of the patients. Orthopaedic trauma surgeons must advocate for effective medical liability reforms.",,Douglas W Lundy
https://pubmed.ncbi.nlm.nih.gov/26049303/,POSNA Quality Safety Value Initiative: From Vision to Implementation to Early Results,"The POSNA Quality, Safety and Value Initiative (QSVI) formally started with POSNA board approval in early 2011. The initial vision statement was: ""To lead in defining our members' value based clinical care. To partner with hospital based and orthopedic organizational efforts to guarantee safe, high quality outcomes for our patients. To communicate our initiatives and results cooperatively with payer, credentialing, and compliance organizations to improve pediatric orthopedic care in North America.""",,Peter M Waters;John M Flynn
https://pubmed.ncbi.nlm.nih.gov/28921006/,Computer aided planning of orthopaedic surgeries: the definition of generic planning steps for bone removal procedures,Purpose: An increasing number of orthopaedic surgeons are using computer aided planning tools for bone removal applications. The aim of the study was to consolidate a set of generic functions to be used for a 3D computer assisted planning or simulation.,Analysis of orthopaedic surgeries; Computer aided surgery; Generic bone removal steps; Generic planning steps; Surgical procedures.,David Putzer;Jose Luis Moctezuma;Michael Nogler
https://pubmed.ncbi.nlm.nih.gov/10697306/,Health economics and orthopaedics,"It is becoming widely accepted that research which considers only the outcome and not the costs associated with new technologies in health care, is of limited value in making decisions about the use of scarce resources. Economic evaluation is becoming a standard feature of clinical research but many published economic evaluations fall short of best practice in their methodology. We have described the essential features of economic evaluation, using published studies in orthopaedics, in order to try to improve the ability of orthopaedic surgeons to read, understand and appraise such studies critically, and to encourage them to consider including economic evaluation in future investigations.",,N Maniadakis;A Gray
https://pubmed.ncbi.nlm.nih.gov/20223075/,The use and abuse of abbreviations in orthopaedic literature,Introduction: Abbreviations are commonly used in medical literature. Their use has been associated with medical errors and they can be a source of irritation and misunderstanding. There are strict guidelines for their use. This study analysed the use of abbreviations in orthopaedic literature and compared adherence with guidelines in a general orthopaedic and spinal journal. It also examined orthopaedic professionals' understanding of abbreviations.,,Michael J Kilshaw;Jemma Rooker;Ian J Harding
https://pubmed.ncbi.nlm.nih.gov/19052827/,The expert witness in medical malpractice litigation,"Physicians may find serving as an expert witness to be interesting, intellectually stimulating, and financially beneficial. However, potential expert witnesses should be aware of the increased legal scrutiny being applied to expert witness testimony in medical malpractice litigation. In the past, expert witnesses received absolute immunity from civil litigation regarding their testimony. This is no longer the case. Expert witnesses may be subject to disciplinary sanctions from professional organizations and state medical boards. In addition, emerging case law is defining the legal duty owed by the expert witness to the litigating parties. Orthopaedic surgeons who serve as expert witnesses should be familiar with the relevant Standards of Professionalism issued by the American Academy of Orthopaedic Surgeons.",,B Sonny Bal
https://pubmed.ncbi.nlm.nih.gov/29752505/,Jean-Louis Petit (1674-1750): a pioneer anatomist and surgeon and his contribution to orthopaedic surgery and trauma surgery,"Purpose: The purpose of this review is to summarize the life and work of Jean-Louis Petit, his inventions, his discoveries, and his impact on the evolution of surgery of his era.",Amputation; History of surgery; Invention of tourniquet; Jean-Louis Petit; Orthopaedics; Trauma surgery.,Konstantinos Markatos;Georgios Androutsos;Marianna Karamanou;Georgios Tzagkarakis;Maria Kaseta;Andreas Mavrogenis
https://pubmed.ncbi.nlm.nih.gov/28489714/,Feasibility of and Rationale for the Collection of Orthopaedic Trauma Surgery Quality of Care Metrics,"Introduction: Reproducible metrics are needed to evaluate the delivery of orthopaedic trauma care, national care, norms, and outliers. The American College of Surgeons (ACS) is uniquely positioned to collect and evaluate the data needed to evaluate orthopaedic trauma care via the Committee on Trauma and the Trauma Quality Improvement Project.",,Anna N Miller;Rosemary Kozar;Philip Wolinsky
https://pubmed.ncbi.nlm.nih.gov/10630805/,Hyphenated-history: the Kocher-Langenbeck surgical approach,"The language spoken by orthopaedic surgeons is filled with eponyms. In orthopaedics, perhaps more than any other medical specialty, we speak cryptically to one another using code words and other secret language. Certain hyphenated eponyms are of particular interest because they pique one's curiosity as to how these people came to be partners in orthopaedic history. In this paper, we offer some bits of orthopaedic hyphenated-history, outlining the pertinent work of Theodor Kocher and Bernhard von Langenbeck, as well as associated background information. These two surgeons are linked through a common hyphenated eponym in orthopaedic surgery: the Kocher-Langenbeck surgical approach, a well-known posterior approach to the proximal femur and acetabulum.",,C T Mehlman;L Meiss;T G DiPasquale
https://pubmed.ncbi.nlm.nih.gov/22814740/,Nonoriginal Malappropriate Eponymous Nomenclature: examples relevant to paediatric orthopaedics,"Eponyms are widely used in medicine and their use has been the subject of much debate recently. Advocates stress their historical significance, their ability to simplify complex terminology and their addition of character to science. Opponents cite the controversy among those eponyms and highlight the lack of both scientific and historical accuracy. The law of Nonoriginal Malappropriate Eponymous Nomenclature (NOMEN) suggests that no phenomenon is named after the individual(s) who originally described it. We aimed to determine whether this law is applicable to various clinical conditions and signs relevant to paediatric orthopaedics. We selected a series of 10 eponyms and performed a thorough literature review. In all cases, a description was identified preceding that from whom the disease received its eponymous name. We were also able to identify what we believe to be the earliest recorded description of each disease and sign. Our examples confirm the law of NOMEN in the field of paediatric orthopaedics. We suggest that irregularities in the descriptions and meanings of eponyms are identified and updated.",,Nick Aresti;Manoj Ramachandran
https://pubmed.ncbi.nlm.nih.gov/9402217/,Hyphenated history: the Hueter-Volkmann law,"The language that orthopedic surgeons speak is filled with eponyms. Perhaps more than any other medical specialty, we speak cryptically to one another using code words and secret language. Certain hyphenated eponyms are particularly interesting, because they pique one's curiosity as to how these persons came to be partners in orthopedic history. We will offer some bits of orthopedic hyphenated history, outlining the pertinent work of the respective authors as well as associated background information. This paper focuses on the Hueter-Volkmann law, an important orthopedic concept concerning bone growth. This law bears the names of the two men credited with enunciating and popularizing it, Carl Hueter and Richard von Volkmann.",,C T Mehlman;A Araghi;D R Roy
https://pubmed.ncbi.nlm.nih.gov/26447414/,Business and Practice Management Knowledge Deficiencies in Graduating Orthopedic Residents,"We conducted a study to determine the general level of knowledge that orthopedic residents have on business and practice management topics at graduation and to evaluate the level of knowledge that practicing orthopedic surgeons need in order to function effectively in a medical practice. Residency graduates from a single training program were asked to complete a survey that gathered demographic information and had surgeons rate their understanding of 9 general business and practice management skills and the importance of these skills in their current practice situation. The amount of necessary business knowledge they lacked at graduation was defined as a functional knowledge deficiency (FKD) and was calculated as the difference between the reported importance of a topic in current practice and the level of understanding of that topic at graduation (larger FKD indicates greater deficiency). Those in physician-managed practices reported significantly higher levels of understanding of economic analytical tools than those in nonphysician-managed practices. There were no other statistically significant differences among groups. Hospital-employed physicians had the lowest overall FKD (4.0), followed by those in academic practices (5.1) and private practices (5.9). Graduating orthopedic surgeons appear to be inadequately prepared to effectively manage business issues in their practices, as evidenced by the low overall knowledge levels and high FKDs.",,D Joshua Miller;Thomas W Throckmorton;Frederick M Azar;James H Beaty;S Terry Canale;David R Richardson
https://pubmed.ncbi.nlm.nih.gov/10818976/,The history of the Campbell Clinic,"The history of the Campbell Clinic is deeply seated in the accomplishments of Dr. Willis Cahoon Campbell. At the age of 26 he decided to live in Memphis and become an orthopaedic surgeon. At the time Memphis was growing rapidly and orthopaedic surgery was evolving as a surgical specialty. These conditions provided him with the opportunity to do many things that were visionary. He established the Campbell Clinic and the orthopaedic department of the medical school and aided in founding hospitals and clinics for private patients and patients who were indigent. His major contributions to the field of orthopaedics include the recruitment of outstanding associates who would follow and build on his high standards of performance, the establishment of an outstanding residency program, the publication of Campbell's Operative Orthopaedics, and providing leadership for many orthopaedic surgeons. It can be said without reservation that Campbell and the early staff members played an important role in the growth of orthopaedic surgery essentially from its infancy and into the second half of the century. The legacy of excellence that Campbell and all the members of the staff established has continued to be the hallmark of the Campbell Clinic.",,R A Calandruccio
https://pubmed.ncbi.nlm.nih.gov/19949127/,Competencies for a Canadian orthopaedic surgery core curriculum,"We have developed a list of 281 competencies deemed to be of importance in the training of orthopaedic surgeons. A stratified, randomised selection of non-university orthopaedic surgeons rated each individual item on a scale 1 to 4 of increasing importance. Summary statistics across all respondents were given. The mean scores and sds were computed. Secondary analyses were computed in general orthopaedics, paediatrics, trauma and adult reconstruction. Of the 156 orthopaedic surgeons approached 131 (84%) responded to the questionnaire. They rated 240 of the 281 items greater than 3.0 suggesting that competence in these was necessary by completion of training. Complex procedures were rated to be less important. The structure, delivery and implementation of the curriculum needs further study. Learning activities are 'driven' by the evaluation of competencies and thus competency-based learning may soon be in the forefront of training programmes.",,V M R Wadey;P Dev;R Buckley;D Walker;D Hedden
https://pubmed.ncbi.nlm.nih.gov/26255057/,"Nicholas J. Giannestras (1908-1978): a distinguished orthopaedic surgeon, his work, life and times","The purpose of our study was to summarize all the knowledge concerning the innovative pioneer in the field of orthopaedic surgery, Nicholas J. Giannestras (1908-1978). A thorough study of texts, medical books and reports, in the field of history of medicine, together with a review of the available literature in PubMed, was undertaken. Giannestras left his mark in the history of orthopaedics with his clinical work and his publications, mainly his treatise ""Foot Disorders: Medical and Surgical Management"" (1973), while his name lingers in Greece with the introduction of spine fusion with the use of metallic implants. He was an eminent university clinical professor of orthopaedics who had harmonically combined academic writing, teaching and clinical research in every field of orthopaedic surgery.",Foot surgery; Giannestras; Orthopaedics; School-screening; Spine surgery.,Konstantinos Markatos;Nikolaos Efstathopoulos;Kiriaki Maria Kaseta;Vasileios Nikolaou;Gregory Tsoucalas;Markos Sgantzos
https://pubmed.ncbi.nlm.nih.gov/14575261/,The Vienna heritage of Iowa orthopaedics,"Strong traditions of basic research, clinical innovation, teaching and integrating science and evaluation of outcomes into clinical practice have characterized University of Iowa orthopaedics for ninety years. These traditions were brought to Iowa City from Vienna when Iowa City was a town of fewer than 10,000 people in a sparcely populated rural state. In the last third of the 19th century, surgeons at the University of Vienna, led by Theodore Billroth (1829-1894), helped transform the practice of surgery. They developed new more effective procedures, analyzed the results of their operations, promoted the emergence and growth of surgical specialties and sought understanding of tissue structure, physiology and pathophysiology. Their efforts made Vienna one of the world's most respected centers for operative treatment, basic and clinical research and surgical education. Two individuals who followed Billroth, Eduard Albert (1841-1900) and Adolf Lorenz (1854-1946) focussed their research and clinical practice on orthopaedics. Their successes in the study and treatment of musculoskeletal disorders led one of their students, Arthur Steindler (1878-1959), a 1902 graduate of the Vienna Medical School, to pursue a career in orthopaedics. Following medical school, he worked in Lorenz's orthopaedic clinic until 1907 when he joined John Ridlon (1852-1936) at the Chicago Home for Crippled Children. In 1910, Steindler became Professor of Orthopaedics at the Drake Medical School in Des Moines, Iowa, and, in 1913, John G. Bowman, the President of the University of Iowa, recruited him to establish an orthopaedic clinical and academic program in Iowa City. For the next third of a century he guided the development of the University of Iowa Orthopaedics Department, helped establish the fields of orthopaedic biomechanics and kinesiology and tirelessly stressed the importance of physiology, pathology and assessment of the outcomes of operations. From the legacy of Billroth, Albert and Lorenz, Arthur Steindler created an internationally recognized center for orthopaedic care, research and teaching in Iowa City.",,Joseph A Buckwalter
https://pubmed.ncbi.nlm.nih.gov/31107336/,What Proportion of Women Who Received Funding to Attend a Ruth Jackson Orthopaedic Society Meeting Pursued a Career in Orthopaedics?,"Background: Orthopaedic surgery has the lowest percentage of women residents and faculty of any medical and surgical specialty. Diversity in medicine has been shown to improve patient outcomes and satisfaction. Although some scholarships are designed to increase the exposure of women medical students to orthopaedic surgery, the impact of those scholarships is largely unknown.",,Sravya Vajapey;Lisa K Cannada;Julie Balch Samora
https://pubmed.ncbi.nlm.nih.gov/30223410/,Dynamics of an orthopaedic team: Insights to improve teamwork through a design thinking approach,"Background: Supporting teamwork in healthcare is a way to foster both the quality and safety of care, and better working conditions for all the team members. Although increasing attention is paid to this topic on a general level, there is less knowledge about its unfolding in orthopaedic units and its translation to interventions.",Team interactions; design thinking; healthcare design; hospital wards; learning history.,E Caprari;J T Porsius;P D'Olivo;R M Bloem;S B W Vehmeijer;N Stolk;M Melles
https://pubmed.ncbi.nlm.nih.gov/19234892/,From evidence to action: Understanding clinical practice guidelines,"Good guidelines will help us to take evidence into practice. In a survey among Dutch orthopedic surgeons, development and use of evidence-based guidelines was perceived as one of the best ways of moving from opinion-based to evidence-based orthopedic practice. The increasing number of guidelines means that knowing how to make a critical appraisal of guidelines is now a key part of every surgeon's life. This is particularly true because guidelines use varying systems to judge the quality of evidence and the strength of recommendations. In this manuscript we discuss what a guideline is, where we can find guidelines, how to evaluate the quality of guidelines, and finally provide an example on the different steps of guideline development. Thus, we show that good guidelines are a summary of the best available evidence and that they provide a graded recommendation to help surgeons in evidence-based practice.",,Rudolf W Poolman;Cees C P M Verheyen;Gino M Kerkhoffs;Mohit Bhandari;Holger J Schünemann;International Evidence-Based Orthopedic Surgery Working Group
https://pubmed.ncbi.nlm.nih.gov/11315802/,Teaching professionalism in orthopaedic residency,"Two residents, wearing white coats with their names and ""Department of Orthopaedics"" conspicuously embroidered on them, boarded a hospital elevator crowded with physicians, employees, and visitors. In a clearly audible voice, one resident began a story: ""You should have seen the patient I saw in my clinic the other day. She was beautiful. I should send her to see Dr. W. He would love to see her!"" This comment drew the undivided attention of everyone in the elevator and cast a ghastly silence over the rest of the ride. In recent years, interest has expanded regarding professionalism and its importance in medicine and surgery. Orthopaedic surgery is no exception, as the topic has recently reached prominence in our literature and policies. It is unlikely that professionalism is a universal and innate characteristic of college students entering medical school, yet it becomes a necessary value in medical practice. Somewhere in the ongoing process of medical education, the issue must be addressed.",,R Cornwall
https://pubmed.ncbi.nlm.nih.gov/24132369/,Orthopaedic fellowship selection criteria: a survey of fellowship directors,"Background: The pursuit of a fellowship has become increasingly popular over the past several years, with &gt;90% of graduating orthopaedic residents applying for a fellowship position. Despite the ample literature available pertaining to the selection of orthopaedic residents, there is no similar research for the selection of fellows.",,Gregory Grabowski;Justin W Walker
https://pubmed.ncbi.nlm.nih.gov/26049306/,"POSNA Quality, Safety, Value Initiative 3 Years Old and Growing Strong. POSNA Precourse 2014","The purpose of this paper is to summarize the Pediatric Orthopaedic Society of North America (POSNA) quality, safety, and value initiative (QSVI). Specifically, it will outline the history of the program, describe typical quality improvement techniques, and how they differ from traditional research techniques, and, finally, describe some of the many projects completed, currently underway, or in planning for POSNA QSVI.",,James J McCarthy;Evaline A Alessandrini;Pamela J Schoettker
https://pubmed.ncbi.nlm.nih.gov/27713071/,Evaluation of the orthopaedics and traumatology resident education in Turkey: A descriptive study,"Objective: The objective of this study is to describe the current situation regarding the training, working conditions, future plans, fields of interest and satisfaction of orthopaedics and traumatology residents in Turkey.",Feedback; Orthopaedics; Resident; Residents' training; Survey.,Gazi Huri;Yusuf Sertan Cabuk;Safa Gursoy;Mustafa Akkaya;Secil Ozkan;Volkan Oztuna;Onder Aydingoz;Alparslan Senkoylu
https://pubmed.ncbi.nlm.nih.gov/27443131/,Hospitalist Co-management of Pediatric Orthopaedic Surgical Patients at a Community Hospital,"Purpose: The benefits of hospitalist co-management of pediatric surgical patients include bettering patient safety, decreasing negative patient outcomes, providing comprehensive medical care, and establishing a dedicated resource to patients for postoperative care. The purpose of this study was to characterize the nature of patients co-managed by a pediatric hospitalist. The authors hypothesize that hospitalist co-management is safe and efficacious in pediatric orthopaedic surgical patients who are admitted to a community hospital.",,Karan Dua;William C McAvoy;Sybil A Klaus;David I Rappaport;Rebecca E Rosenberg;Joshua M Abzug
