link,title,abstract,tag,author
https://pubmed.ncbi.nlm.nih.gov/29499666/,Nanotechnology in orthopedics: a clinically oriented review,"The utility of nanotechnology in medicine, specifically within the field of orthopedics, is a topic of extensive research. Our review provides a unique comprehensive overview of the current and potential future uses of nanotechnology with respect to orthopedic sub-specialties. Nanotechnology offers an immense assortment of novel applications, most notably the use of nanomaterials as scaffolds to induce a more favorable interaction between orthopedic implants and native bone. Nanotechnology has the capability to revolutionize the diagnostics and treatment of orthopedic surgery, however the long-term health effects of nanomaterials are poorly understood and extensive research is needed regarding clinical safety.",,Walter Ryan Smith;Parke William Hudson;Brent Andrew Ponce;Sakthivel Rajan Rajaram Manoharan
https://pubmed.ncbi.nlm.nih.gov/33463450/,Nanotechnology-based drug delivery systems in orthopedics,"In recent years, nanotechnology has led to significant scientific and technological advances in diverse fields, specifically within the field of medicine. Owing to the revolutionary implications in drug delivery, nanotechnology-based drug delivery systems have gained an increasing research interest in the current medical field. A variety of nanomaterials with unique physical, chemical and biological properties have been engineered to develop new drug delivery systems for the local, sustained and targeted delivery of drugs with improved therapeutic efficiency and less or no toxicity, representing a very promising approach for the effective management of diseases. The utility of nanotechnology, particularly in the field of orthopedics, is a topic of extensive research. Nanotechnology has a great potential to revolutionize treatment, diagnostics, and research in the field of orthopedics. Nanophase drug delivery has shown great promise in their ability to deliver drugs at nanoscale for a variety of orthopedic applications. In this review, we discuss recent advances in the field of nanostructured drug delivery systems for orthopedic applications.",,Eylem Güven
https://pubmed.ncbi.nlm.nih.gov/30390985/,Orthopedic Surgery and the Geriatric Patient,"As more patients live longer, it is probable that an increasing number of geriatric patients will require surgery. An organized, systematic, coordinated, multidisciplinary approach to the perioperative management of these patients will result in fewer complications, improved outcomes, and reduced cost of care. Details are herein provided on the preoperative diagnostic evaluation and assessment as well as perioperative care provided to optimize outcomes. The diagnosis, workup, and treatment of osteoporosis and fragility fractures are presented. The article concludes with a review of the care of the geriatric orthopedic patient in the posthospital time period.",Comanagement; Falls; Fragility fracture; Geriatric patient; Orthopaedic surgery; Orthopedic surgery; Osteoporosis.,Alexander S Greenstein;John T Gorczyca
https://pubmed.ncbi.nlm.nih.gov/31084836/,Racial Diversity in Orthopedic Surgery,"Data from the US Census Bureau, the Accreditation Council for Graduate Medical Education, and the American Academy of Orthopaedic Surgeons reveal that orthopedic surgery is the least diverse of any surgical specialty and that diversity within orthopedics is not improving. Considerable data from both medicine and business suggest that improving diversity within the orthopedic surgery specialty would be of significant benefit to the orthopedic surgery profession and to patients. Multiple avenues for increasing diversity exist, including large-scale pipeline programs as well as personal and institutional efforts examining biases and decision-making processes.",Diversity; Ethnic diversity; Racial diversity; Representation.,Rey N Ramirez;Corinna C Franklin
https://pubmed.ncbi.nlm.nih.gov/30064451/,Top orthopedic sports medicine procedures,"Orthopedic sports medicine is a subspecialty of Orthopedics that focuses on managing pathological conditions of the musculoskeletal system arising from sports practice. When dealing with athletes, timing is the most difficult issue to face. Typically, athletes aim to return to play as soon as possible and at the pre-injury level. This means that management should be optimized to combine the need for prompt return to sport and to the biologic healing time of the musculo-skeletal. This poses a great challenge to sport medicine surgeons, who need to follow with attention to the latest scientific evidence to offer their patients the best available treatment options. We briefly review the most commonly performed orthopedic sports medicine procedures, outlining the presently available scientific evidence on their indications and outcomes.",Ankle instability; Anterior cruciate ligament; Meniscus; Orthopedic sports injury; Posterior cruciate ligament; Rotator cuff; Shoulder instability.,Sebastiano Vasta;Rocco Papalia;Erika Albo;Nicola Maffulli;Vincenzo Denaro
https://pubmed.ncbi.nlm.nih.gov/31524590/,"Orthopedics and Traumatology Residency - Working Conditions, Training, and Psychological Stress","PURPOSE OF THE STUDY The specialty of orthopedics and traumatology that is completed in the 5 years period in our country is a challenging educational process and our purpose in this study is to demonstrate through a survey training conditions of the orthopedic assistants in our country and the effects of this process on assistants. MATERIAL AND METHODS 524 (70.05%) of 748 assistants who receive specialization training in Turkey were reached. There were 20 multiple choice questions ( 1 mark each) and 3 questions (more than 1 mark each) in the survey consisting of twenty-three questions. Our study group was formed by doctors who have still worked as assistant in our country and have accepted to participate in the study. The doctors who finished assistantship with any reason and did assistantship for time less than 6 months and did not exactly fill the questionnaire form were excluded from the study. RESULTS 524 (71.97%) of 728 assistant who are in 40 (100%) of 40 provinces where assistant training given in Turkey were reached. 474 (90.45%) participants were satisfied to do orthopedic specialization. When considering working hours, it was observed that 337 (64.31%) participants had over 90 hours weekly including night shift and 521 (99.42%) participants had to work after night shift. The majority of participants (361 persons 68.89%) were receiving salaries between TL 4000-6000. When looking at the entire working group, the rate of participants who said that scientific training is weak or there is no scientific training was 427 (81.48%). CONCLUSIONS Our survey study is one of the first statistical study which investigating professional and social problems of orthopedic assistants. Some of important problems as training satisfaction, abuse by patients and/or manager, the average monthly income and psychological status assessment is emphasized. Orthopedics and Traumatology assistantship is a challenging process to cause physical and psychological problems with the hard working conditions in our Turkey. Key words:residency training, orthopedic surgery, life quality, salary.",,B Gülenç;S Yalçin;S Sürücü;M Mahiroğullari;M Erdil;M Bülbül
https://pubmed.ncbi.nlm.nih.gov/31084833/,Pediatric Orthopedic Workforce: A Review of Recent Trends,"Pediatric orthopedic surgery has changed in many ways over the past 2 decades. Member surveys and recent literature confirm that there has been a sustained balance of interest and opportunity in growth of applicant numbers and fellowship spots. Pediatric orthopedics is leading the way in gender diversity in orthopedics. Concerns of competition are valid and appear to be rising; however, case load data suggest that with increased training of pediatric orthopedists, there seems to be an adequate increase in cases. Periodic workforce analysis should continue to gauge any changes in attitudes or monitor concerns of competition.",POSNA; Pediatric orthopedic surgery; Sports medicine; Workforce.,Arya Minaie;Maksim A Shlykov;Pooya Hosseinzadeh
https://pubmed.ncbi.nlm.nih.gov/16841792/,Damage-control orthopedics: evolution and practical applications,"Evaluation and management of patients who sustain blunt trauma with multiple injuries have changed significantly over the past 50 years. Initially, clinical research supported delayed definitive treatment of the orthopedic subset of injuries in these patients. With the advancement of splinting and fixation techniques, this view changed to one of ""early total care."" Current developments in classifying trauma patients at risk for deterioration (objective scoring scales) and understanding the posttraumatic immune response have allowed us to stratify patients' clinical severity and treat appropriately. The damage-control philosophy proposes early stabilization, resuscitation, and delayed definitive treatment for polytrauma patients with orthopedic injuries who are most at risk.",,Nicholas Renaldo;Kenneth Egol
https://pubmed.ncbi.nlm.nih.gov/29685787/,Mentorship in Orthopedics: A National Survey of Orthopedic Surgery Residents,"Objective: Mentorship is an important component of graduate medical education. It has been associated with numerous benefits including personal development, increased career satisfaction, and reduced stress and burnout. The purpose of this study was to assess orthopedic resident attitudes regarding mentorship and to determine if there were sociodemographic differences.",Practice-Based Learning and Improvement; burnout; graduate medical education; mentorship; orthopedics; residency.,Lasun O Oladeji;Brent A Ponce;John R Worley;James A Keeney
https://pubmed.ncbi.nlm.nih.gov/29701089/,Does virtual reality simulation have a role in training trauma and orthopaedic surgeons?,"Aims: The aim of this study was to assess the current evidence relating to the benefits of virtual reality (VR) simulation in orthopaedic surgical training, and to identify areas of future research.",Arthroscopy; Learning curve; Simulation; Surgical training; Validity; Virtual reality.,J D Bartlett;J E Lawrence;M E Stewart;N Nakano;V Khanduja
https://pubmed.ncbi.nlm.nih.gov/31932218/,"The Times, They Are A-Changing: Women Entering Academic Orthopedics Today Are Choosing Nonpediatric Fellowships at a Growing Rate","Objective: Pediatrics and hand surgery have historically been the orthopaedic subspecialties with the highest female representations. We sought to identify the gender distribution of orthopedic surgical faculty by subspecialty, geography, and educational background. We hypothesized that the proportion of women entering pediatric orthopaedics has decreased since 1980.",faculty; fellowship; gender; orthopedics; pediatrics; specialties.,Walter Klyce;Derek T Nhan;Alexandra M Dunham;Mostafa H El Dafrawy;Claire Shannon;Dawn M LaPorte
https://pubmed.ncbi.nlm.nih.gov/30178107/,[10 years German Society for Orthopedics and Trauma Surgery (DGOU): trauma surgery-quo vadis?],"On the occasion of the 10th anniversary of the foundation of the German Society for Orthopedics and Trauma Surgery (DGOU), the current General Secretary of the German Society for Trauma Surgery sees the need for a standpoint on trauma surgery in Germany. This manuscript outlines future options and perspectives for the development of trauma surgery in Germany.",German Society for Orthopedics and Trauma Surgery; German Trauma Society; Germany; Perspectives; Trauma surgery.,R Hoffmann;D Pennig
https://pubmed.ncbi.nlm.nih.gov/28286926/,Informal (Hallway) medical consultation in orthopedics-is it as common as it seems?,"Introduction: Informal (hallway) medical consultation is an integral part of the physician's work. As musculoskeletal complaints are very common, orthopedic surgeons stand in the frontline of this practice. Many of these consultations are poorly, if at all, documented, thus imposing a potential medical danger to the patient and a medicolegal danger to the surgeon. We conducted this first study to examine whether this practice is common among the orthopedic surgeons in university hospital.",Informal consultation.,Leonid Kandel;Yair Barzilay;Adi Friedman;Idan Ilsar;Ori Safran;Yoav Mattan
https://pubmed.ncbi.nlm.nih.gov/31786992/,Augmented reality in orthopaedics: a systematic review and a window on future possibilities,"Aims: Computer-based applications are increasingly being used by orthopaedic surgeons in their clinical practice. With the integration of technology in surgery, augmented reality (AR) may become an important tool for surgeons in the future. By superimposing a digital image on a user's view of the physical world, this technology shows great promise in orthopaedics. The aim of this review is to investigate the current and potential uses of AR in orthopaedics.",Augmented reality; Head-up display; Orthopaedic.,Carl Laverdière;Jason Corban;Jason Khoury;Susan Mengxiao Ge;Justin Schupbach;Edward J Harvey;Rudy Reindl;Paul A Martineau
https://pubmed.ncbi.nlm.nih.gov/24708703/,Medical photography: principles for orthopedics,"Background: Medical photography is used clinically for patient evaluation, treatment decisions, and scientific documentation. Although standards for medical photography exist in many branches of medicine, we have not encountered such criteria in publications in the area of orthopedics.",,Metin Uzun;Murat Bülbül;Serdar Toker;Burak Beksaç;Adnan Kara
https://pubmed.ncbi.nlm.nih.gov/24836166/,Is orthopedics more competitive today than when my attending matched? An analysis of National Resident Matching Program data for orthopedic PGY1 applicants from 1984 to 2011,Objective: This study evaluated supply and demand trends for orthopedic postgraduate year 1 (PGY1) positions from 1984 to 2011 for the purpose of estimating national intercandidate competition over time.,Interpersonal and Communications Skills; Medical Knowledge; NRMP; Professionalism; match; orthopedics; residency.,Jonathan M Karnes;Joel L Mayerson;Thomas J Scharschmidt
https://pubmed.ncbi.nlm.nih.gov/31974642/,"Indian orthopaedics: the past, present, and future",The editorial summarizes the Indian orthopaedic history in brief and provides an overview of the articles to be published in the Indian traumatology edition.,Orthopedics; SICOT; Trauma.,Ashok S Gavaskar;C Mauffrey;S Babhulkar
https://pubmed.ncbi.nlm.nih.gov/7631272/,[Orthopedics and time],"We can see into the future because we stand on the shoulders of giants. Descartes thought that the human body functioned like clock-work, but orthopaedic surgeons today know better. Man's life expectancy has increased, but has quality of life kept pace? The right moment is only a short instant. To await and then grasp it is part of the art of orthopaedics. But to reduce time to the present moment is to annihilate it. Time is the all-important fourth dimension which allows for change and thus for life.",,B Rüttimann
https://pubmed.ncbi.nlm.nih.gov/29717889/,Robotics in trauma and orthopaedics,Recent advances and review of literature,,Karthik Karuppiah;Joydeep Sinha
https://pubmed.ncbi.nlm.nih.gov/32307052/,The Intersection of Hand Surgery Practice and Industry,This article focuses on the working relationship between practicing hand surgeons and company representatives. The basic job of reps is to influence surgeon behavior to use their products. Surgeons must make certain that nothing of value is received in a quid pro quo for using industry products. Physicians have an ethical obligation to only use industry devices that are in the best interests of their patients. Hand surgeons may become involved in product development and thereby come into contact with industry. Several key steps are required to protect any intellectual property surgeons develop in their interactions with industry.,Commercialization; Implants; Industry; Intellectual property; Products.,Arnold-Peter C Weiss
https://pubmed.ncbi.nlm.nih.gov/9623223/,[One hundred years of orthopedics in the Netherlands. VII. biomaterials],"The use of biomaterials in orthopaedics is becoming increasingly important. They are widely used in artificial joints, as bone replacement material and as resorbable material. Also (recombinant) bone morphogenetic proteins are used. Classification of biomaterials is based on composition (animal or human tissue, metals, polymers, ceramics or composites) or on biological reactions after implantation (bio-inert, bio-tolerant or bio-active). Depending on location and function biomaterials have to meet requirements with respect to durability (artificial joints), fixation (total hip prosthesis), flexibility (artificial ligaments), solubility (suture wire) and stiffness (plates and screws). The development of biomaterials is in full swing, focussing on the decrease of wear and the increase of durable fixation of artificial joints, and the induction of cells to form bone and cartilage tissue.",,I C Heyligers;W J Dhert;S K Bulstra
https://pubmed.ncbi.nlm.nih.gov/29876629/,The beginnings of orthopaedics in Romania,"Aim of the study: To offer a glimpse into the orthopaedic practice in Romania during the nineteenth century and the first decades of the twentieth century, corresponding to a period when this surgical specialty was defining itself.",Alexandru Radulescu; Carol Davila; Constantin Dumitrescu Severeanu; Ernest Juvara; Ioan (Ion) Ghiulamila; Ion (Iancu) Jianu; Orthopedic heritage; Romanian orthopaedic surgery; Romanian surgeons; Romanian surgery; Themistocle Gluck; Theodor Firica.,Dan V Poenaru;Manuel D Oprea
https://pubmed.ncbi.nlm.nih.gov/22426935/,Smartphones in orthopaedics,"With the introduction of the European Working Time Directive, surgical trainees are facing limited training opportunities and doctors are required to maximise their training opportunities. Smartphone sales have been rapidly increasing over the last five years and can be used as a training tool for the orthopaedic trainee and surgeon. Common uses include applications (AO, eLogbook and PubMed), Ebooks, online Logbooks, Guidelines and surgical techniques. In addition, smartphones can be used to immediately complete work-based assessments, in the absence of computers, hopefully increasing completion rates and reliability. Some journals now provide podcasts and video tutorials which may be accessed on smartphones, which is useful for higher examinations. Smartphones can also be used in the clinical setting to take photographs of wounds. Smartphones are enjoying increased uptake and application in the workplace and we review their use for orthopaedic surgeons and trainees to allow them to make the most out of their training opportunities.",,Nawfal Al-Hadithy;Panagiotis D Gikas;Shafic Said Al-Nammari
https://pubmed.ncbi.nlm.nih.gov/28879556/,We are operating too much,"With the increase of superspecialisation, there has been a recent trend for a rising number of operations for both trauma and orthopaedic ailments. This flies against the results of properly planned, well performed, adequately powered, with clinically relevant outcome measures and long enough follow-up level I studies which challenge the received wisdom that surgery is actually superior to conservative management or even supervised neglect. This editorial outlines some of these issues, and suggests that orthopaedic and trauma surgeons should actually think twice before operating on anything that comes our way.",,Nicola Maffulli
https://pubmed.ncbi.nlm.nih.gov/31059338/,Smartphones in orthopaedics: a decade of innovation,"Smartphones have become a mainstream feature in medicine since the introduction of the Apple iPhone in 2007. Over the last decade they have taken on increasing prominence with multiple uses in daily practice. They have long been used for group messaging and accessing patient's electronic records while mobile. More recently, however, smartphones have allowed clinicians to improve patient assessment in clinic and manage follow-up appointments remotely. Furthermore they have been used to aid procedural tasks in surgery and provide a medium for simulation training for junior doctors. The role of smartphones in the future is predicted to increase exponentially and there will no doubt be countless further roles for them in the ever-expanding field of orthopaedics.",,Bilal Al-Obaidi;Satish Babu;Nawfal Al-Hadithy
https://pubmed.ncbi.nlm.nih.gov/2379367/,Recertification in orthopedics,"Will the recertification process always remain the same or is there room for change? Almost certainly the process will change with experience and newer technology, particularly as it relates to clinical policies, outcome studies, and increased computerization of patient data. Even the addition of the practice-based oral exam in 1989 represented a change. The American Board of Orthopaedic Surgery will continue to study and review the experience and methods of other boards with recertification and will continue the dialogue with orthopedic surgeons. Change is, after all, a constant.",,D B Kettelkamp;J N Herndon
https://pubmed.ncbi.nlm.nih.gov/33389055/,Standardizing statistics and data reporting in orthopaedic research,"As the demand for research within orthopaedic surgery continues to grow, it is important to emphasize appropriate data reporting. Insufficient statistical reporting confounds data interpretation and makes it difficult to compare results. Currently, there are no guidelines for reporting results within the orthopaedic literature. This article discusses the importance of appropriate data reporting and proposes guidelines for presenting orthopaedic data to highlight clinical relevance rather than statistical significance.",Data reporting; Orthopaedic data reporting guidelines; Orthopaedic literature; Orthopaedic statistics; Standardization; Statistics.,Katya E Strage;Joshua A Parry;Cyril Mauffrey
https://pubmed.ncbi.nlm.nih.gov/18667387/,Biomaterials in orthopaedics,"At present, strong requirements in orthopaedics are still to be met, both in bone and joint substitution and in the repair and regeneration of bone defects. In this framework, tremendous advances in the biomaterials field have been made in the last 50 years where materials intended for biomedical purposes have evolved through three different generations, namely first generation (bioinert materials), second generation (bioactive and biodegradable materials) and third generation (materials designed to stimulate specific responses at the molecular level). In this review, the evolution of different metals, ceramics and polymers most commonly used in orthopaedic applications is discussed, as well as the different approaches used to fulfil the challenges faced by this medical field.",,M Navarro;A Michiardi;O Castaño;J A Planell
https://pubmed.ncbi.nlm.nih.gov/23686760/,[Chances and risks of a new residency program for orthopedics and trauma surgery],"Background: The residency program for a specialist in orthopedics and trauma surgery is facing fundamental changes based on an initiative originating from the working group ""medical training"" of the German Medical Association (GMA). A survey indicated that 50 % of all trainees are dissatisfied with their current situation. It appears important to integrate the ideas and wishes of current orthopedic residents in a novel training concept. To assess this a survey was performed by the Young Forum of the German Society for Orthopedics und Trauma Surgery.",,
https://pubmed.ncbi.nlm.nih.gov/21871990/,Orthopedic surgery,"Orthopedic surgery is a specialty of surgery dedicated to the prevention, diagnosis, and treatment of diseases and injuries of the musculoskeletal system in all age groups. Careers in orthopedic surgery span the spectrum from general orthopedics to those of subspecialty expertise in orthopedic trauma, hand, pediatrics, total joint, foot and ankle, sports medicine, and oncology to name a few.",,Laura M B Gehrig
https://pubmed.ncbi.nlm.nih.gov/30224006/,The Role of Business Education in the Orthopedic Curriculum,"The field of orthopedics is becoming increasingly complex as the demands for success are not merely clinical competence and good interpersonal skills. To achieve practice stability strategic planning, contract negotiation, health care law, practice management, health care economics, and personal finance are all needed skills. Unfortunately, most of these areas of professional growth require some basic background in business principles. This is an area that most recent residency graduates feel is neglected as a core educational competency. In these changing times, it is imperative that orthopedic residents and fellows obtain some formal business education.",Business education; Health care economics; Health care finance; Orthopedic curriculum.,Peter L Althausen;Kyle E Lybrand
https://pubmed.ncbi.nlm.nih.gov/27492722/,The Masters of the Bolognese Orthopaedic School,"Bologna is one of the most ancient cradles of medical knowledge, as the city hosts one of the oldest medical faculties in the world. Among its best known institutions there is the Rizzoli Orthopaedic Institute, founded in the late nineteenth century, whose history is strictly connected with the evolution and development of the Italian orthopaedic practice of the last 120 years. The present manuscript acknowledges the main contributions by Francesco Rizzoli, Alessandro Codivilla and Vittorio Putti, who prompted the foundation and the international recognition of the Rizzoli Institute and the related Bolognese Orthopaedic School.",Alessandro Codivilla; Francesco Rizzoli; History of orthopaedics; Rizzoli Orthopaedic Institute; Vittorio Putti.,Berardo Di Matteo;Vittorio Tarabella;Giuseppe Filardo;Patrizia Tomba;Anna Viganò;Maurilio Marcacci
