link,title,abstract,tag,author
https://pubmed.ncbi.nlm.nih.gov/29762115/,Effects of Accreditation Council for Graduate Medical Education Duty Hour Regulations on Clinical Preparedness of First-Year Orthopaedic Attendings: A Survey of Senior Orthopaedic Surgeons,"It is unclear how the Accreditation Council for Graduate Medical Education (ACGME) resident duty hour restriction has affected attending orthopaedic surgeons in their first year of practice. The purpose of this study was to compare the clinical preparedness of first-year orthopaedic attending surgeons who trained with ACGME duty hour regulations versus those trained without regulations. Senior orthopaedic surgeons with greater than 10 years of experience were surveyed and results indicate that first-year attendings who trained with ACGME duty hour regulations required more supervision reviewing cases preoperatively, required more assistance completing operative cases, had inferior technical skills, had more major operative complications, had poorer physical exam skills, and delivered an inferior quality of care. Private attendings were most critical. In the postregulatory era, residency programs must optimize the resident's time to ensure competency on graduation. Strategies include increasing midlevel staff, focusing on competencies outlined by ACGMEmilestones, and increasing the role of simulation. (Journal of Surgical Orthopaedic Advances 27(1):42-46, 2018).",,Steven T DiSegna;Timothy D Kelley;Deborah M DeMarco;Abhay R Patel
https://pubmed.ncbi.nlm.nih.gov/497936/,Orthopedic surgery today,"The history of orthopedic surgery in Canada is briefly reviewed. It appears that the problems which were posed in the 1960s and early 1970s have diminished in importance. They related to the shortage of orthopedic manpower and to the lack of a sound scientific base within universities. There appears now to be an adequate number of orthopedic surgeons to handle the needs of the population, and Canadian training programs are providing replacements at an appropriate rate. Future problems will in all probability relate to the interrelationship between society and the medical profession. Academic freedom and mobility of medical manpower must be preserved at all costs and the orthopedic profession must adapt to an ever-changing situation if future developments are to be as satisfying as our very exciting past.",,R L Cruess
https://pubmed.ncbi.nlm.nih.gov/27662381/,Current Issues Affecting the Practice of Pediatric Orthopaedic Surgeons: Results of the 2014 Workforce Survey of American Academy of Pediatrics Section on Orthopaedics,"Introduction: The opinions of the pediatric orthopaedic workforce are shaped by market forces, regulatory processes, and local experience. The purpose of this report is to summarize the findings of the recent Workforce Survey of the American Academy of Pediatrics (AAP) Section on Orthopaedics (SOOr). This submission has been reviewed and approved by the Board of Directors of the Pediatric Orthopaedic Society of North America (POSNA).",,Pooya Hosseinzadeh;Lawson Copley;Holly Ruch-Ross;Richard M Schwend;Jeffrey R Sawyer
https://pubmed.ncbi.nlm.nih.gov/21415695/,Current treatment preferences for early onset scoliosis: a survey of POSNA members,"Background: Surgical options for the management of idiopathic early onset scoliosis (EOS) have increased over the past decade, perhaps surpassing traditional nonoperative methods. We sought to assess current treatment preferences in the management of EOS among pediatric orthopaedic surgeons. We hypothesized that practitioner access to casting tables and halo traction would be significantly associated with treatment choices.",,Nicholas D Fletcher;A Noelle Larson;B Stephens Richards;Charles E Johnston
https://pubmed.ncbi.nlm.nih.gov/29558376/,Objective Methodology to Assess Meaningful Research Productivity by Orthopaedic Residency Departments: Validation Against Widely Distributed Ranking Metrics and Published Surrogates,"The mission of any academic orthopaedic training program can be divided into 3 general areas of focus: clinical care, academic performance, and research. Clinical care is evaluated on clinical volume, patient outcomes, patient satisfaction, and becoming increasingly focused on data-driven quality metrics. Academic performance of a department can be used to motivate individual surgeons, but objective measures are used to define a residency program. Annual in-service examinations serve as a marker of resident knowledge base, and board pass rates are clearly scrutinized. Research productivity, however, has proven harder to objectively quantify. In an effort to improve transparency and better account for conflicts of interest, bias, and self-citation, multiple bibliometric measures have been developed. Rather than using individuals' research productivity as a surrogate for departmental research, we sought to establish an objective methodology to better assess a residency program's ability to conduct meaningful research. In this study, we describe a process to assess the number and quality of publications produced by an orthopaedic residency department. This would allow chairmen and program directors to benchmark their current production and make measurable goals for future research investment. The main goal of the benchmarking system is to create an ""h-index"" for residency programs. To do this, we needed to create a list of relevant articles in the orthopaedic literature. We used the Journal Citation Reports. This publication lists all orthopaedic journals that are given an impact factor rating every year. When we accessed the Journal Citation Reports database, there were 72 journals included in the orthopaedic literature section. To ensure only relevant, impactful journals were included, we selected journals with an impact factor greater than 0.95 and an Eigenfactor Score greater than 0.00095. After excluding journals not meeting these criteria, we were left with 45 journals. We performed a Scopus search over a 10-year period of these journals and created a database of articles and their affiliated institutions. We performed several iterations of this to maximize the capture of articles attributed to institutions with multiple names. Based off of this extensive database, we were able to analyze all allopathic US residency programs based on their quality research productivity. We believe this as a novel methodology to create a system by which residency program chairmen and directors can assess progress over time and accurate comparison with other programs.",,Louis B Jones;Sameer Goel;Leroy Y Hung;Matthew L Graves;Clay A Spitler;George V Russell;Patrick F Bergin
https://pubmed.ncbi.nlm.nih.gov/22662301/,Pitfalls and important issues in testing reliability using intraclass correlation coefficients in orthopaedic research,"Background: Intra-class correlation coefficients (ICCs) provide a statistical means of testing the reliability. However, their interpretation is not well documented in the orthopedic field. The purpose of this study was to investigate the use of ICCs in the orthopedic literature and to demonstrate pitfalls regarding their use.",Intraclass correlation coefficient; Orthopaedic research; Reliability.,Kyoung Min Lee;Jaebong Lee;Chin Youb Chung;Soyeon Ahn;Ki Hyuk Sung;Tae Won Kim;Hui Jong Lee;Moon Seok Park
https://pubmed.ncbi.nlm.nih.gov/20567742/,Ankle fracture syndesmosis fixation and management: the current practice of orthopedic surgeons,"There is a wide variety of treatments for disruption of the syndesmosis. There is also controversy as to which device should be used for fixation of the syndesmosis, how many devices should be used, how many cortices the screws should engage, and whether, when, and where the screws should be removed. We conducted a study to determine how orthopedic surgeons manage these injuries. In a survey, we asked orthopedic trauma and foot and ankle fellowship directors and members of the Orthopaedic Trauma Association and the American Orthopaedic Foot and Ankle Society how they routinely treated the syndesmotic injury component of Danis-Weber type C or Lauge-Hansen pronation-external rotation type IV ankle fractures. The overall response rate was 50% (77/153). Fifty-one percent of respondents routinely used 3.5-mm cortical screws, 24% routinely used 4.5-mm cortical screws, and 14% routinely used a suture fixation device. Forty-four percent of respondents routinely used 1 screw, 44% routinely used 2 screws, and the rest were undecided between 1 and 2 screws. Twenty-nine percent of respondents engaged 3 cortices with syndesmotic screws, and 67% engaged 4 cortices. Syndesmotic screws were routinely removed 65% of the time and left in place 35% of the time. Routine removal of syndesmotic screws was done in the operating room in 95% of cases; it was done at 3 months in 49% of cases, at 4 months in 37%, and at 6 months in 12%. The most common method for treating syndesmotic injuries was through use of 3.5-mm screws engaging 4 cortices routinely removed in the operating room at 3 months. Number of screws used to fix the syndesmosis, either 1 or 2, was evenly split.",,Eric Bava;Timothy Charlton;David Thordarson
https://pubmed.ncbi.nlm.nih.gov/29727412/,"Evidence-based Medicine in Pediatric Orthopaedics: Evidence-based Practice Committee Summary of Levels of Evidence, Clinical Practice Guidelines, Appropriate Use Criteria, and Best Practice Guidelines","The concept of evidence-based medicine has evolved over the past 2 decades, and has become a cornerstone to clinical decision-making in virtually every aspect of medicine. With a commitment to providing its members with high-quality evidence-based guidelines, the American Academy of Orthopaedic Surgeons has instituted concerted efforts since 2006 to develop clinical practice guidelines (CPGs) and appropriate use criteria (AUCs) for certain orthopaedic conditions. Many of these CPGs and AUCs detail the management of pediatric orthopaedic conditions. By the same token, members of the Pediatric Orthopaedic Society of North America (POSNA) Evidence Based Practice Committee have been publishing succinct evaluations of randomized controlled trials in pediatric orthopaedic surgery to create an evidence-based repository for quick reference to available high-level evidence as well as resource to identify gaps in the current research and identify opportunities for future investigation. In instances where higher-level evidence needed to develop CPGs is not available to address a critically important clinical question, consensus recommendations from experts in the field have been obtained to develop best practice guidelines (BPGs). The purpose of this review is to provide readers with a deeper understanding of the key principles of evidence-based medicine and methodologies used for the development of CPGs, AUCs, and BPGs.",,Jigar S Gandhi;Kevin G Shea;Paul D Sponseller;Brian K Brighton;Theodore J Ganley;POSNA Evidence Based Practice Committee
https://pubmed.ncbi.nlm.nih.gov/22955412/,Prevalence of answers to orthopaedic in-training examination questions in 3 commonly used orthopedic review sources,"One of the greatest predictors for resident success on the Orthopaedic In-Training Examination (OITE) is reviewing previous OITE questions. However, no studies have examined which review sources contain the most answers to previously asked OITE questions. The goal of this study was to determine which review source contains the most answers to previously asked OITE questions. Each question from the 2006 to 2010 OITEs was examined. The questions were placed into 1 of 13 categories based on their topic. The publication date of the recommended readings associated with each question was recorded. The answer to each question was then searched for in 3 commonly used review sources: Miller's Review of Orthopaedics, 5th edition (MRO), American Academy of Orthopaedic Surgeons Comprehensive Orthopaedic Review (COR), and www.orthobullets.com (OB). Searchable electronic versions of each textbook were used, and each question had a 12-minute time limit. Of 1358 questions, 665 (49%) were found in all 3 sources. Significantly more answers were found on OB (99.4%) compared with MRO (60%) and COR (62%) (P<.0001). Significantly more answers to questions in each question category were found on OB compared with MRO or COR (P<.0001). More than 50% of all recommended readings for OITE questions were published within 5 years of the OITE. Residents using OB to review for the OITE will be exposed to significantly more answers of previously asked OITE questions than residents using MRO or COR (P<.0001).",,Chad A Krueger;Irshad Shakir;Brian C Fuller
https://pubmed.ncbi.nlm.nih.gov/33582731/,Strengthening Orthopaedic care at national level: Output of a structured residency programme at Aga Khan University,"This descriptive review of the output of the orthopaedic residency programme of Aga Khan University, Karachi, comprised information regarding the number of graduated residents and their educational background which was retrieved from departmental records. Information about their work location, subspecialty, current working status, participation in medical camps and national disaster relief efforts were obtained from various sources, including fellow surgeons, and social media profiles. From 1989 to 2017, a total of 48 residents graduated from the programme, with only 2(4.2%) of them being females. Overall, 19(39.6%) residents hailed from areas outside Karachi; 28(58.3%) belonged to Karachi; 1(2%) came from Kenya; 41(85.4%) remained to serve in Pakistan working mostly in tertiary healthcare centres; and 7(14.6%) moved abroad on consultancy and teaching assignments. Subspecialty training had a general trend towards general orthopaedics and trauma 21(43.7%), followed by arthroplasty surgery 13(27%).","Residency, Orthopaedics, Social accountability, Structured training, Subspecialties, Programme review..",Fateh Ali Janjua;Shah Fahad;Tashfeen Ahmad;Masood Umer
https://pubmed.ncbi.nlm.nih.gov/8770454/,Robert Jones: father of modern orthopaedic surgery,"Robert Jones (1857-1933), the nephew of Hugh Owen Thomas, was an outstanding British orthopaedic surgeon at the close of the nineteenth, and during the first 30 years of the present century. He organized and revolutionized the management and treatment of war wounds in World War I when Director of Military Orthopaedics in the British Army. He established specialized military orthopaedic hospitals for the after-care and rehabilitation of the wounded soldier, being assisted in this work by many, mainly young, American surgeons. Jones was a constant champion of the crippled child. He was responsible for the setting up of orthopaedic departments in the British teaching hospitals and played a major role in the formation of the British Orthopaedic Association; hence the claim that he established orthopaedics as a specialty in its own right in Britain appears valid. He was a fast, brilliant surgeon who devised many new procedures. He was admired and respected by surgeons all over the world, especially Americans, and he received a host of prestigious awards from his own country and from the United States, At all times, he was generous to colleagues and to visitors, entirely free of jealousy and loved by patients, especially children.",,R Cope
https://pubmed.ncbi.nlm.nih.gov/33573909/,Implementation and Impact Evaluation of a Virtual Orthopaedic Continuing Medical Education Conference in a Low-Resource Country,"Objective: The Haitian Annual Assembly of Orthopaedic Trauma (HAAOT) is an annual continuing medical education (CME) conference for Haitian orthopedists and trainees converted to a pilot virtual format in 2020 due to the COVID-19 pandemic. We evaluated this virtual format's effectiveness at teaching, facilitating bilingual discussion, and encouraging cross-cultural exchange of experiences - all aimed at improving orthopedic knowledge in a low-resource country like Haiti.",Continuing Medical Education; Haiti; Orthopaedic Training; Sustainability; Virtual Conference; Virtual Education.,Taylor D Ottesen;Rachel L Montoya;Temi D Ogunleye;Kelsey E Brown;Pierre Marie Woolley;J M Christina Barau Dejean;Rameez A Qudsi;Kiran J Agarwal-Harding;George S M Dyer
https://pubmed.ncbi.nlm.nih.gov/23725942/,The orthopaedic in-training examination: perspectives of program directors and residents from the United States and Canada,"Objective: Objective assessment of resident performance continues to task program directors (PDs) with a formidable challenge. This study evaluated attitudes toward the Orthopaedic In-Training Examination (OITE), compared its value between countries, assessed its value against other metrics of resident performance, and examined program and resident factors predictive of high achievement.",,Nathan Evaniew;Ginger Holt;Sharyn Kreuger;Forough Farrokhyar;Bradley Petrisor;Kelly Dore;Mohit Bhandari;Michelle Ghert
https://pubmed.ncbi.nlm.nih.gov/28899217/,"'The psychological problem is looking at you, are you looking for it?': psychological associations with symptomatic musculoskeletal referrals","It is important that paediatric orthopaedic surgeons recognise that psychological conditions may present with musculoskeletal symptoms. Identification through careful and sensitive history taking is vital. There is a lack of training in this regard in paediatric orthopaedics. We present a series of cases initially referred for a musculoskeletal complaint. Further probing revealed an underlying psychological problem which was neither picked up by the referring physician nor volunteered by the patient. In our opinion, it is important that this training omission is addressed as such psychological problems may be devastating for these individuals and their families.",Psychological; musculoskeletal; paediatric orthopaedic.,M S Arshad;R W Paton
https://pubmed.ncbi.nlm.nih.gov/17353799/,The 2007 ABJS Marshall Urist Award: The impact of direct-to-consumer advertising in orthopaedics,"Direct-to-consumer advertising (DTCA) has become an influential factor in healthcare delivery in the United States. We evaluated the influence of DTCA on surgeon and patient opinions and behavior in orthopaedics by surveying orthopaedic surgeons who perform hip and knee arthroplasties and patients who were scheduled to have hip or knee arthro-plasty. Respondents were asked for their opinions of and experiences with DTCA, including the influence of DTCA on surgeon and patient decision making. Greater than 98% of surgeon respondents had experience with patients who were exposed to DTCA. The majority of surgeon respondents reported DTCA had an overall negative impact on their practice and their interaction with patients (74%), and their patients often were confused or misinformed about the appropriate treatment for their condition based on an advertisement (77%). Fifty-two percent of patient respondents recalled seeing or hearing advertisements related to hip or knee arthroplasty. These patients were more likely to request a specific type of surgery or brand of implant from their surgeon and to see more than one surgeon before deciding to have surgery. Direct-to-consumer advertising seems to play a substantial role in surgeon and patient decision making in orthopaedics. Future efforts should be aimed at improving the quality and accuracy of information contained in consumer-directed advertisements related to orthopaedic implants and procedures.",,Kevin J Bozic;Amanda R Smith;Sanaz Hariri;Sanjo Adeoye;John Gourville;William J Maloney;Brian Parsley;Harry E Rubash
https://pubmed.ncbi.nlm.nih.gov/27528829/,Objective Evaluation of Motor Skills for Orthopedic Residents Using a Motion Tracking Drill System: Outcomes of an ABOS Approved Surgical Skills Training Program,"Background: Orthopedics is a motor skills-demanding surgical specialty requiring surgical skills training outside of the operating room. Unfortunately, limited quantitative techniques exist to determine the effectiveness of these surgical skills training programs. Using a variety of drill, surgeon, and specimen mounted sensors, we evaluated orthopedic surgery residents during a surgical skills training course approved by the American Board of Orthopaedic Surgeons (ABOS). This evaluation consisted of quantitative measures of various kinematic and kinetic parameters with the goal of relating these to clinically-significant outcomes.",,Ashkan Pourkand;Christina Salas;Jasmin Regalado;Krishan Bhakta;Rachel Tufaro;Deana Mercer;David Grow
https://pubmed.ncbi.nlm.nih.gov/26294002/,Fathers of orthopaedics in Germany (eighteenth and early nineteenth centuries): Lorenz Heister in Helmsted; Johann Friedrich Dieffenbach in Berlin; Heine and family in Würzburg,"In orthopaedic medicine in Germany, Lorenz Heister, practicing in the eighteenth century, is considered one of the fathers of German surgery and is renowned for his books on management of hemorrhage, wounds, fractures, bandaging, instrumentation and surgery. After Heister, at the beginning of the nineteenth century, orthopaedic medicine in Germany developed uniformly. In a period when few doctors were interested in a separate discipline of orthopaedics, Germany led in this field. Heine devoted himself to the development of the new profession of orthopaedics, and in 1816, he opened the first orthopaedic institute on German soil in the former monastery of St. Stephen, which later became known as the Karolinen-Institut. Along with Heine and his family, the special development of orthopaedics in Berlin may be attributed to the work of Dieffenbach who, in 1832, became professor at the University of Berlin and in 1840 director of the Clinical Institute for Surgery at Charité Hospital.",German orthopaedic history; Orthopedic history.,Philippe Hernigou
https://pubmed.ncbi.nlm.nih.gov/9863339/,[Development of orthopedics and founding of the Clinic for Orthopedic Surgery and Traumatology in Novi Sad],"A study of the development of the orthopaedic surgery in Novi Sad from the antique times till 1980 when the Clinic for Orthopaedic. Surgery and Traumatology was established has been carried out. Development from Roman Times till the Second World War. The first material evidence of the surgical activities in this area originates from the epoch of the Roman Empire, when under the emperor Augustus (Augustus, 27 B.C.-14 A.D.), the northern border of the Empire was established and fortified on the river Danube. At that time on the place of the contemporary Petrovaradin Fortress, a small fortification with a permanent garrison, called Cusum, was built. As it was proved by excavation of the surgical instruments from the Roman time at the nearby Sremska Mitrovica (Sirmium) the surgery in the Roman legions was quite developed and it could be concluded that some forms of surgery and orthopaedics were practised in the antique Cusum as well. There is no reliable evidence about the health service in the area after the Roman era till the 1689 when Petrovaradin was finally sized by Austrian troops from the Turks, and when the first recorded hospital (Petrovaradin Military Hospital) in this region was founded. At that time on the northern shore of the river Danube a new settlement, developing later into the town of Novi Sad, was established. Surgery together with orthopaedics at that time were performed by the so-called ""feldschers"", and then by primitive, self-taught surgeons who were actually experienced barbers, while educated doctors started to practice surgery only in the 19th century when the first surgical department in Novi Sad was founded in the Great Town Hospital, and for years after that, the orthopaedics was practised by general surgeons. The foundation of the Anglo-Yugoslav Children's Hospital for Tuberculosis of the Bones and Joints at Sremska Kamenica in 1934 by Dr. Katherine S. Macphail, a great benefactress of our people, was of great importance for the development of orthopaedics in this area as it was the first orthopaedic hospital in the country. The first small unit for orthopaedics, as a part of the Surgical Department of the Novi Sad State Hospital, was established in 1937 and led by a surgeon, Dr. Nikola Pravdica. Development from the Second World War till the 1980. After the Second World War the Main Provincial Hospital with two surgical departments was established in Novi Sad. At the so-called Second Surgical Department led by Dr. Nestor Teodorovic a small unit for traumatology and orthopaedics was founded in 1946, which functioned as such till 1953. The first properly trained orthopaedic surgeon was Dr. Stojan Letic who passed the specialty exam in 1953 and was attached to the Second Surgical Department of the Main Provincial Hospital. The first independent Orthopaedic and Traumatologic Department, led by an experienced orthopaedic surgeon, Dr. Vladimir Razenj, was established in 1956. From 1959 till 1963 the department was led by Prim. Dr. Dobrivoje Gradistanac. In 1963 this department together with the former ""English Hospital"" at Sremska Kamenica were incorporated into the so-called Clinic for Surgical Diseases and divided in the Orthopaedic (led by Prof. Milenko Dosen) and separated Traumatologic (led by Prim. Stojan Letić) departments which existed as such till 1975 when they were integrated again into a single unit which evolved into the Clinic for Orthopaedic Surgery and Traumatology in 1980.",,Z Mikić
