link,title,abstract,tag,author,keyword
https://pubmed.ncbi.nlm.nih.gov/20187749/,Gender-related differences in adolescent hypertension and in target organ effects,Aims: To assess whether a gender difference exists in adolescent hypertension and its target organ damage and to compare potential confounding factors and target organ damage in hypertensive and normotensive adolescent girls.,,Mária Juhász;Eva Katona;Georgios Settakis;György Paragh;Csilla Molnár;Béla Fülesdi;Dénes Páll,hypertension
https://pubmed.ncbi.nlm.nih.gov/7074652/,Influence of mediastinal adenopathy on site and frequency of relapse in patients with Hodgkin's disease,"Between April 1969 and July 1979, 267 patients with surgically staged IA-IIB Hodgkin's disease and 31 with clinically staged IIE or IV Hodgkin's disease were treated; disease was limited to the area above the diaphragm. Three separate groups of patients with mediastinal adenopathy were identified. Patients with disease limited to the mediastinum had a favorable prognosis, and treatment with mantle followed by para-aortic irradiation has resulted in 85% relapse-free survival and 100% overall survival at 8 years. Surgically staged patients with large diameter mediastinal adenopathy (greater than 0.33 of the thoracic diameter) have a high relapse rate with radiation therapy alone. The use of combined modality therapy has reduced the risk of relapse in these patients, but the survival remains higher whether MOPP is used initially or at relapse. Clinically staged IIE patients or stage IV patients with extensive extranodal disease limited to the thoracic cavity were treated with chemotherapy and involved- or extended-field irradiation. These patients had a 5-year survival of 66% with large mediastinal adenopathy and 90% with lesser mediastinal disease.",,P Mauch;D Gorshein;J Cunningham;S Hellman,chest
https://pubmed.ncbi.nlm.nih.gov/12719018/,"Prevalence of and carcass condemnation from maedi-visna, paratuberculosis and caseous lymphadenitis in culled sheep from Quebec, Canada","We determined the prevalence of lung and mammary gland lesions associated with maedi-visna (MV) infection, the prevalence of paratuberculosis (PTB), and the prevalence and lesions distribution of caseous lymphadenitis (CL) in culled sheep. Total of 451 ewes and 34 rams were selected randomly from two slaughterhouses in Quebec, Canada. MV serostatus was determined by recombinant ELISA test. PTB diagnosis was based on characteristic histological lesions in the terminal ileum, ileocecal lymph node and/or ileocecal valve and CL by gross detection of abscesses and isolation of Corynebacterium pseudotuberculosis. Seroprevalence of MV was 44% (95% CI: 40, 48). Seropositivity increased with age and was higher in ewes than in rams. The percentages of lung and mammary gland lesions in seropositive sheep were 14 and 40%, respectively, but mammary gland lesions lack specificity. The prevalence of PTB was 3% (95% CI: 2, 5). PTB increased with age and was lower among sheep with abscesses. The prevalence of CL was >/=21% (95% CI: 17, 24). The most-prevalent site of caseous lymphadenitis lesions was the thoracic cavity. The risk of carcass condemnation was significantly associated with region, body score and abscesses. Only the presence of abscesses was associated with an increase in trimming of carcasses.",,Julie Arsenault;Christiane Girard;Pascal Dubreuil;Danielle Daignault;Jean René Galarneau;Julie Boisclair;Carole Simard;Denise Bélanger,chest
https://pubmed.ncbi.nlm.nih.gov/33875803/,Amplification-free RNA detection with CRISPR-Cas13,"CRISPR-based nucleic-acid detection is an emerging technology for molecular diagnostics. However, these methods generally require several hours and could cause amplification errors, due to the pre-amplification of target nucleic acids to enhance the detection sensitivity. Here, we developed a platform that allows ""CRISPR-based amplification-free digital RNA detection (SATORI)"", by combining CRISPR-Cas13-based RNA detection and microchamber-array technologies. SATORI detected single-stranded RNA targets with maximal sensitivity of ~10 fM in <5 min, with high specificity. Furthermore, the simultaneous use of multiple different guide RNAs enhanced the sensitivity, thereby enabling the detection of the SARS-CoV-2 N-gene RNA at ~5 fM levels. Therefore, we hope SATORI will serve as a powerful class of accurate and rapid diagnostics.",,Hajime Shinoda;Yuya Taguchi;Ryoya Nakagawa;Asami Makino;Sae Okazaki;Masahiro Nakano;Yukiko Muramoto;Chiharu Takahashi;Ikuko Takahashi;Jun Ando;Takeshi Noda;Osamu Nureki;Hiroshi Nishimasu;Rikiya Watanabe,covid-19
https://pubmed.ncbi.nlm.nih.gov/3059645/,Carotid artery wall properties in normotensive and borderline hypertensive subjects of various ages,"The vessel wall properties of the common carotid artery were studied noninvasively in normotensive and borderline hypertensive male volunteers of various ages with the use of a multi-gate pulsed Doppler system. In the younger age group (20-35 y) both distensibility and cross-sectional compliance were significantly less in the borderline hypertensive group. In the older borderline hypertensive subjects (50-69 y) distensibility (p less than 0.05) and cross-sectional compliance (p = 0.06) were also less than in the control subjects. The reduced distensibility and cross-sectional compliance likely result from a decrease in arterial wall elasticity because the relative increase in common carotid artery diameter during systole is diminished in borderline hypertensives, despite the fact that their pulse pressure is similar to or higher than that in control subjects. The less pronounced differences in vessel wall properties between borderline hypertensive and normotensive volunteers in the older age group may be a consequence of the changes in these properties with age, partly masking the alterations due to borderline hypertension. Since the stiffer behavior of the common carotid artery in borderline hypertensives is associated with relatively slight changes in blood pressure, the question can be raised whether the alterations in arterial wall properties are really a result of the elevated arterial blood pressure; these alterations might develop independent of the blood pressure elevation.",,T Van Merode;P J Hick;A P Hoeks;K H Rahn;R S Reneman,hypertension
https://pubmed.ncbi.nlm.nih.gov/3813595/,Malignant melanoma of mucous membranes. A clinicopathologic study of 13 cases in Japanese patients,"We found 13 mucosal melanomas (13%) among 103 cases of malignant melanoma at Tohoku University Hospital, Sendai, Japan, a high incidence. Five melanomas were found on the oral mucosa, another five on the genital mucosa, two within the nasal cavity, and one on the esophagus. Three of the melanomas on the oral mucosa occurred on the lip and the other two on the gingiva. A striking prevalence of melanomas was observed in women, the male-to-female ratio being 0.08. Histologic examination revealed that 58% of the melanomas were characterized by lentiginous, 23% by nodular, and 15% by superficial spreading proliferation. Most of the melanomas were Clark's level IV or V at the time of diagnosis. Except for three who have been under observation for a short time, all the patients have died. There appear to be some clinical and histologic similarities between mucosal melanoma and melanoma of the volar skin, but the difference in biological behavior warrants that the two be classified separately.",,T Kato;H Takematsu;Y Tomita;M Takahashi;R Abe,melanoma
https://pubmed.ncbi.nlm.nih.gov/20662355/,Rathke cleft cyst in seven-year-old girl presenting with central diabetes insipidus and review of literature,"Rathke cleft cysts (RCC) are benign cysts derived from remnants of Rathke cleft, and are rarely symptomatic in children. Symptoms due to RCC are associated with mass effect and pituitary hormone deficiencies. Slow growth rate of the cyst makes its incidence increase with aging. Here we report on a seven-year-old girl who presented with central diabetes insipidus (CDI). Her sella MRI revealed a lesion in the sellar region which grew rapidly in follow-up. She underwent microneurosurgical operation and the lesion was totally excised. Pathologic examination revealed RCC with degenerative changes. In her follow-up, growth hormone deficiency developed in addition to arginine vasopressin deficiency. Rapid growth of the cyst is not the usual course of RCC's. Mechanisms regarding the cyst growth are unclear as they are in this case. This is the youngest child to date presenting with central diabetes insipidus due to RCC. Rapid growth of RCC can cause CDI in young children.",,Olcay Evliyaoglu;Cetin Evliyaoglu;Sebnem Ayva,diabetes
https://pubmed.ncbi.nlm.nih.gov/17004549/,Postpneumonectomy and postlobectomy empyema,"Although similar strategies are used in the management of PPE and PLE, these conditions need to be viewed as two separate entities. For the purpose of devising the appropriate management strategy, PPE should be divided into early and late, with and without mediastinal induration and extensive pleural space contamination. If at all possible, PLE should be managed as a postpneumonic empyema with prolonged chest tube drainage. The key to these conditions is prevention.",,Farid Gharagozloo;Marc Margolis;Matthew Facktor;Barbara Tempesta;Farzad Najam,chest
https://pubmed.ncbi.nlm.nih.gov/33130151/,End-point RT-PCR: A potential alternative for diagnosing coronavirus disease 2019 (COVID-19),"Real-time reverse transcription-polymerase chain reaction (RT-qPCR) is considered the ""gold standard"" for the direct diagnosis of SARS-CoV-2 infections. However, routine diagnosis by RT-qPCR is a limitation for many laboratories, mainly due to the infrastructure and/or disproportionate relationship between demand and supply of inputs. In this context, and to increase the diagnostic coverage of SARS-CoV-2 infections, we describe an alternative, sensitive and specific one-step end-point RT-PCR for the detection of the SARS-CoV-2 E gene. The performance of the RT-PCR was evaluated in 43 clinical samples, of which 10 and 33 were previously identified as negative and positive, respectively, by RT-qPCR. Among the positive samples, 15 and 18 were from asymptomatic and symptomatic individuals, respectively. Here, 32/33 of the positive samples in the RT-qPCR, including from asymptomatic individuals, were found positive in the RT-PCR (Ct 15.94-34.92). The analytical sensitivity of the assay was about 7.15-9 copies of vRNA/μL, and nonspecific amplifications were not observed in SARS-CoV-2 negative samples. Importantly, the RT-PCR reactions were performed in a 10 μL final volume. Finally, considering specificity, analytical sensitivity and cost reduction, we believe that the RT-PCR platform described here may be a viable option for the diagnostic of SARS-CoV-2 infections in laboratories in which RT-qPCR is not available.",COVID-19; E gene; Molecular diagnosis; RT-PCR; SARS-CoV-2.,José Valter Joaquim Silva Júnior;Ingryd Merchioratto;Pablo Sebastian Britto de Oliveira;Thaísa Regina Rocha Lopes;Patrícia Chaves Brites;Elehu Moura de Oliveira;Rudi Weiblen;Eduardo Furtado Flores,covid-19
https://pubmed.ncbi.nlm.nih.gov/2490966/,The quality of antihypertensive care,"The study involved 82 hypertensive patients under 65 years of age who suffered a stroke and did not have other risk factors for stroke but high blood pressure. The purpose of the study was to disclose possible deficiencies and to indicate areas for improvement in providers' practices. The process and intermediate outcome of care were judged to be satisfactory in only 4 patients out of the 75 known as hypertensives prior to the stroke (5.2%). There was no association between the structure of care and its process or outcome. The findings of the study are being used in the efforts to improve practices. It is suggested that the described approach could be applied by rehabilitation medicine to assessments of quality of care of conditions known to be risk factors of impairments that lead to disabilities, thereby contributing to quality assurance and disability prevention.",,R Eldar;N Rozenthul,hypertension
https://pubmed.ncbi.nlm.nih.gov/26825037/,Endothelin-1 in the tumor microenvironment correlates with melanoma invasion,"Endothelin-1 (ET-1) is a vasoactive peptide that also plays a role in the tanning response of the skin. Animal and cell culture studies have also implicated ET-1 in melanoma progression, but no association studies have been performed to link ET-1 expression and melanoma in humans. Here, we present the first in-vivo study of ET-1 expression in pigmented lesions in humans: an ET-1 immunohistochemical screen of melanocytic nevi, melanoma in situ lesions, invasive melanomas, metastatic melanomas, and blue nevi was performed. Twenty-six percent of melanocytic nevi and 44% of melanoma in situ lesions demonstrate ET-1 expression in the perilesional microenvironment, whereas expression in nevus or melanoma cells was rare to absent. In striking contrast, 100% of moderately to highly pigmented invasive melanomas contained numerous ET-1-positive cells in the tumor microenvironment, with 79% containing ET-1-positive melanoma cells, confirmed by co-staining with melanoma tumor marker HMB45. Hypopigmented invasive melanomas had reduced ET-1 expression, suggesting a correlation between ET-1 expression and pigmented melanomas. ET-1-positive perilesional cells were CD68-positive, indicating macrophage origin. Sixty-two percent of highly pigmented metastatic melanomas demonstrated ET-1 expression in melanoma cells, in contrast to 28.2% of hypopigmented specimens. Eighty-nine percent of benign nevi, known as blue nevi, which have a dermal localization, were associated with numerous ET-1-positive macrophages in the perilesional microenvironment, but no ET-1 expression was detected in the melanocytes. We conclude that ET-1 expression in the microenvironment increases with advancing stages of melanocyte transformation, implicating a critical role for ET-1 in melanoma progression, and the importance of the tumor microenvironment in the melanoma phenotype.",,Luis Chiriboga;Shane Meehan;Iman Osman;Michael Glick;Gelo de la Cruz;Brittny S Howell;George Friedman-Jiménez;Robert J Schneider;Sumayah Jamal,melanoma
https://pubmed.ncbi.nlm.nih.gov/9190534/,[Congenital nephrogenic diabetes insipidus: a difficult diagnosis?],"In five patients (a boy aged 10 years, a boy aged 3 months, his brother aged 1 week, the brother of the mother of the last-mentioned two boys who had died at the age of one, and a girl of kindergarten age) congenital nephrogenic diabetes insipidus was diagnosed. This rare syndrome (prevalence 1:500,000) is caused by renal insensitivity to the antidiuretic hormone arginine vasopressin. In infancy the symptoms of this disorder are aspecific, and the main symptoms of the disease, polyuria and polydipsia, often remain unnoticed at this young age. A simple anamnesis and a few laboratory tests should suggest the diagnosis. Early diagnosis and genetic counselling are possible as the molecular effects involved have been elucidated.",,A F van Lieburg;N V Knoers;L A Monnens,diabetes
https://pubmed.ncbi.nlm.nih.gov/16197850/,[Acute myelogenous leukemia presenting as diabetes insipidus],"Central diabetes insipidus, is a syndrome characterized by the excretion of abnormally elevated volumes of diluted urine, due to the diminution of reabsorption of water in the collecting ducts, induced by the diminution of production of antidiuretic hormone. The involvement of the central nervous system in the leukaemia is frequent, but the association leukaemia/diabetes insipidus is rare. We describe a clinical case of a 40 years old female, whose first manifestation of leukaemia was diabetes insipidus; we discuss the difficulties of diagnosis, the particularities of the case and its evolution.",,Susana Calretas;Sara Leitão;Emília Cortesão;Ana Isabel Espadana;Rui M Santos;Armando Porto,diabetes
https://pubmed.ncbi.nlm.nih.gov/28741688/,New insights into naevoid melanomas: a clinicopathological reassessment,"Aims: Because the term 'naevoid melanoma' has variable clinical and pathological interpretations, we aimed to clarify the features of melanomas referred to as naevoid.",immunohistochemistry; maturing naevoid melanoma; papillomatous naevoid melanoma; paradoxical maturation; small-cell melanoma.,Martin G Cook;Daniela Massi;Willeke A M Blokx;Joost Van den Oord;Senada Koljenović;Vincenzo De Giorgi;Eleanor Kissin;Megan Grant;Amit Mandal;Gabriela Gremel;Caroline Gaudy;Amaya Viros;Nathalie Dhomen;Kiarash Khosrotehrani;Richard Marais;Adele C Green;Martin C Mihm Jr,melanoma
https://pubmed.ncbi.nlm.nih.gov/33078604/,A single center cohort of 40 severe COVID-19 patients who were treated with convalescent plasma,Background/aim: A SARS-Cov2 infection which was first arised from Wuhan in December 2019 and named as COVID-19. Still there lacks either a specific treatment or a vaccine to treat COVID-19. Convalescent plasma (CP) was previously used successfully to treat SARS-CoV-1 and MERS infections. Health authority in Turkey has published a guideline to integrate this promising option in the treatment process of patients who are prone to high risk of developing severe COVID 19.,COVID-19; Convalescent plasma; viral infections.,Aliihsan Gemici;Hülya Bilgen;Cem Erdoğan;Abdullah Kansu;Oktay Olmuşçelik;Hüseyin Saffet Beköz;Rumeysa Çakmak;Ali Mert;Ömür Gökmen Sevindik,covid-19
https://pubmed.ncbi.nlm.nih.gov/34067128/,Will SARS-CoV-2 Become Just Another Seasonal Coronavirus?,"The future prevalence and virulence of SARS-CoV-2 is uncertain. Some emerging pathogens become avirulent as populations approach herd immunity. Although not all viruses follow this path, the fact that the seasonal coronaviruses are benign gives some hope. We develop a general mathematical model to predict when the interplay among three factors, correlation of severity in consecutive infections, population heterogeneity in susceptibility due to age, and reduced severity due to partial immunity, will promote avirulence as SARS-CoV-2 becomes endemic. Each of these components has the potential to limit severe, high-shedding cases over time under the right circumstances, but in combination they can rapidly reduce the frequency of more severe and infectious manifestation of disease over a wide range of conditions. As more reinfections are captured in data over the next several years, these models will help to test if COVID-19 severity is beginning to attenuate in the ways our model predicts, and to predict the disease.",SARS-CoV-2; SIR model; mathematical model; ordinary differential equations.,Alexander B Beams;Rebecca Bateman;Frederick R Adler,covid-19
https://pubmed.ncbi.nlm.nih.gov/9614398/,Dioxin exposure and non-malignant health effects: a mortality study,"Objective: To investigate, in a population heavily exposed to 2,3,7,8-tetrachlorodibenzo-p-dioxin (TCDD), the possible unusual occurrence of diseases other than cancer.",,A C Pesatori;C Zocchetti;S Guercilena;D Consonni;D Turrini;P A Bertazzi,diabetes
https://pubmed.ncbi.nlm.nih.gov/18582820/,"Embryology, sternal clefts, ectopia cordis, and Cantrell's pentalogy","Sternal clefts, ectopia cordis, and Cantrell's pentalogy continue to be very rare congenital anomalies in pediatric surgery. Unfortunately, these conditions present as neonatal emergencies and demand early surgical intervention. This article reviews the embryological development of the chest wall, specific sternal defect anomalies, along with available methods of treatment.",,Scott A Engum,chest
https://pubmed.ncbi.nlm.nih.gov/9279475/,Detection and treatment of hypertension in patients with non-insulin-dependent diabetes mellitus: does the 'rule of halves' apply to a diabetic population?,"The extent to which hypertension is detected and adequately treated in the general population is often described by the 'rule of halves', but corresponding figures for patients with non-insulin-dependent diabetes mellitus (NIDDM), based on current American Diabetes Association (ADA) criteria, have not been previously reported. This study looked at the detection and management of hypertension among 2331 consecutive patients with NIDDM attending for annual complications assessment. Hypertension was defined according to ADA criteria, i.e. systolic blood pressure (sBP) > 140 mmHg and/or diastolic blood pressure (dBP) > 90 mmHg. A total of 69% of patients were hypertensive, with proportionately more women in the hypertensive group (48 versus 39%, P < 0.002). Among those with hypertension, 59% were taking antihypertensive drugs but only 31% of treated hypertensives were adequately controlled. Thus, hypertension affects roughly two-thirds of patients with NIDDM and compared with treatment strategies reported in the literature for the non-diabetic population (summarised in the 'rule of halves'), proportionately more hypertensive patients with NIDDM are treated with BP-lowering drugs (59%) but proportionately less (31%) have adequate BP control.",,R Donnelly;L Molyneaux;M McGill;D K Yue,hypertension
https://pubmed.ncbi.nlm.nih.gov/18294512/,Pilot study of transesophageal endoscopic epicardial coagulation by submucosal endoscopy with the mucosal flap safety valve technique (with videos),Background: We previously demonstrated that the thoracic cavity could be safely accessed by submucosal endoscopy with the mucosal flap safety valve (SEMF) technique.,,Kazuki Sumiyama;Christopher J Gostout;Elizabeth Rajan;Timothy A Bakken;Mary A Knipschield;Sydney Chung;Peter B Cotton;Robert H Hawes;Anthony N Kalloo;Sergey V Kantsevoy;Pankaj J Pasricha,chest
https://pubmed.ncbi.nlm.nih.gov/33733663/,COVID-19 vaccines for low- and middle-income countries,"The COVID-19 pandemic is the biggest threat to public health in a century. Through hard work and ingenuity, scientists have developed a number of safe and effective vaccines against COVID-19 disease. However, demand far outstrips supply and countries around the world are competing for available vaccines. This review describes how low- and middle-income countries access COVID-19 vaccines, what is being done to distribute vaccines fairly, as well as the challenges ahead.",2019 novel coronavirus disease clinical trial; COVID-19; low- and middle-income countries; severe acute respiratory syndrome coronavirus 2; vaccines.,Edward M Choi,covid-19
https://pubmed.ncbi.nlm.nih.gov/34272205/,The evolution of rapid antigen detection systems and their application for COVID-19 and other serious respiratory infectious diseases,"Making the correct diagnosis of a patient seeking medical attention is the ultimate goal of a practicing physician, irrespective of whether the cause of the patient's condition is infectious or non-infectious. Antigen detection tests can be used to aid in the diagnosis of various infectious-related disorders including COVID-19 where it has become especially important due to the serious nature of this disease and its worldwide prevalence. These tests closely mimic one of the earliest prototypes - the urine pregnancy test - and as a result they have gained wide acceptance based on their overall simplicity, low cost and relative accuracy. In some situations, especially as a screening test, they can be used instead of the more technically demanding and complex molecular and serologic assays that are still useful and helpful under many different circumstances. Antigen detection systems are based on finding a particular immunogenic component, typically a protein or polysaccharide molecule, that is both unique and an integral part of the pathogen or other biological entity. Because these tests generally provide only qualitative results, they often need to be supplemented with other and sometimes more sophisticated laboratory-based diagnostic procedures to corroborate the initial test result. In this review, we first describe general background information on antigen-detection methods, including any unique aspects of their overall design, and then follow with an extensive description on the merits and limitations of these tests for detecting COVID-19 and, to a lesser extent, for other serious respiratory diseases caused by three common bacterial pathogens - Streptococcus pyogenes, Streptococcus pneumoniae and Legionella pneumophila.",Antigen-detection; COVID-19; Legionella pneumophila; SARS-Cov-2; Streptococcus pneumoniae; Streptococcus pyogenes.,Charles S Pavia;Maria M Plummer,covid-19
https://pubmed.ncbi.nlm.nih.gov/10473158/,Clinicopathological characteristics of melanomas of the hand,"A 25-year clinicopathological review of 19 patients with malignant melanoma of the hand is reported. There were 11 women (median age 73 years) and eight men (median age 70 years). Eleven tumours were subungual, six on the dorsum of the hand, and two had a palmar location. Seven tumours were acral lentiginous melanomas, six were superficial spreading melanomas, and five were of the nodular subtype. Eleven patients presented with localized disease (clinical stage I), four with local spread (clinical stage II), and four with regional lymph node metastases (clinical stage III). Nine of the patients have died of the disease, with a median survival time of 30 months (range, 10-84 months). The subungual melanomas were thicker and the patients were older at presentation compared with the non-subungual sites. Review of our patients emphasized the need for early diagnosis.",,L M Hove;L A Akslen,melanoma
