link,title,abstract,tag,author,keyword
https://pubmed.ncbi.nlm.nih.gov/28761961/,Lethal Melanomas: A Population-based Registry Study in Western Sweden from 1990 to 2014,"The incidence rates of thin melanomas (≤1 mm Breslow thickness) have increased in many fair-skinned populations, prompting a need to better identify patients with thin melanomas who will eventually die from the disease. This study aimed to describe the clinicopathological characteristics of lethal melanomas in Western Sweden, with a focus on thin lesions. Population-based data on invasive melanomas diagnosed during the years 1990 to 2014 were extracted from the Swedish Melanoma Registry, and linked to the Swedish Cause of Death Registry. The age-standardized incidence (US population 2000) of thin melanomas increased from 9.1×10-5 (95% confidence interval (95% CI) 8.5-9.8) to 21.3×10-5 (95% CI 20.4-22.1) during the study period. Thin melanomas comprised 55.2% of the total and contributed to 13.5% of all melanoma deaths. Non-ulcerated melanomas 0.76-1 mm and ulcerated melanomas 0.26-1.0 mm showed a poorer survival compared with other thin melanomas.",,Magdalena Claeson;Martin Gillstedt;David C Whiteman;John Paoli,melanoma
https://pubmed.ncbi.nlm.nih.gov/3177449/,Fragile X syndrome and nephrogenic diabetes insipidus,We describe a man with the fra(X) syndrome and nephrogenic diabetes insipidus. The disease loci for both conditions are in the region Xq27.3-q28. This is the first report of the fra(X) syndrome associated with another X-linked disorder. Analysis of DNA markers suggested that the association in this man was coincidental.,,G K Suthers;G Turner;J C Mulley,diabetes
https://pubmed.ncbi.nlm.nih.gov/23608266/,Lung incarceration after anterior mediastinal tracheostomy,"A 63-year-old man underwent anterior mediastinal tracheostomy for postradiotherapy stoma ulceration exposing the left anterolateral tracheal side, cervical vessels, and pharynx. An anterior chest wall defect (hemiclaviculectomy, manubriectomy, and resection of anterior third of first and second ribs bilaterally) was covered by a myocutaneous pectoral flap, and a new tracheostoma was constructed in the middle of the skin island. At postoperative day 7, a protrusion of the right upper lobe outside the thoracic cavity through the anterior chest wall defect was detected. Surgical repair by a right thoracotomy to reposition the lung and defect repair using an expanded polytetrafluoroethylene (Gore-Tex) internal prosthesis were successful. The patient was discharged home at 63 days after the first operation.",,Abel Gómez-Caro;Josep Maria Gimferrer;Laureano Molins,chest
https://pubmed.ncbi.nlm.nih.gov/7638985/,Local melanoma recurrences in the scar after limited surgery for primary tumor,"The clinical and histologic records of 46 consecutive patients were reviewed who during the period 1980-1993 had recurrence from melanoma in the scar after limited surgery for a skin tumor. They constituted about 50% of all patients admitted with local recurrence from melanoma during this period. At reexamination of the primary tumors, 16 were found to be malignant melanomas and 9 were nevi (four atypical and five benign). Twenty-one were missing, 11 of which had never been set for histologic examination. The median thickness of nine measurable melanomas was 0.66 mm. The recurrences in scar consisted of 34 primary melanomas: 18 superficial spreading, 4 nodular, 3 lentigo malignant, and 9 unclassified. Twelve tumors were dermal melanoma metastases. The median thickness of the 25 measurable melanomas was 0.78 mm. The 5-year overall survival was 69%. At the closing date of the study 15 patients had died, 13 of them because of disseminated melanoma. A comparison of the survival curves from this study with those from other series of melanomas with comparable tumor thickness indicates a considerably worse prognosis than is expected with such thin tumors. We believe that the considerable number of local recurrences in the form of a new primary in a scar following limited surgery supports the theory of limited field change around a primary melanoma. Furthermore, limited procedures for primary melanoma, if followed by a recurrence in the scar, worsen the prognosis.",,K T Drzewiecki;A P Andersson,melanoma
https://pubmed.ncbi.nlm.nih.gov/30747402/,First report of filarial nematodes in free-living pitheciid primates,"Although little studied, infections with nematodes of the Onchocercidae Leiper, 1911, predominated by the genera Dipetalonema Diesing, 1861 and Mansonella Faust, 1929, are frequent in wild primates and human populations in the Neotropical forest areas. This study reports natural infections with Dipetalonema freitasi Bain, Diagne & Muller, 1987 and D. gracile (Rudolphi, 1809) in two free-living species of pitheciid primates, extending the known geographical distribution of these species to the forest of the Peruvian Amazon. Adult worms were recovered from the thoracic and abdominal cavities of two species of monkeys, Pithecia monachus monachus (É. Geoffroy Saint-Hilaire) and Cacajao calvus ucayalii (Thomas) (Primates: Pitheciidae), collected along the Yavari-Mirin River basin and analysed via light and scanning electron microscopy. Both host species represent new host records for D. freitasi and D. gracile. Morphometric data are also presented for the sampled filarial worms in addition to morphological details obtained through light and electron microscopy examination of D. freitasi specimens.",,David Fernandez Conga;Pedro Mayor;Elane Guerreiro Giese;Jeannie Nascimento Dos Santos,chest
https://pubmed.ncbi.nlm.nih.gov/31366393/,A cost of illness study evaluating the burden of Wolfram syndrome in the United Kingdom,"Background: Wolfram syndrome is a rare genetic, progressive, neurodegenerative disorder characterised by childhood-onset diabetes mellitus, diabetes insipidus, optic atrophy and deafness. To date, the economic burden of Wolfram syndrome has not been well-studied or reported. The aim of this study was to evaluate the cost of illness (COI) of all people with Wolfram syndrome in the UK and to identify major determinants of cost from a service provider perspective (National Health Service, NHS).","Cost of illness; DIDMOAD; Economic burden, rare disease; Wolfram syndrome.",Sana Eljamel;Wrik Ghosh;Sachin De Stone;Annabel Griffiths;Timothy Barrett;Richard Thompson,diabetes
https://pubmed.ncbi.nlm.nih.gov/20570171/,Malignant melanoma of unknown primary site. To make the long story short. A systematic review of the literature,"Introduction: Although more than 90% of melanomas have a cutaneous origin, occasionally it is discovered as a secondary deposit without evident primary site. The aim of this study was to systematically review published literature and analyse data on incidence, presentation, therapeutic interventions, survival and prognostic factors.",,K Kamposioras;G Pentheroudakis;D Pectasides;N Pavlidis,melanoma
https://pubmed.ncbi.nlm.nih.gov/2270325/,[The relationships between cholesterol and arterial pressure in the Málaga-86 study. Something more than a casual association?],"The frequent association of this vascular risk factors implies not just a potentiation of the vascular risk, but also the need for a wider therapeutical approach on this patients not only regarding the control of the arterial hypertension but also other risk factors. After a cross-sectional study of the prevalence of various vascular risk factors in the province of Málaga (Spain), we analysed the results as for the cholesterolemia and blood pressure in normotensives and hypertensives. In the hypertensive population we observed a tendency to present a higher levels of cholesterol as well as a higher prevalence of hypercholesterolemia (p less than 0.001); on the other hand, hypercholesterolemic people versus normocholesterolemics showed similar data related to their blood pressure and prevalence of hypertension. Finally we discussed the likely etiopathogenetic interrelationships between both vascular risk factors.",,P Aranda;J Aranda;J Carmona;D Núñez,hypertension
https://pubmed.ncbi.nlm.nih.gov/2268509/,The role of 5-hydroxytryptamine and 5-hydroxytryptaminergic mechanisms in hypertension,"1. The possible role of 5-hydroxytryptamine (5-HT) and 5-HT-receptors in hypertension, already suggested by Page in 1954, has been subject to a renaissance of interest owing to the development of antihypertensive drugs which interact with 5-HT-receptors. These drugs, like ketanserin, urapidil and flesinoxan are used as tools to study the role of 5-HT and its receptors in hypertension. 2. The following arguments would plead in favour of a certain role of 5-HT and 5-HT-receptors in the pathogenesis and maintenance of hypertension: hyperresponsiveness of blood vessels from hypertensive patients and animals to 5-HT-induced constriction; the antihypertensive/vasodilator activity of the 5-HT2-receptor antagonist ketanserin; enhanced sensitivity of platelets from hypertensives to 5-HT. 3. However, at least as many arguments would deny a role of peripheral 5-HT in hypertension, like for instance: the fact that 5-HT is not a generally accepted pressor agent, whereas its concentration in the circulating blood is subthreshold; the hyperresponsiveness of vessels from hypertensives is not specific for 5-HT; the elevated local concentration of 5-HT released by platelets is mainly limited to the microcirculation; the 5-HT2-receptor antagonist ketanserin is the only agent of this type which lowers blood pressure, other 5-HT2-receptor blockers like ritanserin and LY 53587 being inactive. 4. The various data and arguments available do not unequivocally support a relevant role of peripheral 5-HT and its receptors in hypertensive disease.(ABSTRACT TRUNCATED AT 250 WORDS)",,P A van Zwieten;G J Blauw;P van Brummelen,hypertension
https://pubmed.ncbi.nlm.nih.gov/305552/,Prevalence of high blood pressure treated and untreated in an urban adult New Zealand population: Napier 1973,The prevalence of hypertensive levels of blood pressure was investigated in a random sample of 2535 adults in Napier in 1973. More than 70 percent of all persons examined had been measured for blood pressure within the previous five years. A retrospective analysis of results using the WHO classification indicated that 16.4 percent of the adult population had a mean systolic pressure of not less than 160mmHg or mean diastolic pressure of not less than 95mmHg. One third of the hypertensive group was receiving treatment and one half of those on therapy were effectively controlled. The total prevalence of treated and untreated hypertensives was estimated to be 20 percent of the survey population. According to the WHO criteria for blood pressure classification 33 percent of those over 60 years were hypertensive.,,B W Christmas;A S Turner,hypertension
https://pubmed.ncbi.nlm.nih.gov/22166145/,Validation of an arterial tortuosity measure with application to hypertension collection of clinical hypertensive patients,"Background: Hypertension may increase tortuosity or twistedness of arteries. We applied a centerline extraction algorithm and tortuosity metric to magnetic resonance angiography (MRA) brain images to quantitatively measure the tortuosity of arterial vessel centerlines. The most commonly used arterial tortuosity measure is the distance factor metric (DFM). This study tested a DFM based measurement's ability to detect increases in arterial tortuosity of hypertensives using existing images. Existing images presented challenges such as different resolutions which may affect the tortuosity measurement, different depths of the area imaged, and different artifacts of imaging that require filtering.",,Karl T Diedrich;John A Roberts;Richard H Schmidt;Chang-Ki Kang;Zang-Hee Cho;Dennis L Parker,hypertension
https://pubmed.ncbi.nlm.nih.gov/32761898/,A systematic review and meta-analysis of children with coronavirus disease 2019 (COVID-19),"To provide a comprehensive and systematic analysis of demographic characteristics, clinical symptoms, laboratory findings, and imaging features of coronavirus disease 2019 (COVID-19) in pediatric patients. A meta-analysis was carried out to identify studies on COVID-19 from 25 December 2019 to 30 April 2020. A total of 48 studies with 5829 pediatric patients were included. Children of all ages were at risk for COVID-19. The main illness classification ranged as: 20% (95% confidence interval [CI]: 14%-26%; I2 = 91.4%) asymptomatic, 33% (95% CI: 23%-43%; I2 = 95.6%) mild and 51% (95% CI: 42%-61%; I2 = 93.4%) moderate. The typical clinical manifestations were fever 51% (95% CI: 45%-57%; I2 = 78.9%) and cough 41% (95% CI: 35%-47%, I2 = 81.0%). The common laboratory findings were normal white blood cell 69% (95% CI: 64%-75%; I2 = 58.5%), lymphopenia 16% (95% CI: 11%-21%; I2 = 76.9%) and elevated creatine-kinase MB 37% (95% CI: 25%-48%; I2 = 59.0%). The frequent imaging features were normal images 41% (95% CI: 30%-52%; I2 = 93.4%) and ground-glass opacity 36% (95% CI: 25%-47%; I2 = 92.9%). Among children under 1 year old, critical cases account for 14% (95% CI: 13%-34%; I2 = 37.3%) that should be of concern. In addition, vomiting occurred in 33% (95% CI: 18%-67%; I2 = 0.0%) cases that may also need attention. Pediatric patients with COVID-19 may experience milder illness with atypical clinical manifestations and rare lymphopenia. High incidence of critical illness and vomiting symptoms reward attention in children under 1 year old.",2019-nCoV; COVID-19; SARS-CoV-2; children; coronavirus; meta-analysis.,Xiaojian Cui;Zhihu Zhao;Tongqiang Zhang;Wei Guo;Wenwei Guo;Jiafeng Zheng;Jiayi Zhang;Cuicui Dong;Ren Na;Lisheng Zheng;Wenliang Li;Zihui Liu;Jia Ma;Jinhu Wang;Sijia He;Yongsheng Xu;Ping Si;Yongming Shen;Chunquan Cai,covid-19
https://pubmed.ncbi.nlm.nih.gov/3221143/,Diabetes insipidus in severely brain damaged children,"Nineteen children aged four months to 15 years with diabetes insipidus (DI) secondary to severe brain insults were studied. The main primary brain insult was severe head injury in 12, anoxic ischemic brain damage in four, encephalitis in two, Reye's syndrome in one. Sixteen children died, and three survived. The time from insult to onset of polyuria varied from several hours to one month, and was significantly shorter in head trauma patients, 1.8 +/- 0.9 vs. 9.3 +/- 1.9 days for patients with anoxic ischemic brain damage (p less than 0.03). Twelve of the 19 patients met the criteria for brain death at onset of DI. Treatment by appropriate fluids and vasopressin resulted in resolution of polyuria and increase in urine osmolality. Ten patients developed DI while being treated with dopamine for hemodynamic support. In two of these patients, the cessation of dopamine was time-related to the resolution of DI. Our results indicate that as many as 15% of children with DI (with 95% confidence) following severe brain injury may survive. Hence, despite the overall poor prognosis, its occurrence does not necessarily indicate brain death.",,Z Barzilay;E Somekh,diabetes
https://pubmed.ncbi.nlm.nih.gov/33645512/,Postoperative Copeptin as a Biomarker for Development of Diabetes Insipidus Following Hypothalamic-Pituitary Surgery,Objective: Copeptin is a surrogate marker of arginine vasopressin release with better stability and simplicity of measurement. Postoperative copeptin levels may guide clinicians in stratifying patients who need close monitoring of fluid balance. The objective is to determine whether copeptin is a predictive marker of postoperative diabetes insipidus (DI).,Diabetes insipidus; ROC curve; diagnosis; hypernatremia; osmolar concentration; polyuria.,Amporn Vanasuntorn;Ake Hansasuta;La-Or Chailurkit;Chutintorn Sriphrapradang,diabetes
https://pubmed.ncbi.nlm.nih.gov/30192302/,Melanoma diagnosis: predictive value of macroscopic changes observed by the patient,"About half of the melanomas are detected by patients but the mean thickness of such melanomas is higher than when diagnosed by physicians. Symptoms and signs described by patients are dynamic changes and pruritus, the appearance of a new lesion having been rarely investigated. These observations are documented for melanomas but not for benign naevi. To the best of our knowledge, this is the first study in which both melanomas and suspected excised naevi were included. The main objectives were to (a) analyse the value of the anamnestic predictors for melanoma versus non-melanoma and (b) calculate the influence of age on the most significant anamnestic predictors. In order to reach these objectives, we prospectively collected data on symptoms (pruritus, anxiety) and signs (de novo appearance, dynamic changes and bleeding) described by patients undergoing the excision of lesions clinically diagnosed as melanocytic and considered as suspicious by 46 Belgian dermatologists. Among 1865 lesions, dynamic changes and de novo appearance were significant predictors for melanoma versus non-melanoma diagnosis in all patients and patients older than 50, respectively. More precisely, dynamic changes and de novo appearance occurred to be strong predictors for melanoma diagnosis in patients greater than 41.5 and greater than 44.5 years, respectively. Pruritus was not significant for melanoma diagnosis. As a conclusion, when mid-age or older patients observe melanocytic lesions as recently changed or newly appeared, such lesions should be considered more carefully than when observed by young patients.",,Isabelle Tromme;Laurine Sacré;Fatima Hammouch;Pauline Richez;Jean-Marie Degryse;Niko Speybroeck,melanoma
https://pubmed.ncbi.nlm.nih.gov/19463628/,Accessory liver lobe in the left thoracic cavity,"Accessory liver of the thoracic cavity is usually asymptomatic, and its incidental detection is extremely rare. In this study, an unusual case of an accessory liver lobe of the thoracic cavity in a 26-year-old woman is described. A chest roentgenogram and thoracic computed tomographic scan revealed a mass in the left thoracic cavity. Left posterolateral thoracotomy was performed by removing a 10 x 8 x 5 cm(3) mass separated from lung. The arterial and venous supply of the mass originated from the abdomen. The diaphragm was found to be intact. The pathologist reported a normal hepatic tissue. This report presented a very rare occurrence of accessory liver in the thoracic cavity.",,Serdar Han;Lutfi Soylu,chest
https://pubmed.ncbi.nlm.nih.gov/29738756/,Endobronchial Ultrasound Elastography Differentiates Intrathoracic Lymph Nodes: A Meta-Analysis,"Background: In this study, we investigated the clinical significance of endobronchial ultrasound elastography for differentiating malignant and benign intrathoracic lymph nodes.",,Ye-Feng Chen;Xiao-Wei Mao;Yu-Jun Zhang;Chun-Yi Zhang;Yue-Fang Yu;E Qin;Xing Chen;Ju-Xin Shen,chest
https://pubmed.ncbi.nlm.nih.gov/23078407/,Trends in the diagnosis of melanoma at a university center over time,Background and objectives: The aim of this study is to show data regarding trends in the diagnosis of melanoma over the last ten years by looking at the University Clinic of Dermatology in Vienna as an example.,,Philipp Tschandl;Hubert Pehamberger;Harald Kittler,melanoma
https://pubmed.ncbi.nlm.nih.gov/16928976/,Percutaneous thoracic drainage in neonates: catheter drainage versus treatment with aspiration alone,Purpose: To retrospectively compare thoracic drainage in neonates by using catheter and aspiration techniques.,,Ryan Margau;Joao G Amaral;Peter G Chait;Justine Cohen,chest
https://pubmed.ncbi.nlm.nih.gov/11930886/,Unpredictability of lymphatic drainage patterns in melanoma patients,"We analysed the localisations of sentinel nodes (SN) found with the SN procedure to compare these sites with those that would have been predicted by conventional clinical descriptions of cutaneous lymphatic drainage. We assessed the surplus value of performing the SN procedure in melanoma patients who underwent regional nodal surgery. The SN procedure was performed in 348 patients with melanomas who were referred to our institute between 1993 and 1999. The localisations of the melanomas with the corresponding SNs were meticulously recorded on drawings of the human body and grouped according to the conventional descriptions. Predictability of lymph drainage was defined as the percentage of melanomas whose draining pattern was to the ipsilateral nearest basin, without simultaneous drainage to other basins or to an interval node. In all patients the SN procedure visualised at least one SN. We found 410 lymphatic basins in 347 patients. These basins included basins that could not have been predicted by the conventional clinical descriptions, such as multiple basins and contralateral drainage sites. For the head/neck region, SNs could be found in any of the basins described in the literature. The trunk's drainage predictability depended strongly on the melanoma localisation, ranging from 0% in the midline to 92% in one of the upper quadrants. The lower extremities had a high predictability of almost 100%, and predictability of drainage for the upper extremities ranged from 77% to 100%. In total, 34% of the patients had a cutaneous lymphatic drainage that was unpredictable, either totally or partially. We therefore conclude that an SN procedure is indispensable if the drainage site(s) are to be accurately identified.",,Markwin G Statius Muller;Feitse A Hennipman;Paul A M van Leeuwen;Rik Pijpers;Ronald J Vuylsteke;Sybren Meijer,melanoma
https://pubmed.ncbi.nlm.nih.gov/33674285/,Portable RT-PCR System: a Rapid and Scalable Diagnostic Tool for COVID-19 Testing,"Combating the ongoing coronavirus disease 2019 (COVID-19) pandemic demands accurate, rapid, and point-of-care testing with fast results to triage cases for isolation and treatment. The current testing relies on reverse transcriptase PCR (RT-PCR), which is routinely performed in well-equipped laboratories by trained professionals at specific locations. However, during busy periods, high numbers of samples queued for testing can delay the test results, impacting efforts to reduce the infection risk. Besides, the absence of well-established laboratories at remote sites and low-resourced environments can contribute to a silent spread of severe acute respiratory syndrome coronavirus 2 (SARS-CoV-2). These reasons compel the need to accommodate point-of-care testing for COVID-19 that meets the ASSURED criteria (affordable, sensitive, specific, user-friendly, rapid and robust, equipment-free, and deliverable). This study assessed the agreement and accuracy of the portable Biomeme SARS-CoV-2 system against the gold standard tests. Nasopharyngeal and nasal swabs were used. Of the 192 samples tested using the Biomeme SARS-CoV-2 system, the results from 189 samples (98.4%) were in agreement with the reference standard-of-care RT-PCR testing for SARS-CoV-2. The portable system generated simultaneous results for nine samples in 80 min with high positive and negative percent agreements of 99.0% and 97.8%, respectively. We performed separate testing in a sealed glove box, offering complete biosafety containment. Thus, the Biomeme SARS-CoV-2 system can help decentralize COVID-19 testing and offer rapid test results for patients in remote and low-resourced settings.",Biomeme; COVID-19; RT-PCR; point-of-care; portable.,Hosam M Zowawi;Thamer H Alenazi;Waleed S AlOmaim;Ahmad Wazzan;Abdullah Alsufayan;Rihab A Hasanain;Omar S Aldibasi;Sahar Althawadi;Sarah A Altamimi;Maysoon Mutabagani;Maha Alamri;Reem S Almaghrabi;Hail M Al-Abdely;Ziad A Memish;Saleh A Alqahtani,covid-19
