link,title,abstract,tag,author,keyword
https://pubmed.ncbi.nlm.nih.gov/25614480/,Assessment of spontaneous hemopneumothorax: Indications for surgery,"Background: Although spontaneous hemopneumothorax is rare, emergency surgery may be necessary if massive bleeding is present.",Arteriovenous malformations; hemopneumothorax; lung; thoracic surgery; thoracostomy; video-assisted.,Kenji Inafuku;Takamitsu Maehara;Taketsugu Yamamoto;Munetaka Masuda,chest
https://pubmed.ncbi.nlm.nih.gov/8896656/,Retinol-binding protein and transferrin in urine. New markers of renal function in essential hypertension and white coat hypertension?,"We studied the 24 h urinary excretion of albumin, transferrin, immunoglobulin G, and retinol-binding protein in individuals with essential hypertension, white coat hypertension, and normotension. In 56 individuals, we measured the 24 h ambulatory blood pressure (AMBP). The individuals could be divided into three groups: 26 hypertensives, 14 white coat hypertensives, and 16 normotensives. Daytime AMBP values were (median values with range in parentheses, mm Hg): hypertensives 158/105 (198 to 121/95 to 120), white coat hypertensives 141/83 (161 to 129/72 to 90), and normotensives 123/75 (148 to 102/63 to 86). We determined with immunochemical methods the 24 h urinary excretions of albumin, transferrin, and immunoglobulin G, all markers of glomerular dysfunction, and retinol-binding protein, a marker of impaired proximal tubular function. We found a significantly higher excretion of albumin and transferrin in hypertensives (P < .0000/P < .0001) and in white coat hypertensives (P < .003/P < .02) compared to normotensives. Out of 26 hypertensives, seven had microalbuminuria (> or = 30 to < 300 mg albumin/ 24 h). Two cases of microalbuminuria were found among the 14 white coat hypertensives. Immunoglobulin G excretion was not significantly increased in any of the hypertensive groups. Retinol-binding protein excretion was significantly higher in hypertensive patients (P < .007), whereas no elevation was observed in persons with white coat hypertension. In hypertensives, a significant correlation was found between urinary excretion of albumin and transferrin and office blood pressure and systolic AMBP. There was no significant correlation between the urinary excretions of IgG and retinol-binding protein and blood pressures in any of the three groups. Our findings indicate that patients with white coat hypertension, like hypertensives, have a selective type of glomerular dysfunction. However, proximal tubular dysfunction was seen only in hypertensives. Urinary excretions of albumin, transferrin, and retinol-binding protein may be useful as markers of glomerular and tubular dysfunction in essential hypertension.",,L E Bang;J Holm;T L Svendsen,hypertension
https://pubmed.ncbi.nlm.nih.gov/1325524/,Difficulties in diagnosing hypertension: implications and alternatives,Objective: To estimate the magnitude of misclassification rates with commonly used algorithms for the detection of hypertensives and to suggest a sequential approach to screening.,,H M Perry Jr;J P Miller,hypertension
https://pubmed.ncbi.nlm.nih.gov/24158232/,Is a small-bore catheter efficient for most pleural pathologies?,"Purpose: Chest tubes are used for drainage of the pleural cavity. Traditionally, large-bore catheters are inserted for all indications, but there has been a recent tendency to use small-bore catheters. We share the results of our experience of using small-bore catheters for almost all indications routinely in our clinic.",,Serife Tuba Liman;Aykut Elicora;Aslı Gul Akgul;Salih Topcu;Serkan Ozbay;Seymur Salih Mehmetoğlu;Fatih Sezer;Can Koska;Ahmet Ilgazli,chest
https://pubmed.ncbi.nlm.nih.gov/33575241/,Sensitivity of SARS-CoV-2 Detection With Nasopharyngeal Swabs,"Background: SARS-CoV-2-infected subjects have been proven contagious in the symptomatic, pre-symptomatic and asymptomatic phase. The identification of these patients is crucial in order to prevent virus circulation. No reliable data on the sensitivity of nasopharyngeal swabs (NPS) are available because of the lack of a shared reference standard to identify SARS-CoV-2 infected patients. The aim of our study was to collect data on patients with a known diagnosis of COVID-19 who underwent serial testing to assess NPS sensitivity. Methods: The study was a multi-center, observational, retrospective clinical study with consecutive enrollment. We enrolled patients who met all of the following inclusion criteria: clinical recovery, documented SARS-CoV-2 infection (≥1 positive rRT-PCR result) and ≥1 positive NPS among the first two follow-up swabs. A positive NPS not preceded by a negative nasopharyngeal swab collected 24-48 h earlier was considered a true positive. A negative NPS followed by a positive NPS collected 24-48 h later was regarded as a false negative. The primary outcome was to define sensitivity of SARS-CoV-2 detection with NPS. Results: Three hundred and ninety three NPS were evaluated in 233 patients; the sensitivity was 77% (95% CI, 73 to 81%). Sensitivity of the first follow-up NPS (n = 233) was 79% (95% CI, 73 to 84%) with no significant variations over time. We found no statistically significant differences in the sensitivity of the first follow-up NPS according to time since symptom onset, age, sex, number of comorbidities, and onset symptoms. Conclusions: NPS utility in the diagnostic algorithm of COVID-19 should be reconsidered.",COVID-19; diagnosis; false negative (FN); sensitivity; swab analysis.,Bianca Clerici;Antonio Muscatello;Francesca Bai;Donatella Pavanello;Michela Orlandi;Giulia C Marchetti;Valeria Castelli;Giovanni Casazza;Giorgio Costantino;Gian Marco Podda,covid-19
https://pubmed.ncbi.nlm.nih.gov/24384199/,Manubrial-clavicular-chest wall explantation to expose the anterior thoracic inlet,"The anterior thoracic inlet is difficult to access surgically because of the overlying pectoral-shoulder girdle, clavicle, and manubrium. With both the Dartevelle and Grunenwald approaches, retraction of an osteomuscular flap is required, and patients may be left with the functional and aesthetic implications of partial clavicular resection. We describe a novel technique involving manubrial-clavicular-chest wall explantation with preservation and reimplantation. Manubrial and clavicular plating is performed to stabilize the anterior chest wall and clavicle after reimplantation. This approach represents an alternative technique that provides excellent visualization of the entire anterior thoracic inlet.",5.,Christopher W Seder;Bassem T Elhassan;Dennis A Wigle,chest
https://pubmed.ncbi.nlm.nih.gov/29479677/,Temporary spontaneous regression of feline non-Hodgkin's lymphoma,"Case report: A 6-year-old neutered male British Shorthair cat presented with two rapidly growing subcutaneous masses, one over each thoracic wall. High-grade, non-Hodgkin's lymphoma was confirmed following histopathology, immunohistochemistry and PCR analysis for antigen receptor re-arrangements. Following biopsy there was rapid regression of the remaining neoplastic tissue with no medical treatment. The cat relapsed 3 months later, with poor response to therapy, and was euthanased.",cats; lymphoma; spontaneous regression.,J Elliott,chest
https://pubmed.ncbi.nlm.nih.gov/16700319/,Diabetes insipidus in craniopharyngioma: postoperative management of water and electrolyte disorders,"Pre-operative central diabetes insipidus has been reported in 8-35% of patients affected with craniopharyngioma, and in 70-90% after surgery. The management of postoperative polyuria and polydipsia can be challenging and fluid balance needs to be closely monitored. The classical triphasic pattern of endogenous vasopressin secretion--an initial phase of symptomatic diabetes insipidus occurring 24 hours after surgery; a second phase of inappropriate vasopressin secretion potentially causing hyponatraemia; and a third phase with a return to diabetes insipidus occurring up to 2 weeks later--is often complicated by cerebral salt wasting and thirst disorders. Inadequate adrenal replacement therapy and anticonvulsant agent treatment may increase the risk of life-threatening hyponatraemia in the course of desmopressin (DDAVP) treatment. Appropriate management, in order to avoid life-threatening or disabling electrolyte disturbances, requires a good grasp of the relevant pathophysiology. We review here the pathophysiology and management of the multiple fluid disorders encountered following surgery for craniopharyngiomas.",,Stefano Ghirardello;Neil Hopper;Assunta Albanese;Mohamad Maghnie,diabetes
https://pubmed.ncbi.nlm.nih.gov/17593623/,Real-time quantitative reverse transcriptase-polymerase chain reaction analysis of melanoma progression-associated genes,"Background: Melanoma is an aggressive disease that spreads quickly and is resistant to most therapeutic agents. In an effort to provide insight into the molecular basis of melanoma progression, the expression of 94 genes in 20 metastatic melanomas using a high-throughput real-time quantitative RT-PCR assay was analysed.",,Mairin Rafferty;William J Faller;Catherine Moss;Janet McCormack;Gunhild M Mãlandsmo;David J Easty;William M Gallagher,melanoma
https://pubmed.ncbi.nlm.nih.gov/8237283/,[The role of current diagnostic measures in hypertension],The problems in diagnostic steps in the hypertensive patient can be grouped in 4 categories: the etiological evaluation concentrates recently especially on renovascular hypertension since. This disorder is getting more common with the ageing population and since diagnosis and treatment have been simplified; the detection of additional risk factors is important to guide individual drug selection; the detection of organ manifestations (e.g. LVH) may help in the therapeutic decision especially in borderline hypertensives; ambulatory blood pressure monitoring is becoming increasingly used despite the lack of standardized and generally accepted means to evaluate the recorded data.,,P Kühn,hypertension
https://pubmed.ncbi.nlm.nih.gov/6573653/,Diabetes insipidus as a complication of acute myelomonocytic leukaemia,"A female patient, aged 44, with diabetes insipidus as a complication of acute myelomonocytic leukaemia (AMML) is described. She presented with bleeding, anaemia, polyuria and polydypsia. She was treated with intranasal vasopressin for diabetes insipidus and responded well to treatment. Chemotherapy was administered for the leukaemia and a full remission was achieved. The patient relapsed a few days before final admission to hospital and died of septicaemia 7 months after initial diagnosis. A short review of the literature related to this subject is also presented.",,D Philippakos;S Kakouros;J Dervenoulas;E Pontidas,diabetes
https://pubmed.ncbi.nlm.nih.gov/20235031/,[Lymphadenopathy and diabetes insipidus - association],"We report the case of a 62 year old women with chronic idiopathic myelofibrosis who developed acute lymphadenopathy. At the same time diabetes insipidus, osteolytic bone lesions and exanthema of the skin were diagnosed. Suspected Langerhans cell histiocytosis could be proven by repeated biopsies of affected organs. Therapy was started in accordance with the recommendations of the Histiocyte Society.",,R Zahnd;A Oestmann;M Ebnöther,diabetes
https://pubmed.ncbi.nlm.nih.gov/32876570/,"A comparison of clinical, laboratory and chest CT findings of laboratory-confirmed and clinically diagnosed COVID-19 patients at first admission","Purpose: This study aims to identify chest computed tomography (CT) characteristics of coronavirus disease 2019 (COVID-19), investigate the association between CT findings and laboratory or demographic findings, and compare the accuracy of chest CT with reverse transcription-polymerase chain reaction (RT-PCR).",,Taha Yusuf Kuzan;Kübra Murzoğlu Altıntoprak;Hatice Özge Çiftçi;Umut Ergül;Nur Betül Ünal Özdemir;Muhammet Bulut;Nurettin Yiyit,covid-19
https://pubmed.ncbi.nlm.nih.gov/33446823/,In vivo multimodal optical imaging of dermoscopic equivocal melanocytic skin lesions,"There is a wide range of equivocal melanocytic lesions that can be clinically and dermoscopically indistinguishable from early melanoma. In the present work, we assessed the possibilities of combined using of multiphoton microscopy (MPM) and optical coherence angiography (OCA) for differential diagnosis of the equivocal melanocytic lesions. Clinical and dermoscopic examinations of 60 melanocytic lesions revealed 10 benign lesions and 32 melanomas, while 18 lesions remained difficult to diagnose. Histopathological analysis of these lesions revealed 4 intradermal, 3 compound and 3 junctional nevi in the ""benign"" group, 7 superficial spreading, 14 lentigo maligna and 11 nodular melanomas in the ""melanoma"" group and 2 lentigo simplex, 4 dysplastic nevi, 6 melanomas in situ, 4 invasive lentigo melanomas and 2 invasive superficial spreading melanomas in the ""equivocal"" group. On the basis of MPM, a multiphoton microscopy score (MPMS) has been developed for quantitative assessment of melanoma features at the cellular level, that showed lower score for benign lesions compare with malignant ones. OCA revealed that the invasive melanoma has a higher vessel density and thicker blood vessels than melanoma in situ and benign lesions. Discriminant functions analysis of MPM and OCA data allowed to differentiate correctly between all equivocal melanocytic lesions. Therefore, we demonstrate, for the first time, that a combined use of MPM and OCA has the potential to improve early diagnosis of melanoma.",,V Elagin;E Gubarkova;O Garanina;D Davydova;N Orlinskaya;L Matveev;I Klemenova;I Shlivko;M Shirmanova;E Zagaynova,melanoma
https://pubmed.ncbi.nlm.nih.gov/15579748/,Posterior pituitary dysfunction after traumatic brain injury,"Disorders of water balance are well recognized after traumatic brain injury (TBI), but there are no reliable data on their true prevalence in post-TBI patients. We aimed to evaluate the prevalence of posterior pituitary dysfunction in a large cohort of survivors of TBI. One hundred two consecutive patients (85 males) who suffered severe or moderate TBI were evaluated for diabetes insipidus (DI) at a median of 17 months (range 6-36 months) after the event, using the 8-h water deprivation test (WDT). Their results were compared against normative data obtained from 27 matched, healthy controls. Patients' medical records were retrospectively reviewed for the presence of abnormalities of salt and water balance in the immediate post-TBI period. Twenty-two patients (21.6%) developed DI in the immediate post-TBI period (acute DI group), of whom five had abnormal WDT on later testing. In total, seven patients (6.9%) had abnormal WDT (permanent DI group), five of whom had partial DI. Patients in the acute and permanent DI groups were more likely to have more severe TBI, compared with the rest of the cohort (P < 0.05). In the immediate post-TBI period, 13 patients (12.9%) had syndrome of inappropriate secretion of antidiuretic hormone, which persisted in one patient, and one other patient developed cerebral salt wasting. Diabetes insipidus and syndrome of inappropriate secretion of antidiuretic hormone were common in the immediate post-TBI period. Permanent DI was present in 6.9% of patients who survived severe or moderate TBI, which is higher than traditionally thought. Identification of patients with partial posttraumatic DI is important because appropriate treatment may reduce morbidity and optimize the potential for recovery.",,Amar Agha;Evan Thornton;Patrick O'Kelly;William Tormey;Jack Phillips;Christopher J Thompson,diabetes
https://pubmed.ncbi.nlm.nih.gov/20549054/,[Choroidal and ciliary body melanoma: case report],"Ocular melanomas correspond to 5% of all melanomas and 85% of them have its origin in the uveal tract. Uveal melanoma is the most common primary intraocular malignant tumor in the adult. In this article, a case of uveal melanoma in a 31 year-old female patient, with photopsia, hyperemia and low visual acuity in the left eye with evolution of 4 months is presented. In the ophthalmologic examination, visual acuity was lower than 20/400, a large tumoral mass was noted at the nasal region behind the iris with anterior lens displacement, anterior chamber narrowing and serous retinal detachment. The ocular echography suggested a large tumoral mass as a choroidal melanoma extending to the ciliary body. The confirmation diagnosis was possible through the histopathologic examination.",,Aline Amaral Fulgêncio da Cunha;Nara Helena Teixeira Rodrigues;Grazziella Acácio E Almeida;Bruno Carvalho Picanço;João Agostini Netto,melanoma
https://pubmed.ncbi.nlm.nih.gov/12431131/,"Diabetes insipidus in children: pathophysiology, diagnosis and management","In diabetes insipidus, the amount of water ingested and the quantity and concentration of urine produced needs to be carefully regulated if fluid volume and osmolality are to be maintained within the normal range. One of the principal mechanisms controlling urine output is vasopressin which is released from the posterior pituitary gland and enhances water reabsorption from the renal collecting duct. In diabetes insipidus, the excessive production of dilute urine, and the causes of this clinical picture can be divided into three main groups: the first is primary polydipsia where the amount of fluid ingested is inappropriately large; the second group is cranial diabetes insipidus where the production of vasopressin is abnormally low; and, the third group is nephrogenic diabetes insipidus where the kidney response to vasopressin is impaired. The history and examination may suggest an underlying explanation for diabetes insipidus but a range of baseline and more extensive investigations may be required before a diagnosis can be reached. These investigations are not without risk, and the results need to be interpreted carefully because children do not always segregate neatly into a particular diagnostic category on the basis of one test alone. Children with cranial diabetes insipidus typically respond to arginine vasopressin or its manufactured analogue, desmopressin, with an increase in urine osmolality and an associated reduction in urine output. Such children usually require neuroimaging to look for evidence of evolving CNS pathology, such as an intracranial tumour. Vasopressin ""replacement"" with desmopressin is the treatment of choice in patients with cranial diabetes insipidus although extreme caution is required when treating babies or small children because of the danger of fluid overload. Abnormal production of other pituitary hormones in children with CNS disease can also influence fluid balance. Nephrogenic diabetes insipidus can be due to abnormal electrolyte concentrations, therefore these should be measured as part of the initial assessment. In a small number of children the defect is a primary abnormality of the vasopressin receptor or one of the water channel proteins (aquaporins) involved in water transport. The treatment of these patients is difficult and typically involves therapy with a diuretic such as chlorothiazide, as well as indomethacin. These agents enhance urine osmolality by their effect on circulating volume and renal solute and water handling. The fluid intake of most young children with primary polydipsia can be safely reduced to a more appropriate level.",,Tim Cheetham;Peter H Baylis,diabetes
https://pubmed.ncbi.nlm.nih.gov/1003172/,[Hereditary optic atrophies],"Congenital or infantile autosomal recessive optic atrophy is rare. The autosomal recessive syndrome of optic atrophy associated with diabetes is less rare. Dominant juvenile optic atrophy occurs frequently. Behr's heredo-familial optic atrophy, with its neurological mainfestations and its recessive autosomal inheritance, is rare. Sex-linked optic atrophy is exceptional. Leber's optic neuritis occurs frequently. Its heredity is apparently sex-linked, but no classical mode of transmission can be applied. Cytoplasmic heredity is the most probable.",,J Francois,diabetes
https://pubmed.ncbi.nlm.nih.gov/691204/,"Evaluation of a new antidiuretic agent, desmopressin acetate (DDAVP)",Desmopressin acetate is a synthetic vasopressin analogue administered by the intranasal route. It is long-acting and well tolerated and may be the agent of choice for treating central diabetes insipidus.,,M E Kosman,diabetes
https://pubmed.ncbi.nlm.nih.gov/10779095/,Headache in patients with mild to moderate hypertension is generally not associated with simultaneous blood pressure elevation,"Objective: Although headache is regarded a symptom of hypertension, its relation to blood pressure, especially in mild and moderate hypertension, is not clear. Thus, the aim of the study was to investigate whether headache in patients with mild to moderate hypertension may be attributed to simultaneous elevations in blood pressure.",,P Kruszewski;L Bieniaszewski;J Neubauer;B Krupa-Wojciechowska,hypertension
https://pubmed.ncbi.nlm.nih.gov/34024060/,[COVID-19 Vaccination for Cancer Patients: Progress and Preliminary Recommendations],"The pandemic of coronavirus disease 2019 (COVID-19) has had a serious impact on global health. COVID-19 vaccines may be one of the most effective measure to end the pandemic. High infection risk and higher serious incident and mortality rates have been shown in cancer patients with COVID-19. Therefore, cancer patients should be the priority group for COVID-19 prevention. Until now, data of COVID-19 vaccination for cancer patients is lacking. We review the interim data of safety and immune-efficacy of COVID-19 vaccination in cancer patients based on the latest studies. Due to the complicated immune systems of cancer patients caused by the malignancy and anticancer treatments, we proposed preliminary specific COVID-19 vaccination recommendations for cancer patients with different anticancer treatments and at different stages of the disease. Preventing COVID-19 with vaccinations for cancer patients is crucial, and we call for more large-scale clinical trials and real-world studies, for further COVID-19 vaccination recommendations development. .",,Luo Wang;Yan Xu;Lu Zhang;Junping Fan;Ruili Pan;Jinglan Wang;Mengzhao Wang,covid-19
https://pubmed.ncbi.nlm.nih.gov/2197875/,Indomethacin treatment for polyhydramnios and subsequent infantile nephrogenic diabetes insipidus,"A case of polyhydramnios was effectively treated with amniotic fluid decompression and indomethacin. Six months later nephrogenic diabetes insipidus was diagnosed and indomethacin was again effectively used. By reducing urine output, indomethacin controlled both in utero and extrauterine polyuria in this patient.",,L G Smith Jr;B Kirshon;D B Cotton,diabetes
https://pubmed.ncbi.nlm.nih.gov/8450519/,Platelet intracellular pH and glucose metabolism in hypertensive patients,"Intracellular platelet pH was studied by the BCECF fluorescent pH-sensitive intracellular indicator method in 52 patients with essential hypertension and 42 control subjects of similar age and sex. In 40 hypertensive patients studied by oral glucose tolerance test (standard OGTT) 23 presented with pathological blood glucose and plasma insulin values. Intracellular pH was on average higher in hypertensives (7.415 +/- 0.114, mean +/- SD) than in controls (7.348 +/- 0.109, P < 0.05), although there was a considerable overlap in values. In the group of hypertensive patients, no difference was observed between those with normal and those with pathological OGTT. There was also no significant correlation between intracellular pH and blood glucose, plasma insulin after OGTT, plasma cholesterol and triglycerides, age, BP or body mass index. These data are consistent with an anomaly of intraplatelet pH, perhaps owing to alteration of Na+/H+ exchange in essential hypertension, but do not indicate that this is related to a condition of hyper-insulinaemia or insulin resistance.",,C Lechi;E Arosio;M Zannoni;P Guzzo;P Delva;G Montesi;A Lechi,hypertension
https://pubmed.ncbi.nlm.nih.gov/26689234/,Clinical Investigation of Benign Asbestos Pleural Effusion,"There is no detailed information about benign asbestos pleural effusion (BAPE). The aim of the study was to clarify the clinical features of BAPE. The criteria of enrolled patients were as follows: (1) history of asbestos exposure; (2) presence of pleural effusion determined by chest X-ray, CT, and thoracentesis; and (3) the absence of other causes of effusion. Clinical information was retrospectively analysed and the radiological images were reviewed. There were 110 BAPE patients between 1991 and 2012. All were males and the median age at diagnosis was 74 years. The median duration of asbestos exposure and period of latency for disease onset of BAPE were 31 and 48 years, respectively. Mean values of hyaluronic acid, adenosine deaminase, and carcinoembryonic antigen in the pleural fluid were 39,840 ng/mL, 23.9 IU/L, and 1.8 ng/mL, respectively. Pleural plaques were detected in 98 cases (89.1%). Asbestosis was present in 6 (5.5%) cases, rounded atelectasis was detected in 41 (37.3%) cases, and diffuse pleural thickening (DPT) was detected in 30 (27.3%) cases. One case developed lung cancer (LC) before and after BAPE. None of the cases developed malignant pleural mesothelioma (MPM) during the follow-up.",,Nobukazu Fujimoto;Kenichi Gemba;Keisuke Aoe;Katsuya Kato;Takako Yokoyama;Ikuji Usami;Kazuo Onishi;Keiichi Mizuhashi;Toshikazu Yusa;Takumi Kishimoto,chest
