link,title,abstract,tag,author,keyword
https://pubmed.ncbi.nlm.nih.gov/10408346/,Tumor microvessels in melanoma express the beta-2 chain of laminin. Implications for melanoma metastasis,"The ultrastructural localization of an amorphous matrix to the interface between microvessel endothelium and tumor cells has been recently reported in a series of melanomas. Laminin expression as documented by immunohistochemistry was localized to microvessels in melanomas showing the amorphous matrix. In order to identify more precisely the type of laminin present in this amorphous material, immunostaining was carried out on cryostat sections from 16 human melanoma specimens. Four murine monoclonal antibodies directed against the alpha-3, beta-2, beta-3 and gamma-2 laminin chains were employed. In the melanomas studied, alpha3, beta3 and gamma2 laminin chains showed only minimal focal vascular positivity. In contrast, the beta2 (16/16 cases) laminin chain exhibited a consistent positivity in an angiocentric pattern about tumor microvessels. In all melanomas, some tumor cells seemed to spread along the abluminal surface of the small vessels, exhibiting a pericytic location, particularly along the intratumoral projections formed by the beta2 laminin chain. Given the role of laminin in migration and tumor progression, the results suggest a role of the beta2 laminin chain in melanoma spread, promoting tumor migration along the abluminal surface of vessel, a phenomenon which has been termed extra-vascular migratory metastasis.",,C Lugassy;A Shahsafaei;P Bonitz;K J Busam;R L Barnhill,melanoma
https://pubmed.ncbi.nlm.nih.gov/3406674/,Meningococcal meningitis and diabetes insipidus,"A 20-year-old woman with a transient diabetes insipidus as a complication to meningococcal meningitis is presented. This condition has only been described once before. Culture of blood and spinal fluid yielded Neisseria meningitidis group B, sensitive to penicillin. The diabetes insipidus arose on day 4 after admission and continued to day 15. Treatment comprised benzylpenicillin, DIC therapy, assisted ventilation, and vasopressin.",,C Christensen;A Bank,diabetes
https://pubmed.ncbi.nlm.nih.gov/33335084/,Characteristics of Nosocomial Infections in Children Screened for SARS-CoV-2 Infection in China,"BACKGROUND This study summarizes the characteristics of children screened for severe acute respiratory syndrome coronavirus 2 (SARS-CoV-2) infection and reports the case of 1 child who was diagnosed with SARS-CoV-2 infection in Guangzhou Women and Children's Medical Center and the cases of his family members. MATERIAL AND METHODS The medical records of 159 children who were admitted to our hospital from January 23 to March 20, 2020, were retrospectively analyzed. Samples from pharyngeal or/and anal swabs were subjected to reverse-transcription polymerase chain reaction (RT-PCR) testing for SARS-CoV-2 within 12 h of patient admission; a second RT-PCR test was done 24 h after the first test. RESULTS Of the 159 patients, 151 patients had epidemiological histories, 14 patients had cluster onset, and 8 patients had no epidemiological history but had symptoms similar to coronavirus disease 2019 (COVID-19). The most common symptom was fever (n=125), followed by respiratory and gastrointestinal symptoms. A 7-year-old boy in a cluster family from Wuhan was confirmed with asymptomatic SARS-CoV-2 infection with ground-glass opacity shadows on his lung computed tomography scan, and his swab RT-PCR test had not turned negative until day 19 of his hospitalization. In patients who did not test positive for SARS-CoV-2, influenza, respiratory syncytial virus, and adenovirus were observed. A total of 158 patients recovered, were discharged, and experienced no abnormalities during follow-up. CONCLUSIONS For SARS-CoV-2 nosocomial infections, taking a ""standard prevention & contact isolation & droplet isolation & air isolation"" strategy can prevent infection effectively. Children with clustered disease need close monitoring.",,Jun Shen;Jing Sun;Danyang Zhao;Suyun Li;Weiqiang Xiao;Xian Cai;Jianjiang Yan;Weidong Zhu;Qiaozhi Guo;Xiulan Wen;Jinxia Wu;Xuan Shi;Daoju Jiang;Jing Huang;Jiaming Luo;Huan Chen;Yan Hong;Wencheng Ma;Guangming Liu;Haomei Yang;Qiang Wang;Yongling Song;Jinai Lin;Xin Sun;Peiqing Li,covid-19
https://pubmed.ncbi.nlm.nih.gov/7912651/,"[Arterial hypertension, stress, and beta-blockers]","There is strong circumstantial evidence supporting the hypothesis that essential arterial hypertension is associated at least initially, with an augmented sympathetic activity. The link between the sympathetic nervous system and the hypertensive state is further supported by the clinical evidence furnished by the efficacy of drugs interfering with sympathetic control. In this lecture we address the role of behavioral and mental factors, globally indicated with the word ""stress"", that may contribute to the initiation and maintenance of the hypertensive condition. At the core of this approach, there is the view that, operationally, mental stress could be conveniently substituted by some quantification of the sympathetic activity (in its continuous balance with vagal modulation). In our laboratory we employ the normalized power of the low frequency (LF, 0.1 Hz) component of the autospectra of RR interval variability as an index of sympathetic drive. In hypertensives at rest there is a prevalence of LF (as compared to the HF, high frequency, component, which is a marker of vagal activity). Additionally the responsiveness to both physical and mental stimuli is diminished. After chronic beta-adrenergic blockade, the spectral profile, and its responsiveness, returns toward normal. Furthermore the gain of baroreflex mechanisms (obtained with cross spectral analysis of RR interval and systolic arterial pressure variability) is also increased by atenolol treatment. We conclude that this approach may permit a better quantification of the role played by behavioral and mental factors in essential hypertension, and help to define individualized treatments.",,M Pagani,hypertension
https://pubmed.ncbi.nlm.nih.gov/465186/,[Short stature and nephrogenic diabetes insipidus. Report of a clinical case],"A male child who was initially studied as a short stature syndrome, was found to have a severe picture of polyuria-polydipsia. The routine tests for dehydration and vasopressin administration were carried out and the results obtained were fully demonstrative of a lack of renal response to the administration of vasopressin.",,M T Lechuga Medina;P Jiménez Ortiz;A Loredo Abdalá;L Carbajal Rodríguez;C Vidales Bayona,diabetes
https://pubmed.ncbi.nlm.nih.gov/33610783/,Collection of lower respiratory specimen by bronchoscopy for the diagnosis of COVID-19,"Bronchoscopy, as an aerosol-generating procedure, is not routinely performed in patients with high-risk of coronavirus disease-2019 (COVID-19) owing to potential transmission to healthcare workers. However, to obtain lower respiratory specimens from bronchoscopy with bronchoalveolar lavage (BAL) is necessary to confirm COVID-19 or other diagnosis that will change clinical management. We report a case of diagnostic difficulty with five negative SARS-CoV-2 RT-PCR testing in four upper respiratory tract and one stool samples following presentation with fever during the quarantine period and a strong epidemiological linkage to an index patient with COVID-19. The final diagnosis was confirmed by BAL. Special precautions to be taken when performing bronchoscopy in high-risk non-intubated patients were discussed.",Bronchoscopy; COVID-19; Infection control.,Joyce K C Ng;Jenny C L Ngai;Susanna S S Ng;David S C Hui,covid-19
https://pubmed.ncbi.nlm.nih.gov/12609787/,Changes from mid-1980s to late 1990s among clinical and demographic correlates of melanoma thickness,"Tumour thickness is the most relevant prognostic factor for cutaneous melanoma. Although the increasing incidence of melanoma is currently attributable to ""thin"" lesions, the incidence rates of ""thick"" melanomas have not declined. We want to identify the clinical and demographic characteristics of patients that are associated with diagnosis of thick (> 3 mm) cutaneous melanoma and whether they had changed from mid-1980s to late-1990s. Cutaneous malignant melanomas incidence in 1985-87 and in 1995-97 were retrieved from the Tuscany Cancer Registry, central Italy. Only cases with Breslow-thickness information (182/260 in 1985-87 and 387/490 in 1995-97) were included. Thickness was categorised in < = 1 mm, 1-3 mm and > 3 mm. Thickness was evaluated for each period of time according to gender, age, histological type, site and residence. For cases diagnosed in 1995-97 the effect of such variables in predicting the risk of a thick tumour (vs. a thin one) was analysed in a logistic model. In 1985-87 patients with thick melanoma were more likely to be - with a statistically significant difference - males (38.1 % of thick tumours) than females (19.4 %), over 70 (57.7 % of thick tumour), with nodular melanoma (62.1 %) and residents far from the city of Florence (30.3 %); no differences were evidenced according to site. From 1985-87 to 1995-97 there was a global shift towards thinner melanomas. In 1995-97 nodular type and old age were the only variables significantly associated with thick melanomas when other factors were taken into account in a multivariate analysis. According to most recent data, early detection activities should be focused on older patients and on nodular histotype. Male sex and residence was no longer found to be associated with late melanoma diagnosis.",,Emanuele Crocetti;Paolo Carli,melanoma
https://pubmed.ncbi.nlm.nih.gov/17550554/,Patient education and regular surveillance results in earlier diagnosis of second primary melanoma,"Background: As the incidence of cutaneous melanoma continues to rise, more individuals will be at risk for developing second primary melanomas. We hypothesize that patient education and follow-up surveillance will lead to the early detection of subsequent primary melanomas as demonstrated by a decrease in Breslow thickness at diagnosis.",,Annemarie Uliasz;Mark Lebwohl,melanoma
https://pubmed.ncbi.nlm.nih.gov/2267994/,Estrogen receptor status in malignant melanoma,"Estrogen receptor (ER) positivity demonstrated in malignant melanomas by histochemical and biochemical assays suggested the possibility of hormonal management and improved prognosis as for breast carcinoma patients. We studied the ER status of 5 primary and 28 metastatic malignant melanomas with a commercial immunohistochemical kit (ER-ICA monoclonal), that utilizes monoclonal anti-ER and a peroxidase-antiperoxidase technique, and by a histochemical method using fluorescein-conjugated estradiol (Fluoro-Cep Estrogen assay), on frozen sections. In addition, we conducted a biochemical assay [dextran-coated charcoal cytosolic assay (DCC)] in 16 cases. All 33 cases were ER negative by ER-ICA and Fluoro-Cep: 11 biochemical assays were negative (less than 3 fmol ER/mg protein), four were in the borderline range (3 to 10 fmol ER/mg protein), and one was positive (greater than 10 fmol ER/mg protein) at 11 fmol. The melanomas in 97% of the cases we studied were ER negative by two or three different assays. Low-level estrogen binding of MM tissues may be the result of interactions other than with Type I true ER. The low frequency of ER positivity of malignant melanomas appears to preclude the clinical use of ER status as an indicator for response to hormonal manipulation in patients with malignant melanoma.",,C Cohen;P B DeRose;W G Campbell;D C Schlosnagle;D Sgoutas,melanoma
https://pubmed.ncbi.nlm.nih.gov/33649778/,Current molecular and clinical insights into uveal melanoma (Review),"Uveal melanoma (UM) represents the most prominent primary eye cancer in adults. With an incidence of approximately 5 cases per million individuals annually in the United States, UM could be considered a relatively rare cancer. The 90‑95% of UM cases arise from the choroid. Diagnosis is based mainly on a clinical examination and ancillary tests, with ocular ultrasonography being of greatest value. Differential diagnosis can prove challenging in the case of indeterminate choroidal lesions and, sometimes, monitoring for documented growth may be the proper approach. Fine needle aspiration biopsy tends to be performed with a prognostic purpose, often in combination with radiotherapy. Gene expression profiling has allowed for the grading of UMs into two classes, which feature different metastatic risks. Patients with UM require a specialized multidisciplinary management. Primary tumor treatment can be either enucleation or globe preserving. Usually, enucleation is reserved for larger tumors, while radiotherapy is preferred for small/medium melanomas. The prognosis is unfavorable due to the high mortality rate and high tendency to metastasize. Following the development of metastatic disease, the mortality rate increases to 80% within one year, due to both the absence of an effective treatment and the aggressiveness of the condition. Novel molecular studies have allowed for a better understanding of the genetic and epigenetic mechanisms involved in UM biological activity, which differs compared to skin melanomas. The most commonly mutated genes are GNAQ, GNA11 and BAP1. Research in this field could help to identify effective diagnostic and prognostic biomarkers, as well as novel therapeutic targets.",uveal melanoma; staging; treatment; diagnosis; prognosis; biomarkers; epigenetics.,Matteo Fallico;Giuseppina Raciti;Antonio Longo;Michele Reibaldi;Vincenza Bonfiglio;Andrea Russo;Rosario Caltabiano;Giuseppe Gattuso;Luca Falzone;Teresio Avitabile,melanoma
https://pubmed.ncbi.nlm.nih.gov/8896306/,Automated blood pressure measurement (ABPM) in the elderly,"Application and feasibility of automated ambulatory blood pressure measurement (ABPM) in the elderly are comparable to younger age groups. Major side-effects are sleep disturbances and pain during cuff-inflation. The main indications for ABPM are diagnosis and control of treatment in hypertensive patients. Further indications are the diagnosis of syncope or hypotensive disorders and the diagnostic work-up of symptoms like vertigo, dizziness and dyspnea. In hypertensives, ABPM can easily assess the ""white coat"" effect and cases of ""white coat"" hypertension (prevalence in the elderly 15-25%). The prognostic implications of ""white coat"" hypertensions remain to be determined. Recording of the total 24-h blood pressure profile with analysis of circadian blood pressure changes, the day-night difference and the early morning surge raises the possibility to assess age-specific patterns. The drop in blood pressure at night (during sleep) is usually decreased and less frequently observed in elderly hypertensives. Possible explanations include decreased daytime activity, an altered sleep pattern in the elderly and secondary forms of hypertension. So-called ""non-dippers"", with no adequate drop in night-time blood pressure, show a significant increase in cardiovascular complications. Control of treatment via ABPM can assess non-responders and cases of overtreatment, and permits a fairly objective analysis of side-effects. Episodes of transient myocardial ischemia and possible trigger mechanisms can be assessed by simultaneous application of ABPM and Holter monitoring. The insufficient control of hypertension in the majority of elderly patients and the current lower target blood pressures in the elderly call for new methods to improve the level and quality of antihypertensive treatment. Although ABPM provides a closer correlation to target organ damage than measurement of office (casual) blood pressure, and ABPM frequently improves or at least facilitates the care of elderly hypertensive patients, it remains to be determined whether ABPM can finally improve the long-term outcome of these patients.",,P Trenkwalder,hypertension
https://pubmed.ncbi.nlm.nih.gov/20160605/,Thoracolithiasis: 11 cases with a calcified intrapleural loose body,Purpose: To describe clinical and imaging characteristics of thoracolithiasis.,,Fumiko Kinoshita;Yukihisa Saida;Yuka Okajima;Satoshi Honda;Tetsuya Sato;Akira Hayashibe;Sonoe Hiramatsu,chest
https://pubmed.ncbi.nlm.nih.gov/22668533/,Management and follow-up of a patient with Familial Atypical Multiple Mole-Melanoma (FAMMM) Syndrome,"Introduction: Familial Atypical Multiple Mole-Melanoma Syndrome (FAMMM) is an autosomal dominant genodermatosis characterized by the presence of a high number of dysplastic nevi and family history of melanoma or pancreatic cancer. Melanomas in FAMMM patients tend to occur at a younger age, although they are clinically similar to sporadic melanomas in terms of overall survival.",,M G Onesti;N Fallico;M Ciotti;F Pacitti;P Lieto;R Clerico,melanoma
https://pubmed.ncbi.nlm.nih.gov/8358692/,"Hypertension follow-up survey Laval, Quebec, 1988","In 1988, a follow-up study of a group of hypertensives (n = 278), identified two years earlier in a prevalence survey (1986), was conducted. Blood pressure (BP) levels, treatment and control status and medical follow-up were assessed. Subjects were classified as either known hypertensives or newly identified hypertensives. There was a moderate increase in blood pressure control over the two-year period in known hypertensives. Approximately half of newly identified hypertensives remained untreated, uncontrolled; half became ex-hypertensives. One third of the ex-hypertensives, however, still had high-normal diastolic readings (85-89 mm Hg). Newly identified hypertensives reported less frequent medical visits and fewer non-pharmacological recommendations from their physicians than known hypertensives. The study suggests that follow-up and counselling on modifiable risk factors in borderline and mild hypertensives might not be up to recent Canadian and American guidelines.",,L A Pica;M M Boucher;R Grignon;R Guibert;V Déry,hypertension
https://pubmed.ncbi.nlm.nih.gov/32266741/,Radiography and computed tomography of the heart and lower respiratory tract in toco toucans (Ramphastos toco),"This study aimed to evaluate normal features of the heart and lower respiratory tract in toco toucans by means of radiography and helical computed tomography (CT) scanner. Fifteen healthy adult toco toucans (Ramphastos toco), 10 females and 5 males, average body mass of 650 g were studied. CT examination as well as right lateral and ventrodorsal radiographic examinations of the coelomic cavity were performed under chemical restraint. Heart, lungs, air sacs, trachea and syrinx were analysed. The mean values of heart length, heart width and thoracic cavity in radiographs were, respectively, 23.76 mm, 25.94 mm and 48.87 mm. In both X-rays and CT scans, the lung parenchyma had honeycomb-like pattern. The topographic areas of the anterior and posterior air sacs were visualized as dark and air-filled spaces in X-rays. On CT evaluation, the air sacs occupied a larger area in the coelomic cavity compared to X-ray. In the lateral radiographic view, the cervical part of the trachea was positioned more ventrally in the transition from cervical to thoracic regions showing a V-shaped appearance. In all CT planes was visible division of the trachea into the right and left main bronchi at the level of 3rd thoracic vertebra. The syrinx was difficult to visualize in X-rays, but on CT it was easily identified in axial slice. In conclusion, the normal features of toco toucan's heart and lower respiratory tract that were determined on X-rays and CT scans are useful to compare with sick toco toucans, as well as other bird species.",air sacs; bird; heart; imaging techniques; lung.,Jeana Pereira da Silva;Sheila Canevese Rahal;Maria Cristina Reis Castiglioni;Raphael Augusto Baldissera Gonçalves;Danuta Pulz Doiche;Anneke Moresco;Maria Jaqueline Mamprim;Luiz Carlos Vulcano,chest
https://pubmed.ncbi.nlm.nih.gov/1992712/,Transient postpartum diabetes insipidus,"Diabetes insipidus may first present before, during, or immediately after pregnancy. The characteristics of two unusual cases of transient postpartum diabetes insipidus are described and discussed.",,A Raziel;T Rosenberg;P Schreyer;E Caspi;Y Gilboa,diabetes
https://pubmed.ncbi.nlm.nih.gov/34527736/,The Challenge of Using an Antigen Test as a Screening Tool for SARS-CoV-2 Infection in an Emergency Department: Experience of a Tertiary Care Hospital in Southern Italy,"Background: In emergency hospital settings, rapid diagnosis and isolation of SARS-CoV-2 patients are required. The aim of the study was to evaluate the performance of an antigen chemiluminescence enzymatic immunoassay (CLEIA) and compare it with that of Real-time Reverse transcription-Polymerase Chain Reaction (RT-qPCR), the gold standard assay, to assess its suitability as a rapid diagnostic method for managing patients in the emergency department (ED).",,Daniela Loconsole;Francesca Centrone;Caterina Morcavallo;Silvia Campanella;Anna Sallustio;Daniele Casulli;Marisa Accogli;Maria Chironna,covid-19
https://pubmed.ncbi.nlm.nih.gov/30384958/,Modifications of Callender's Classification of Uveal Melanoma at the Armed Forces Institute of Pathology,One hundred well-documented cases of uveal melanoma accessioned at the Armed Forces Institute of Pathology before 1970 were reviewed and reclassified to identify changes made in the Callender classification. We compared the new classification with the original classification to determine the effect of the changes on the prediction of outcome for the patient after enucleation. Staff pathologists had originally classified 52 of the 100 cases as spindle-cell type melanoma. Only 31 of the 100 cases were reclassified as spindle-cell types (two spindle-cell nevi and 29 spindle-cell melanomas). Tumors classified as mixed-cell type were further subdivided into groups based on the percentage and size of the epithelioid cells. Tumors formerly classified as spindle-cell type that contained small or rare epithelioid cells were reclassified as mixed-cell type. This improved the prediction of outcome for the patient. We found that nucleolar size and pleomorphism are important variables that should be considered in the classification of uveal melanomas.,,Ian W McLean;Walter D Foster;Lorenz E Zimmerman;John W Gamel,melanoma
https://pubmed.ncbi.nlm.nih.gov/12116178/,Wolfram syndrome: identification of a phenotypic and genotypic variant from Jordan,"Wolfram syndrome is an autosomal recessive disorder with probable locus heterogeneity. Only insulin-dependent diabetes mellitus and progressive optic-nerve atrophy are necessary to make the diagnosis, but associated findings include diabetes insipidus, sensorineural hearing loss, ataxia, peripheral neuropathy, urinary-tract atony, and psychiatric illnesses. We performed clinical and molecular studies on four consanguineous families with 16 affected individuals. We point out a new phenotypic variant with absent diabetes insipidus, presence of peptic ulcer disease and bleeding tendency secondary to a platelet aggregation defect. The same phenotypic variant turned out to be a genotypic variant with linkage to a second Wolfram syndrome locus (WFS2) on chromosome 4q22-24.",,Kamel Ajlouni;Nadim Jarrah;Mohammed El-Khateeb;Mohamed El-Zaheri;Hatem El Shanti;Andrew Lidral,diabetes
https://pubmed.ncbi.nlm.nih.gov/8722158/,[Factors affecting the follow up of hypertensive patients],Objectives: To study the factors affecting lack of continuity in hypertense patients' follow-up care and to define these patients' profile.,,T Iruela López;S Juncosa Font,hypertension
https://pubmed.ncbi.nlm.nih.gov/30103615/,Primary Middle Ear Mucosal Melanoma: Case Report and Comprehensive Literature Review of 21 Cases of Primary Middle Ear and Eustachian Tube Melanoma,Objective: To present a case of primary middle ear mucosal melanoma and perform a comprehensive literature review of middle ear and eustachian tube mucosal melanoma.,eustachian tube; head and neck; melanoma; middle ear; mucosal melanoma.,Anne K Maxwell;Hiroki Takeda;Samuel P Gubbels,melanoma
