pmid	title_e	journal
34281045	Telemedicine as a Therapeutic Option in Sports Medicine: Results of a Nationwide Cross-Sectional Study among Physicians and Patients in Germany.	Int J Environ Res Public Health
34281009	Pre-Vaccination COVID-19 Vaccine Literacy in a Croatian Adult Population: A Cross-Sectional Study.	Int J Environ Res Public Health
34280963	A dossier on COVID-19 chronicle.	J Basic Clin Physiol Pharmacol
34280885	A prospective evaluation of lung function at three and six months in patients with previous SARS-COV-2 pneumonia.	Respir Med
34280732	Exploring peptide studies related to SARS-CoV to accelerate the development of novel therapeutic and prophylactic solutions against COVID-19.	J Infect Public Health
34280534	First detection of SARS-CoV-2 A.23.1 sub-lineage in migrants arriving to Italy via the Mediterranean Sea and public health implications.	Travel Med Infect Dis
34280407	Political affiliation and risk taking behaviors among adults with elevated chance of severe complications from COVID-19.	Prev Med
34280405	The role of trust in the likelihood of receiving a COVID-19 vaccine: Results from a national survey.	Prev Med
34280353	Correction: Should Remdesivir Be Used for the Treatment of Patients With COVID-19?	Ann Intern Med
34280346	Transmission of SARS-CoV-2.	Ann Intern Med
34280345	Transmission of SARS-CoV-2.	Ann Intern Med
34280335	Screening for SARS-CoV-2 Antigen Before a Live Indoor Music Concert: An Observational Study.	Ann Intern Med
34280334	To Test or Not to Test: COVID-19 Prevention Strategies to Keep Large Gatherings Safe.	Ann Intern Med
34280332	SARS-CoV-2 Vaccine Effectiveness in a High-Risk National Population in a Real-World Setting.	Ann Intern Med
34280141	Revisiting COVID-19 Communication in Western Africa: A Health Literacy-based Approach to Health Communication.	Am J Trop Med Hyg
34279868	Interventions to Influence the Use of Antibiotics for Acute Upper Respiratory Tract Infections	Interventions to Influence the Use of Antibiotics for Acute Upper Respiratory Tract Infections
34279842	The Worldwide Effort to Develop Vaccines for COVID-19.	Adv Exp Med Biol
34279841	Associastion of In-hospital Use of Statins, Aspirin, and Renin-Angiotensin-Aldosterone Inhibitors with Mortality and ICU Admission Due to COVID-19.	Adv Exp Med Biol
34279840	Curcumin and Piperine in COVID-19: A Promising Duo to the Rescue?	Adv Exp Med Biol
34279839	Cinnamon: A Promising Natural Product Against COVID-19.	Adv Exp Med Biol
34279838	Topical Oral and Intranasal Antiviral Agents for Coronavirus Disease 2019 (COVID-19).	Adv Exp Med Biol
34279837	COVID-19, Coenzyme Q10 and Selenium.	Adv Exp Med Biol
34279836	Using Ozone Therapy as an Option for Treatment of COVID-19 Patients: A Scoping Review.	Adv Exp Med Biol
34279835	Deep Learning Analysis in Prediction of COVID-19 Infection Status Using Chest CT Scan Features.	Adv Exp Med Biol
34279834	How Do We Manage Breastfeeding During the COVID-19 Pandemic?	Adv Exp Med Biol
34279833	Cutaneous Manifestations of COVID-19: Early Diagnosis and Prognostic Information.	Adv Exp Med Biol
34279832	SARS-CoV-2 Infection and the Kidneys: An Evolving Picture.	Adv Exp Med Biol
34279831	Intestinal Microbiota in the SARS-CoV-2 Infection: What Is Known?	Adv Exp Med Biol
34279830	Sex Differences and COVID-19.	Adv Exp Med Biol
34279829	Age-Specific Differences in the Severity of COVID-19 Between Children and Adults: Reality and Reasons.	Adv Exp Med Biol
34279828	The Experiences of Recovered COVID-19 Patients in Baqiyatallah Hospital: A Qualitative Study.	Adv Exp Med Biol
34279827	COVID-19 Pandemic in Brazil: History, Characteristics, and Evolution.	Adv Exp Med Biol
34279826	Prevalence of COVID-19 and the Continued Citizen-Based Control in Japan.	Adv Exp Med Biol
34279825	Genetic Aspects and Immune Responses in Covid-19: Important Organ Involvement.	Adv Exp Med Biol
34279483	Predictive Factors of Pulmonary Embolism in Older Patients with SARS-CoV-2: The OCTA-COVID-19 Study.	J Clin Med
34279458	Delirium Severely Worsens Outcome in Patients with COVID-19-A Retrospective Cohort Study from Temporary Critical Care Hospitals.	J Clin Med
34279453	Efficiency of Prolonged Prone Positioning for Mechanically Ventilated Patients Infected with COVID-19.	J Clin Med
34279449	Chest X-ray Score and Frailty as Predictors of In-Hospital Mortality in Older Adults with COVID-19.	J Clin Med
34279439	Plants and Natural Products with Activity against Various Types of Coronaviruses: A Review with Focus on SARS-CoV-2.	Molecules
34279137	Identification of SARS-CoV-2 on the ocular surface in a cohort of COVID-19 patients from Brazil.	Exp Biol Med (Maywood)
34278917	A thematic analysis of Instagram's gendered memes on COVID-19.	J Vis Commun Med
34278916	'Hawa' and 'resistensiya': local health knowledge and the COVID-19 pandemic in the Philippines.	Anthropol Med
34278694	Autoimmune hepatitis triggered by COVID-19.	Intern Med J
34278693	Telehealth model of care for outpatient inflammatory bowel disease care in the setting of the COVID-19 pandemic.	Intern Med J
34278684	Management of diabetes-related foot disease in the outpatient setting during the COVID-19 pandemic.	Intern Med J
34278682	Supporting cancer care clinicians to 'hold' their patients during and beyond the COVID-19 pandemic: a role for reflective ethics discussions.	Intern Med J
34278356	Incidence of first trimester pregnancy loss in the infertile population during the first wave of the coronavirus disease 2019 pandemic in New York City.	F S Rep
34278290	IgA Nephropathy After SARS-CoV-2 Vaccination.	Kidney Med
34278228	"Commentary: ""Fungal Infections of Oral Cavity: Diagnosis, Management, and Association with COVID-19""."	SN Compr Clin Med
34277997	Managing supraglottitis in the COVID-19 era.	Vis J Emerg Med
34277788	Clinical course and outcomes of COVID-19 patients with a history of cerebrovascular disease: a retrospective study in Wuhan.	Ann Transl Med
34277742	Global, Regional, and National Burden of Myocarditis From 1990 to 2017: A Systematic Analysis Based on the Global Burden of Disease Study 2017.	Front Cardiovasc Med
34277728	COVID-19 and the Digitalisation of Cardiovascular Training and Education-A Review of Guiding Themes for Equitable and Effective Post-graduate Telelearning.	Front Cardiovasc Med
34277698	Indian Ethnomedicinal Phytochemicals as Promising Inhibitors of RNA-Binding Domain of SARS-CoV-2 Nucleocapsid Phosphoprotein: An In Silico Study.	Front Mol Biosci
34277674	Clinical Outcomes of Severe COVID-19 Patients Admitted to an Intermediate Respiratory Care Unit.	Front Med (Lausanne)
34277653	Use of Almitrine and Inhaled Nitric Oxide in ARDS Due to COVID-19.	Front Med (Lausanne)
34277652	Comparison of the Filtration Efficiency of Different Face Masks Against Aerosols.	Front Med (Lausanne)
34277510	State of the art of (18)F-FDG PET/CT application in inflammation and infection: a guide for image acquisition and interpretation.	Clin Transl Imaging
34277330	Who is more likely to ignore experts' advice related to COVID-19?	Prev Med Rep
34277329	Why are some people reluctant to be vaccinated for COVID-19? A cross-sectional survey among U.S. Adults in May-June 2020.	Prev Med Rep
34277170	Patient Adherence to Glaucoma Treatment During the COVID-19 Pandemic.	Cureus
34277143	Evaluating the Educational Impact of Telehealth on Adolescent Medicine Trainees: a Qualitative Approach.	Curr Pediatr Rep
34277014	Simple prognostic factors and change of inflammatory markers in patients with severe coronavirus disease 2019: a single-center observational study.	Acute Med Surg
34276987	Clinical efficacy of Nafamostat Mesylate in combination with Favipiravir for COVID-19 pneumonia treatment review article.	Ann Med Surg (Lond)
34276986	Evaluation of 3 and 2-point internal fixation in the management of zygomaticomaxillary complex fractures: Case report.	Ann Med Surg (Lond)
34276907	BENEFIT AND SAFETY OF INCOBOTULINUMTOXINA FOR EARLY MANAGEMENT OF POST-STROKE SPASTICITY IN A PATIENT WITH SARS-COV-2: A CASE REPORT.	J Rehabil Med Clin Commun
34276260	The Impact of COVID-19 on Drug Use and Harm Reduction Programming in the Middle East and North Africa (MENA) Region: a Regional Consultation of Stakeholders and People Who Use Drugs.	Int J Ment Health Addict
34276233	A Quick Review on the Multisystem Effects of Prone Position in Acute Respiratory Distress Syndrome (ARDS) Including COVID-19.	Clin Med Insights Circ Respir Pulm Med
34276164	Ayurvedic evaluation and treatment of Covid 19: A case report.	J Ayurveda Integr Med
34276163	Standalone Ayurvedic treatment of high-risk COVID-19 patients with multiple co-morbidities: A case series.	J Ayurveda Integr Med
34275981	Posterior Reversible Encephalopathy Syndrome Associated with COVID-19 in a Japanese Patient.	Intern Med
34275978	Efficacy of Chest Radiography as a Primary Care Triage Tool in Severe Coronavirus Disease.	Intern Med
34275594	Impact of COVID-19 on Nuclear Medicine in Asia.	Semin Nucl Med
34275513	Designing and Validation of the Nurses' Preparedness to Response to COVID-19 Questionnaire in Iran.	Disaster Med Public Health Prep
34275263	The impact of physical activity rate on subjective well-being among North-Western Italian population during COVID-19 nationwide lockdown.	J Sports Med Phys Fitness
34275096	High-dose dexamethasone treatment for COVID-19 severe acute respiratory distress syndrome: a retrospective study.	Intern Emerg Med
34274859	Taste alteration in COVID-19: Significant geographical differences exist in the prevalence of the symptom.	J Infect Public Health
34274845	Evaluation of in vitro activity of copper gluconate against SARS-CoV-2 using confocal microscopy-based high content screening.	J Trace Elem Med Biol
34274494	The COVID-19 Outpatient Pragmatic Platform Study (COPPS): Study design of a multi-center pragmatic platform trial.	Contemp Clin Trials
34274212	Young Adult Perspectives on COVID-19 Vaccinations.	J Adolesc Health
34274191	Middle-age Asian male with cerebral venous thrombosis after COVID-19 AstraZeneca vaccination.	Am J Emerg Med
34274190	Lessons Learned From the COVID-19 Response in a Major New York City Hot Zone.	Curr Probl Diagn Radiol
34274035	Protecting the vulnerable: SARS-CoV-2 vaccination in immunosuppressed patients with interstitial lung disease.	Lancet Respir Med
34273962	Residual respiratory impairment after COVID-19 pneumonia.	BMC Pulm Med
34273787	How the COVID-19 Pandemic Affects Sexual Behavior of Hetero-, Homo-, and Bisexual Males in Germany.	Sex Med
34273770	Identification of potential plant bioactive as SARS-CoV-2 Spike protein and human ACE2 fusion inhibitors.	Comput Biol Med
34273733	Effects of surgical and cloth facemasks during a submaximal exercise test in healthy adults.	Respir Med
34273268	COVID-19 hospital admissions: Brazil's first and second waves compared.	Lancet Respir Med
34273267	Recovery after prolonged ICU treatment in patients with COVID-19.	Lancet Respir Med
34273169	Mitigating the Impact of Reemergence From a Pandemic on Healthcare.	Mil Med
34273092	Trends in emergency department use by older people during the COVID-19 pandemic.	Eur Geriatr Med
34273056	Impact of cardiovascular disease on clinical outcomes in hospitalized patients with Covid-19: a systematic review and meta-analysis.	Intern Emerg Med
34272852	Coincidence of fever following COVID-19 vaccine and endemic tropical diseases: a challenge to clinicians during the global rollout of COVID-19 vaccination.	J Travel Med
34272850	International dental tourism in a post-COVID era: pre-travel advice.	J Travel Med
34272755	Traditional medicines for COVID-19: Perspectives from clinical pharmacologists.	Br J Clin Pharmacol
34272500	Understanding COVID-19 vaccine hesitancy.	Nat Med
34272499	COVID-19 vaccine acceptance and hesitancy in low- and middle-income countries.	Nat Med
34272318	Evolution of (18)F-FDG-PET/CT findings in patients following COVID-19 pneumonia: An Initial Investigation.	J Nucl Med
34272272	Protecting olympic participants from COVID-19: the trialled and tested process.	Br J Sports Med
34272137	Public Support for Policies to Increase Housing Stability During the COVID-19 Pandemic.	Am J Prev Med
34272104	The Rapid Evaluation of COVID-19 Vaccination in Emergency Departments for Underserved Patients Study.	Ann Emerg Med
34271231	Patterns of Emergency Department visits for acute and chronic diseases during the two pandemic waves in Italy.	Am J Emerg Med
34271179	Sufficient sleep attenuates COVID-19 pandemic-related executive dysfunction in late adolescents and young adults.	Sleep Med
34270990	Community-Based Primary Care Management of 'Long COVID': A Center of Excellence Model at NYC Health+Hospitals.	Am J Med
34270716	Updates on Lobular Neoplasms, Papillary, Adenomyoepithelial, and Fibroepithelial Lesions of the Breast.	Arch Pathol Lab Med
34270458	The Need for a Practical Approach to Evaluate the Effectiveness of COVID-19 Vaccines for Low- and Middle-Income Countries.	Am J Trop Med Hyg
34270457	Feasibility of Noninvasive Positive Pressure Ventilation in the Treatment of Oxygen-Dependent COVID-19 Patients in Peru.	Am J Trop Med Hyg
34270456	Concurrent COVID-19 and Tuberculosis in an Immigrant Worker Presenting with Hemoptysis.	Am J Trop Med Hyg
34270454	Papular-Vesicular Rash in COVID-19.	Am J Trop Med Hyg
34270451	Long-Term Assessment of the Effects of COVID-19 and Isolation Care on Survivor Disability and Anxiety.	Am J Trop Med Hyg
34270449	COVID-19 Therapeutics for Low- and Middle-Income Countries: A Review of Candidate Agents with Potential for Near-Term Use and Impact.	Am J Trop Med Hyg
34270448	Post-Discharge Symptoms among Hospitalized COVID-19 Patients in Nigeria: A Single-Center Study.	Am J Trop Med Hyg
34269979	The impact of artificial intelligence and digital style on industry and energy post-COVID-19 pandemic.	Environ Sci Pollut Res Int
34269853	Diagnosis and treatment of COVID-19 associated pulmonary apergillosis in critically ill patients: results from a European confederation of medical mycology registry.	Intensive Care Med
34269723	DOTATATE Uptake in an Axillary Lymph Node After COVID-19 Vaccination.	Clin Nucl Med
34269722	Features of Systemic Immune Response From COVID-19 Vaccination on 18F-FDG PET/CT.	Clin Nucl Med
34269719	Ischemic and Hemorrhagic Stroke Among Critically Ill Patients With Coronavirus Disease 2019: An International Multicenter Coronavirus Disease 2019 Critical Care Consortium Study.	Crit Care Med
34269629	A multi-stage SEIR(D) model of the COVID-19 epidemic in Korea.	Ann Med
34269450	Civilian walking blood bank emergency preparedness plan.	Transfusion
34269413	Management of non-COVID respiratory illnesses during the COVID-19 pandemic - a pulmonologist's perspective.	Adv Respir Med
34269410	Enteroclysis in gastrointestinal tuberculosis: an overview.	Adv Respir Med
34269407	Potential benefits and hazards associated with the use of e-cigarettes - a guide for practitioners and current status in Poland.	Adv Respir Med
34269405	Probe-based confocal laser endomicroscopy in COVID-19.	Adv Respir Med
34268819	Self-infection with speech aerosol may contribute to COVID-19 severity.	J Intern Med
34268500	Neurological Manifestations in COVID-19: An Unrecognized Crisis in Our Elderly?	Adv Geriatr Med Res
34268426	Practice of adjunctive treatments in critically ill COVID-19 patients-rational for the multicenter observational PRoAcT-COVID study in The Netherlands.	Ann Transl Med
34268424	Wearing masks to reduce the spread of respiratory viruses: a systematic evidence mapping.	Ann Transl Med
34268322	Widespread Parenchymal Abnormalities and Pulmonary Embolism on Contrast-Enhanced CT Predict Disease Severity and Mortality in Hospitalized COVID-19 Patients.	Front Med (Lausanne)
34268278	Renal Vein Thrombosis and Pulmonary Embolism Secondary to Vaccine-induced Thrombotic Thrombocytopenia (VITT).	Eur J Case Rep Intern Med
34268277	COVID-19 mRNA Vaccine and Myocarditis.	Eur J Case Rep Intern Med
34268264	The Meaning of SARS-CoV-2 Antibodies in a Patient with a Systemic Reaction to the mRNA-1273 SARS-CoV-2 Vaccine after Previous Natural Immunization.	Eur J Case Rep Intern Med
34268263	Development of a Large Pneumatocele in a Patient Recovering from COVID-19 Pneumonitis.	Eur J Case Rep Intern Med
34267844	The Contribution of COVID-19-Forced Transformations in Critical Care Delivery to Patient Mortality: Still an Underexplored Association.	J Clin Med Res
34267839	Review of COVID-19 Variants and COVID-19 Vaccine Efficacy: What the Clinician Should Know?	J Clin Med Res
34267652	Naturally Occurring Bioactives as Antivirals: Emphasis on Coronavirus Infection.	Front Pharmacol
34267581	What Predicts the Mood of Athletes Involved in Preparations for Tokyo 2020/2021 Olympic Games During the Covid - 19 Pandemic? The Role of Sense of Coherence, Hope for Success and Coping Strategies.	J Sports Sci Med
34267561	The Effect of the COVID-19 on Corrosive Ingestion in Thailand.	Open Access Emerg Med
34267560	Perception of an Introductory Point-of-Care Ultrasound Course for Thai Medical Students on Emergency Medicine Rotation.	Open Access Emerg Med
34267545	The Long-Term Impact of COVID-19 Pneumonia on the Pulmonary Function of Survivors.	Int J Gen Med
34267382	Another COVID-19 vaccine to boost rollout.	Nat Med
34267379	Telehealth is here to stay.	Nat Med
34267107	Negative Employment Changes During the COVID-19 Pandemic and Psychological Distress: Evidence From a Nationally Representative Survey in the U.S.	J Occup Environ Med
34267043	How coronavirus disease will change the face of travel medicine.	Curr Opin Infect Dis
34266910	From COVID-19 adversity comes opportunity: teaching an online integrative medicine course.	BMJ Support Palliat Care
34266842	Cohort profile of Acutelines: a large data/biobank of acute and emergency medicine.	BMJ Open
34266715	The Impact of the COVID-19 Pandemic on the Number of Adolescents/Young Adults Seeking Eating Disorder-Related Care.	J Adolesc Health
34266550	[Development of a psychiatric care facility into a Covid unit].	Soins Psychiatr
34266339	Perceived stress in different countries at the beginning of the coronavirus pandemic.	Int J Psychiatry Med
34265658	Thoughts of social distancing experiences affect food intake and hypothetical binge eating: Implications for people in home quarantine during COVID-19.	Soc Sci Med
34265636	Validation of the Japanese version of Stress and Anxiety to Viral Epidemics-9 (SAVE-9) and relationship among stress, insomnia, anxiety, and depression in healthcare workers exposed to coronavirus disease 2019.	Sleep Med
34265436	Efficacy of chloroquine and hydroxychloroquine in treating COVID-19 infection: A meta-review of systematic reviews and an updated meta-analysis.	Travel Med Infect Dis
34265238	Lifting of COVID-19 restrictions in the UK and the Delta variant.	Lancet Respir Med
34265234	The Impact of the COVID-19 Pandemic on Exacerbations and Symptoms in Bronchiectasis: A Prospective Study.	Am J Respir Crit Care Med
34265229	Symptoms, complications and management of long COVID: a review.	J R Soc Med
34265190	Averting Future Vaccine Injustice.	N Engl J Med
34264968	Introducing the 4Ps Model of Transitioning to Distance Learning: A convergent mixed methods study conducted during the COVID-19 pandemic.	PLoS One
34264880	Is severe COVID-19 a cytokine storm syndrome: a hyperinflammatory debate.	Curr Opin Rheumatol
34264852	NASEM REPORT HERALDS PRIMARY CARE EVOLUTION, URGES ACTION.	Ann Fam Med
34264847	FAMILY MEDICINE EDUCATORS AS EXEMPLARS OF MASTER ADAPTIVE LEARNING IN RESPONSE TO THE COVID-19 PANDEMIC.	Ann Fam Med
34264845	Sandwiches, 6 Feet Apart: Reflections on Community (and Medical School) During COVID-19.	Ann Fam Med
34264842	Virtual Care: Choosing the Right Tool, at the Right Time.	Ann Fam Med
34264837	Building an Evidence Base for Integration of Social Care Into Health Care: Our Collective Path Ahead.	Ann Fam Med
34264507	Professional development during a pandemic: a live virtual conference for emergency medicine chief residents.	CJEM
34264250	1,10/1,11-Cyclization catalyzed by diverged plant sesquiterpene synthases is dependent on a single residue.	Org Biomol Chem
34263682	Sleep quality and mental health status of healthcare professionals during the outbreak of coronavirus disease 2019 (COVID-19).	Psychol Health Med
34263658	A call to action: Antiracist patient engagement in adolescent and young adult oncology research and advocacy.	Future Oncol
34263633	Clinical features and survival analysis of 97 coronavirus disease 2019 (COVID-19) patients.	Ann Palliat Med
34263624	A human-computer collaboration for COVID-19 differentiation: combining a radiomics model with deep learning and human auditing.	Ann Palliat Med
34263609	Management of a COVID-19-infected critically ill patient treated by extracorporeal membrane oxygenation: a case report.	Ann Palliat Med
34263023	Laboratory Medicine and Pathology Education During the COVID-19 Pandemic-Lessons Learned.	Acad Pathol
34263019	Ethical Issues in Genetics and Infectious Diseases Research: An Interdisciplinary Expert Review.	Ethics Med Public Health
34262921	Novel Highly Divergent SARS-CoV-2 Lineage With the Spike Substitutions L249S and E484K.	Front Med (Lausanne)
34262919	Case Report: A Rehabilitation Practice Report During ICU Management for a Patient With Multiple Disabilities Due to COVID-19 Pneumonia and COPD.	Front Med (Lausanne)
34262779	Current status of hyperbaric oxygen therapy for COVID-19.	Acute Med Surg
34262766	Weathering the storm: A qualitative study of social prescribing in urban and rural Scotland during the COVID-19 pandemic.	SAGE Open Med
34262763	COVID-19 and dysnatremia: A comparison between COVID-19 and non-COVID-19 respiratory illness.	SAGE Open Med
34262762	Mental health effect of COVID-19 pandemic among women who are pregnant and/or lactating: A systematic review and meta-analysis.	SAGE Open Med
34262332	Value-Added Roles of Medical Students During the COVID-19 Pandemic: Assessment of Medical Students' Perceptions and Willingness in Sri Lanka.	Int J Gen Med
34262158	Immune responses against SARS-CoV-2 variants after heterologous and homologous ChAdOx1 nCoV-19/BNT162b2 vaccination.	Nat Med
34262117	Clinical subphenotypes in COVID-19: derivation, validation, prediction, temporal patterns, and interaction with social determinants of health.	NPJ Digit Med
34261867	Addressing Equity in Global Medical Education During the COVID-19 Pandemic: The Global Medical Education Collaborative.	Acad Med
34261866	Siamit: A Novel Academic-Tribal Health Partnership in Northwest Alaska.	Acad Med
34261763	Impact of the COVID-19 pandemic on emergency medical service response to out-of-hospital cardiac arrests in Taiwan: a retrospective observational study.	Emerg Med J
34261575	Of Lives and Life Years: 1918 Influenza Versus COVID-19.	Disaster Med Public Health Prep
34261572	A Snapshot of Poverty, Diseases and war - the Democratic Republic of the Congo.	Disaster Med Public Health Prep
34261567	General Public Perception of Social Media, Impact of COVID-19 Pandemic, and Related Misconceptions.	Disaster Med Public Health Prep
34261546	Novel Respiratory Viruses in the Context of Mass-Gathering Events: A Systematic Review to Inform Event Planning from a Health Perspective.	Prehosp Disaster Med
34261512	Presentation of a participatory approach to develop preventive measures to reduce COVID-19 transmission in child care.	J Occup Med Toxicol
34261078	In-hospital prognostic role of coronary atherosclerotic burden in COVID-19 patients.	J Cardiovasc Med (Hagerstown)
34260977	Low dose lung radiotherapy for COVID-19 pneumonia: A potential treatment.	Respir Med
34260976	Rapid access rehabilitation after exacerbations of COPD - A qualitative study.	Respir Med
34260850	Heterologous ChAdOx1 nCoV-19 and mRNA-1273 Vaccination.	N Engl J Med
34260849	Bamlanivimab plus Etesevimab in Mild or Moderate Covid-19.	N Engl J Med
34260844	Audio Interview: Monoclonal Antibodies and Vaccine Boosts.	N Engl J Med
34260834	Durable Humoral and Cellular Immune Responses 8 Months after Ad26.COV2.S Vaccination.	N Engl J Med
34260565	The educational and psychological impact of the COVID-19 pandemic on medical students: A descriptive survey at the American University of Beirut.	Medicine (Baltimore)
34260556	Effects of dynamic response to coronavirus disease outbreak in a regional emergency medical center: A retrospective study.	Medicine (Baltimore)
34260531	Corrected QT interval in hospitalized patients with coronavirus disease 2019: Focus on drugs therapy.	Medicine (Baltimore)
34260529	An artificial neural network model to predict the mortality of COVID-19 patients using routine blood samples at the time of hospital admission: Development and validation study.	Medicine (Baltimore)
34260527	Lymphocyte blood levels that remain low can predict the death of patients with COVID-19.	Medicine (Baltimore)
34260192	Calculated decisions: ACEP ED COVID-19 management tool.	Emerg Med Pract
34260159	Individual COVID-19 disease trajectories revealed by plasma proteomics.	EMBO Mol Med
34259874	The COVID-19 Pandemic Introduces Diagnostic and Treatment Planning Complexity for Individuals at Clinical High Risk for Psychosis.	Schizophr Bull
34259764	Association of ABO blood group and age with COVID-19 positive test.	Rev Assoc Med Bras (1992)
34259724	Women and COVID-19: reflections for a sexual and reproductive rights-based obstetric care.	Rev Bras Enferm
34259669	The Role of the Long-Term Acute Care Hospital Following Critical Illness-Has the Coronavirus Disease 2019 Pandemic Demonstrated Their Usefulness or Emphasized Their Downside?	Crit Care Med
34259668	Quantifying the Burden of Viral Sepsis During the Coronavirus Disease 2019 Pandemic and Beyond.	Crit Care Med
34259667	Trends in ICU Mortality From Coronavirus Disease 2019: A Tale of Three Surges.	Crit Care Med
34259665	The Impact of Strict Public Health Restrictions on Pediatric Critical Illness.	Crit Care Med
