pmid	title_e	journal
34688172	A large margin piecewise linear classifier with fusion of deep features in the diagnosis of COVID-19.	Comput Biol Med
34688170	Translational suppression of SARS-COV-2 ORF8 protein mRNA as a Viable therapeutic target against COVID-19: Computational studies on potential roles of isolated compounds from Clerodendrum volubile leaves.	Comput Biol Med
34687733	Symptomology following mRNA vaccination against SARS-CoV-2.	Prev Med
34687656	Long-term immunogenicity of BNT162b2 vaccination in older people and younger health-care workers.	Lancet Respir Med
34687597	Lipase elevation in serum of COVID-19 patients: frequency, extent of increase and clinical value.	Clin Chem Lab Med
34687439	Training During the COVID-19 Lockdown: Knowledge, Beliefs, and Practices of 12,526 Athletes from 142 Countries and Six Continents.	Sports Med
34687386	Correction to: Leveraging knowledge of Asian herbal medicine and its active compounds as COVID-19 treatment and prevention.	J Nat Med
34687139	Vaso-occlusive crisis in a patient with sickle cell trait and COVID-19.	J Cell Mol Med
34687033	[Impact of Covid 19 on endoscopy in Germany].	Z Gastroenterol
34686965	Predictors of Psychological Distress and Resilience in the Post-COVID-19 Era.	Int J Behav Med
34686631	Post-acute COVID-19 Syndrome Negatively Impacts Physical Function, Cognitive Function, Health-Related Quality of Life, and Participation.	Am J Phys Med Rehabil
34686540	Journal update monthly top five.	Emerg Med J
34686444	SARS-Coronavirus-2 seroprevalence in asymptomatic healthy blood donors: Indicator of community spread.	Transfus Apher Sci
34686295	Academic Detailing to Increase Prescribing of HIV Pre-exposure Prophylaxis.	Am J Prev Med
34686291	Georgia Leverages Telehealth to Expand HIV Care Management in Underserved Areas.	Am J Prev Med
34686285	A Pilot of Mail-Out HIV and Sexually Transmitted Infection Testing in Washington, District of Columbia During the COVID-19 Pandemic.	Am J Prev Med
34686281	Syringe Services Programs' Role in Ending the HIV Epidemic in the U.S.: Why We Cannot Do It Without Them.	Am J Prev Med
34686280	Bringing Iowa TelePrEP to Scale: A Qualitative Evaluation.	Am J Prev Med
34686216	Epidemiological and clinical characteristics of patients with suspected COVID-19 admitted in Metro Manila, Philippines.	Trop Med Health
34686214	Correction to: Epidemiological and clinical characteristics of patients with suspected COVID-19 admitted in Metro Manila, Philippines.	Trop Med Health
34686088	An observational cohort study of the performance of the REDS score compared to the SIRS criteria, NEWS2, CURB65, SOFA, MEDS and PIRO scores to risk-stratify emergency department suspected sepsis.	Ann Med
34685505	Evolution of Diploid Progenitor Lung Cell Applications: From Optimized Biotechnological Substrates to Potential Active Pharmaceutical Ingredients in Respiratory Tract Regenerative Medicine.	Cells
34684068	Fatal Association of Mirror and Eisenmenger Syndrome during the COVID-19 Pandemic.	Medicina (Kaunas)
34683878	The Revolving Door of Adenovirus Cell Entry: Not All Pathways Are Equal.	Pharmaceutics
34683178	Treatment and Prognosis of COVID-19 Associated Olfactory and Gustatory Dysfunctions.	J Pers Med
34683156	Dementia Risk among Coronavirus Disease Survivors: A Nationwide Cohort Study in South Korea.	J Pers Med
34683149	Domain-Adaptive Artificial Intelligence-Based Model for Personalized Diagnosis of Trivial Lesions Related to COVID-19 in Chest Computed Tomography Scans.	J Pers Med
34683141	Direct and Indirect Effects of COVID-19 in Frail Elderly: Interventions and Recommendations.	J Pers Med
34683133	Artificial Intelligence and COVID-19 Using Chest CT Scan and Chest X-ray Images: Machine Learning and Deep Learning Approaches for Diagnosis and Treatment.	J Pers Med
34683130	Late Failure of High-Flow Nasal Cannula May Be Associated with High Mortality in COVID-19 Patients: A Multicenter Retrospective Study in the Republic of Korea.	J Pers Med
34683127	Impact of COVID-19 on the Mental Health of Medical Students in Portugal.	J Pers Med
34683115	Biomarkers Associated with Failure of Liberation from Oxygen Therapy in Severe COVID-19: A Pilot Study.	J Pers Med
34683102	Management of COVID-19 Patients in the Emergency Department.	J Pers Med
34683095	Graphical Trajectory Comparison to Identify Errors in Data of COVID-19: A Cross-Country Analysis.	J Pers Med
34683093	Uncertainty, Anxiety and Isolation: Experiencing the COVID-19 Pandemic and Lockdown as a Woman with Polycystic Ovary Syndrome (PCOS).	J Pers Med
34683086	The Impact of the COVID-19 Pandemic on Nursing Care: A Cross-Sectional Survey-Based Study.	J Pers Med
34682920	Effect of Age on Innate and Adaptive Immunity in Hospitalized COVID-19 Patients.	J Clin Med
34682912	The Development of Electronic Health and Artificial Intelligence in Surgery after the SARS-CoV-2 Pandemic-A Scoping Review.	J Clin Med
34682909	Myalgic Encephalomyelitis/Chronic Fatigue Syndrome (ME/CFS): An Overview.	J Clin Med
34682907	Incidence and Practice of Early Prone Positioning in Invasively Ventilated COVID-19 Patients-Insights from the PRoVENT-COVID Observational Study.	J Clin Med
34682879	Gastrointestinal Bleeding in Patients with SARS-CoV-2 Infection Managed by Interventional Radiology.	J Clin Med
34682874	When Conventional Oxygen Therapy Fails-The Effectiveness of High-Flow Nasal Oxygen Therapy in Patients with Respiratory Failure in the Course of COVID-19.	J Clin Med
34682869	Effects of COVID-19 Lockdown on Weight, Body Composition, and Behavior of Children, Adolescents, and Young Adults with Prader-Willi Syndrome.	J Clin Med
34682855	The Effects of Income Level on Susceptibility to COVID-19 and COVID-19 Morbidity/Mortality: A Nationwide Cohort Study in South Korea.	J Clin Med
34682810	COVID-19 Associated Choroidopathy.	J Clin Med
34682805	Early Administration of Bamlanivimab in Combination with Etesevimab Increases the Benefits of COVID-19 Treatment: Real-World Experience from the Liguria Region.	J Clin Med
34682801	Real-Life Impact of Glucocorticoid Treatment in COVID-19 Mortality: A Multicenter Retrospective Study.	J Clin Med
34682776	A Systematic Review on Detraining Effects after Balance and Fall Prevention Interventions.	J Clin Med
34682749	The Effects of Previous Asthma and COPD on the Susceptibility to and Severity of COVID-19: A Nationwide Cohort Study in South Korea.	J Clin Med
34682357	Mental Health during the COVID-19 Crisis in Africa: A Systematic Review and Meta-Analysis.	Int J Environ Res Public Health
34681737	Research Progress in Chinese Herbal Medicines for Treatment of Sepsis: Pharmacological Action, Phytochemistry, and Pharmacokinetics.	Int J Mol Sci
34681279	In Vitro Effect of Taraxacum officinale Leaf Aqueous Extract on the Interaction between ACE2 Cell Surface Receptor and SARS-CoV-2 Spike Protein D614 and Four Mutants.	Pharmaceuticals (Basel)
34681142	The Curious Case of Earthworms and COVID-19.	Biology (Basel)
34680210	Current Technologies for RNA-Directed Liquid Diagnostics.	Cancers (Basel)
34679467	The Use of Saliva as a Biosample in the Light of COVID-19.	Diagnostics (Basel)
34679263	Arq Ajib - a wonder Unani formulation for inhibiting SARS-CoV-2 spike glycoprotein and main protease - an in silico approach.	J Complement Integr Med
34679170	Chest Pain and Fever in a Healthcare Provider During the Global Coronavirus Pandemic.	Mil Med
34679144	EPICENTRE - Delivery of high quality acute medical care without transfer to hospital.	Acute Med
34679140	Thrombotic thrombocytopenia following ChAdOx1 nCov-19 vaccination.	Acute Med
34679139	A case report of extensive cerebral venous sinus thrombosis: a sequela of COVID-19?	Acute Med
34679137	D-dimer levels for Risk Stratification in Patients with Suspected COVID-19 - A Prospective Observational Study.	Acute Med
34679132	The experiences of NHS hospital acute medicine departments in England during the first wave of the COVID-19 pandemic.	Acute Med
34678885	Epidemiological characteristics of COVID-19 clusters in Hainan, China.	Medicine (Baltimore)
34678862	Ocular chemical burn associated with gel type alcohol-based hand sanitizer: A case report.	Medicine (Baltimore)
34678760	Hand Hygiene and Mask-Wearing Practices during COVID-19 among Healthcare Workers: Misinformation as a Predictor.	Am J Trop Med Hyg
34678575	Decreases in out of hospital cardiac arrest (OHCA) outcome metrics persist when known COVID patients are excluded from analysis.	Am J Emerg Med
34678526	A Resident-Led Initiative to Advance Diversity, Equity, Inclusion, and Antiracism in a Pediatrics Residency Program.	Acad Pediatr
34678482	Assessing population-sampling strategies for reducing the COVID-19 incidence.	Comput Biol Med
34678422	Editorial commentary: Long COVID-19: A tangled web of lungs, heart, mind, and gender.	Trends Cardiovasc Med
34678417	Advanced applications of mass spectrometry imaging technology in quality control and safety assessments of traditional Chinese medicines.	J Ethnopharmacol
34678213	Addressing the post-acute sequelae of SARS-CoV-2 infection: a multidisciplinary model of care.	Lancet Respir Med
34678103	Practice Guidelines for the Diagnosis of COVID-19-Associated Pulmonary Aspergillosis in an Intensive Care Setting.	J Intensive Care Med
34678091	Moral Injury and Moral Resilience in Health Care Workers during COVID-19 Pandemic.	J Palliat Med
34678084	Top Trends in Multiomics Research: Evaluation of 52 Published Studies and New Ways of Thinking Terminology and Visual Displays.	OMICS
34677919	Uncomfortable Truths - What Covid-19 Has Revealed about Chronic-Disease Care in America.	N Engl J Med
34677789	Oxygen-ozone treatment and COVID-19: antioxidants targeting endothelia lead the scenery.	Intern Emerg Med
34677731	Eugenol, a Component of Holy Basil (Tulsi) and Common Spice Clove, Inhibits the Interaction Between SARS-CoV-2 Spike S1 and ACE2 to Induce Therapeutic Responses.	J Neuroimmune Pharmacol
34677701	Effectiveness of methylprednisolone therapy in patients with a high-risk common type of COVID-19 pneumonia: a retrospective cohort study.	Clin Exp Med
34677489	Laparoscopy in Gynecologic and Abdominal Surgery in Regional (Spinal, Peridural) Anesthesia, the Utility of the Technique during COVID-19 Pandemic.	Medicines (Basel)
34677488	COVID-19 Infection and Neuropathological Features.	Medicines (Basel)
34677486	Impact of Adiposity and Fat Distribution, Rather Than Obesity, on Antibodies as an Illustration of Weight-Loss-Independent Exercise Benefits.	Medicines (Basel)
34677484	Autoimmune Disorders & COVID-19.	Medicines (Basel)
34677178	The Impact of the COVID-19 Pandemic on Dental Education: An Online Survey of Students' Perceptions and Attitudes.	Dent J (Basel)
34677154	Prediction of diagnosis and prognosis of COVID-19 disease by blood gas parameters using decision trees machine learning model: a retrospective observational study.	Med Gas Res
34677151	Effects of Iranian Polyherbal Syrup (Zufa syrup) on oxygen saturation and clinical symptoms in suspected patients with COVID-19: a triple-blinded, randomized, placebo-controlled trial.	Med Gas Res
34677039	The Knowledge of COVID-19 among Health Care Workers in a Nigerian Urban Community and their Willingness to Manage COVID-19 Patients.	West Afr J Med
34676975	COVID-19 swab in patients with suspected open globe.	Emerg Med Australas
34676792	Support needs and barriers to accessing support: Baseline results of a mixed-methods national survey of people bereaved during the COVID-19 pandemic.	Palliat Med
34676581	Virtual screening of functional foods and dissecting their roles in modulating gene functions to support post COVID-19 complications.	J Food Biochem
34676405	The evolving challenges confronting adults living with HIV in three North African countries during the COVID-19 crisis: a survey-based study.	Trans R Soc Trop Med Hyg
34676370	Lipid nanoparticle formulation of niclosamide (nano NCM) effectively inhibits SARS-CoV-2 replication in vitro.	Precis Nanomed
34676273	Effect of COVID-19 Social Isolation Policies on Rehabilitation After Anterior Cruciate Ligament Reconstruction.	Orthop J Sports Med
34676254	Response: Commentary: Case Report: Hyperbilirubinemia in Gilbert Syndrome Attenuates Covid-19-Induced Metabolic Disturbances.	Front Cardiovasc Med
34676222	The Abnormal Imaging of SARS-CoV-2: A Predictive Measure of Disease Severity.	Front Med (Lausanne)
34676221	Clinical Characteristics of Cancer Patients With COVID-19: A Retrospective Multicentric Study in 19 Hospitals Within Hubei, China.	Front Med (Lausanne)
34676081	Challenges for China's medical education in the coming post-COVID-19 era.	Natl Sci Rev
34676075	Predictors of hospital mortality among patients with COVID-19 in Tehran, Iran.	SAGE Open Med
34676000	Effectiveness of COVID-19 vaccines and their challenges (Review).	Exp Ther Med
34675742	Improving Medical Education in Hematology and Transfusion Medicine in Canada: Standards and Limitations.	Adv Med Educ Pract
34675627	Construction and Investigation of Competing Endogenous RNA Networks and Candidate Genes Involved in SARS-CoV-2 Infection.	Int J Gen Med
34675435	Global increase in depression and anxiety.	Nat Med
34675180	[Contribution of the occupational health to the COVID-19 pandemic control.]	Rev Esp Salud Publica
34675171	[Influenza vaccination in medical and nursing students in the Covid-19 era: how to improve it?]	Rev Esp Salud Publica
34675129	Mental health among UK university staff and postgraduate students in the early stages of the COVID-19 pandemic.	Occup Environ Med
34675111	Imaging in Post-COVID Lung Disease (PCLD): does [(18)F]-FDG-PET/CT have the Key?	J Nucl Med
34674787	Pilot Testing of Simulation in the Evaluation of a Novel, Rapidly Deployable Electronic Health Record for use in Disaster Intensive Care.	Disaster Med Public Health Prep
34674772	Tuberculosis amidst COVID-19 pandemic in India: unspoken challenges and the way forward.	Trop Med Health
34674735	Correction to: Tocilizumab for patients with COVID-19 pneumonia. The single-arm TOCIVID-19 prospective trial.	J Transl Med
34674519	Adverse outcomes in patients with heart failure admitted for COVID-19 in association with renin-angiotensin-aldosterone system inhibitors.	Pol Arch Intern Med
34674416	Value of hypocalcemia and thromboinflammatory biomarkers for prediction of COVID-19 severity during the second wave: were all the waves the same?	Clin Chem Lab Med
34674408	The pandemic silver lining: preparing osteopathic learners to address healthcare needs using telehealth.	J Osteopath Med
